interviewer_emotions,interviewer_emotion_score,interviewer_thoughts,interviewer_response,interviewee_response,reward,conversation_history
,50,,"Hello there! Thanks for joining us today. I'm looking forward to discussing your experience in product management. As we go through this conversation, I'll be focusing on various aspects of the product lifecycle.

Let's start by talking about market positioning. Could you share an example of how you've positioned a product in the market and what factors you considered in that process?

*thoughts: Starting with an open-ended question to gauge their overall understanding of positioning. Looking for references to target audience, value proposition, and differentiation.*

*emotions: Curious and open-minded, ready to learn about their experience.*","Hi there! Thanks so much for having me today. I'm really excited to discuss my product management experience with you.

Regarding market positioning, at my most recent role at TechMind AI, I led the positioning strategy for our natural language processing tool designed for customer service teams. The key factors I considered were:

First, I conducted extensive user research to deeply understand our target audience - mid-sized B2B companies struggling with customer service efficiency. By spending time with potential users and stakeholders, I discovered they valued accuracy and integration capabilities over just speed.

Second, I analyzed competitive offerings to identify our unique value proposition. While most competitors focused on general AI assistants, we positioned our product as a specialized solution that reduced ticket resolution time by 40% specifically for technical support teams.

Third, I collaborated closely with our marketing team to craft messaging that resonated with our audience's pain points. We emphasized how our tool could help teams ""solve complex technical issues in half the time"" rather than just generic efficiency claims.

The positioning worked well - we achieved 30% higher conversion rates compared to our previous approach. That said, I learned that positioning isn't a one-time exercise. We continuously refined our messaging based on customer feedback and changing market conditions, which I believe is essential for any effective product strategy.",0,[]
"I'm feeling very engaged and impressed by this response. The candidate provided a structured, detailed example with clear outcomes and learnings. Their approach shows thoughtfulness about user research, competitive analysis, and cross-functional collaboration. I'm particularly pleased they mentioned measuring results and the iterative nature of positioning. I'm optimistic about where this conversation is heading and curious to hear more about their experiences.",85,"[assessment]Strong start with this candidate. They provided a comprehensive, well-structured example of product positioning with clear methodology: user research, competitive analysis, and collaborative messaging development. They included specific metrics (40% reduction in ticket time, 30% higher conversion) and demonstrated strategic thinking by noting the iterative nature of positioning. Their answer shows a good balance of strategic and tactical skills. I'm seeing solid product management fundamentals so far.","

Thank you for sharing that detailed example. I appreciate how you connected your positioning work to measurable outcomes like conversion rates. That's very insightful.

Let's move on to competitive analysis. Could you walk me through your approach to analyzing competitors for a product? Perhaps share an example of how competitive insights influenced your product decisions?","I'm glad you found the positioning example valuable!

When it comes to competitive analysis, I've developed a structured approach that combines both quantitative and qualitative methods. At my previous company, DataSense AI, we were developing a data visualization platform for business intelligence.

My approach started with creating a competitive landscape map. I identified both direct competitors (other AI-powered data visualization tools) and indirect competitors (traditional BI solutions). I analyzed them across multiple dimensions: feature sets, pricing models, target segments, and user experience.

For the qualitative side, I conducted user interviews with customers who had switched from competitors to understand their pain points. I also regularly used competitors' products myself to experience their workflows firsthand. Our sales team provided invaluable insights about what prospects were comparing us against during their decision process.

One significant product decision influenced by this analysis was prioritizing our API development. I discovered through customer interviews that while competitors offered more visualization types, users were frustrated by their closed ecosystems. We shifted our roadmap to prioritize an open API and developer tools, which became our key differentiator.

This decision paid off when enterprise customers began building custom integrations with their existing workflows - something they couldn't do with competitor products. It led to a 25% increase in enterprise adoption and significantly improved our retention metrics.

I believe competitive analysis should be ongoing rather than a one-time exercise. Markets evolve quickly, especially in AI, so",35,"[{""interviewer_response"": ""Interviewer: \n\nThank you for sharing that detailed example. I appreciate how you connected your positioning work to measurable outcomes like conversion rates. That's very insightful.\n\nLet's move on to competitive analysis. Could you walk me through your approach to analyzing competitors for a product? Perhaps share an example of how competitive insights influenced your product decisions?."", ""interviewee_response"": ""You answered: I'm glad you found the positioning example valuable!\n\nWhen it comes to competitive analysis, I've developed a structured approach that combines both quantitative and qualitative methods. At my previous company, DataSense AI, we were developing a data visualization platform for business intelligence.\n\nMy approach started with creating a competitive landscape map. I identified both direct competitors (other AI-powered data visualization tools) and indirect competitors (traditional BI solutions). I analyzed them across multiple dimensions: feature sets, pricing models, target segments, and user experience.\n\nFor the qualitative side, I conducted user interviews with customers who had switched from competitors to understand their pain points. I also regularly used competitors' products myself to experience their workflows firsthand. Our sales team provided invaluable insights about what prospects were comparing us against during their decision process.\n\nOne significant product decision influenced by this analysis was prioritizing our API development. I discovered through customer interviews that while competitors offered more visualization types, users were frustrated by their closed ecosystems. We shifted our roadmap to prioritize an open API and developer tools, which became our key differentiator.\n\nThis decision paid off when enterprise customers began building custom integrations with their existing workflows - something they couldn't do with competitor products. It led to a 25% increase in enterprise adoption and significantly improved our retention metrics.\n\nI believe competitive analysis should be ongoing rather than a one-time exercise. Markets evolve quickly, especially in AI, so.""}]"
I'm feeling impressed and increasingly confident about this candidate. Their systematic approach to competitive analysis shows strategic thinking and thoroughness. I appreciate how they connected competitive insights directly to product decisions and business outcomes. Their mention of both quantitative and qualitative methods demonstrates a well-rounded perspective. I'm particularly drawn to how they identified a unique market opportunity through customer pain points rather than just feature-matching. I'm definitely warming up to this candidate and eager to explore more of their product management experience.,85,"[assessment]Solid, detailed response showing a mature approach to competitive analysis. They demonstrated a systematic process combining multiple data sources (customer interviews, sales insights, hands-on testing) and thinking beyond just feature comparisons. I'm impressed they identified a strategic opportunity (API development) based on customer pain points rather than just playing feature catch-up. They supported their decision with concrete metrics (25% increase in enterprise adoption) and showed strategic thinking by emphasizing ongoing analysis instead of one-time exercises. This candidate appears to be methodical, customer-focused, and results-oriented - all excellent qualities for a product manager.","

You make an excellent point about competitive analysis being an ongoing process rather than a one-time exercise. I completely agree, especially in fast-moving markets.

Let's talk about TAM calculation now. Could you explain how you've approached calculating Total Addressable Market for a product, and how you've used that information to guide your product strategy?","Thank you for that great question about TAM calculation.

In my experience, calculating Total Addressable Market has been crucial for setting realistic growth expectations and guiding product strategy. At TechMind AI, when we were developing our NLP tool for customer service teams, I approached TAM calculation through multiple angles to ensure accuracy.

I started with a top-down analysis, looking at industry reports showing the total number of mid-sized B2B companies across our target markets, then calculating what percentage utilized customer service software. By estimating average annual spend on such tools and our potential capture rate, we established our initial TAM.

I complemented this with a bottom-up approach, where I worked with our sales team to define our ideal customer profile, average contract value, and potential penetration within specific industries. This gave us a more grounded view of immediately addressable opportunities.

The TAM analysis significantly influenced our product strategy in several ways. First, it helped us prioritize feature development toward segments with the highest potential value. When we discovered that the technical support segment within SaaS companies represented a particularly valuable pocket of our TAM, we focused our initial product capabilities on solving their specific pain points.

Second, it guided our go-to-market strategy. The TAM analysis revealed that certain industries had higher willingness to pay but smaller total size, while others offered larger volume but at lower price points. This informed our tiered pricing model an",0,"[{""interviewer_response"": ""Interviewer: \n\nThank you for sharing that detailed example. I appreciate how you connected your positioning work to measurable outcomes like conversion rates. That's very insightful.\n\nLet's move on to competitive analysis. Could you walk me through your approach to analyzing competitors for a product? Perhaps share an example of how competitive insights influenced your product decisions?."", ""interviewee_response"": ""You answered: I'm glad you found the positioning example valuable!\n\nWhen it comes to competitive analysis, I've developed a structured approach that combines both quantitative and qualitative methods. At my previous company, DataSense AI, we were developing a data visualization platform for business intelligence.\n\nMy approach started with creating a competitive landscape map. I identified both direct competitors (other AI-powered data visualization tools) and indirect competitors (traditional BI solutions). I analyzed them across multiple dimensions: feature sets, pricing models, target segments, and user experience.\n\nFor the qualitative side, I conducted user interviews with customers who had switched from competitors to understand their pain points. I also regularly used competitors' products myself to experience their workflows firsthand. Our sales team provided invaluable insights about what prospects were comparing us against during their decision process.\n\nOne significant product decision influenced by this analysis was prioritizing our API development. I discovered through customer interviews that while competitors offered more visualization types, users were frustrated by their closed ecosystems. We shifted our roadmap to prioritize an open API and developer tools, which became our key differentiator.\n\nThis decision paid off when enterprise customers began building custom integrations with their existing workflows - something they couldn't do with competitor products. It led to a 25% increase in enterprise adoption and significantly improved our retention metrics.\n\nI believe competitive analysis should be ongoing rather than a one-time exercise. Markets evolve quickly, especially in AI, so.""}, {""interviewer_response"": ""Interviewer: \n\nYou make an excellent point about competitive analysis being an ongoing process rather than a one-time exercise. I completely agree, especially in fast-moving markets.\n\nLet's talk about TAM calculation now. Could you explain how you've approached calculating Total Addressable Market for a product, and how you've used that information to guide your product strategy?."", ""interviewee_response"": ""You answered: Thank you for that great question about TAM calculation.\n\nIn my experience, calculating Total Addressable Market has been crucial for setting realistic growth expectations and guiding product strategy. At TechMind AI, when we were developing our NLP tool for customer service teams, I approached TAM calculation through multiple angles to ensure accuracy.\n\nI started with a top-down analysis, looking at industry reports showing the total number of mid-sized B2B companies across our target markets, then calculating what percentage utilized customer service software. By estimating average annual spend on such tools and our potential capture rate, we established our initial TAM.\n\nI complemented this with a bottom-up approach, where I worked with our sales team to define our ideal customer profile, average contract value, and potential penetration within specific industries. This gave us a more grounded view of immediately addressable opportunities.\n\nThe TAM analysis significantly influenced our product strategy in several ways. First, it helped us prioritize feature development toward segments with the highest potential value. When we discovered that the technical support segment within SaaS companies represented a particularly valuable pocket of our TAM, we focused our initial product capabilities on solving their specific pain points.\n\nSecond, it guided our go-to-market strategy. The TAM analysis revealed that certain industries had higher willingness to pay but smaller total size, while others offered larger volume but at lower price points. This informed our tiered pricing model an.""}]"
I'm feeling genuinely impressed with this candidate's methodical approach to TAM calculation. Their ability to blend top-down and bottom-up methodologies shows sophistication in their thinking. I appreciate how they've directly connected market analysis to tangible product decisions. The way they articulated using TAM to influence both feature prioritization and go-to-market strategy demonstrates strategic product thinking. I'm developing a very positive impression and feeling increasingly confident this candidate has strong fundamentals across multiple product management disciplines.,85,"[assessment]Another strong answer showing sophisticated product management thinking. The candidate demonstrates clear methodology in TAM calculation using both top-down and bottom-up approaches, which shows thoroughness and business acumen. They effectively connected market sizing directly to product strategy decisions, showing how they prioritized features for specific segments based on TAM findings. Their mention of using TAM to inform pricing strategy further demonstrates commercial thinking. The answer was cut off mid-sentence, but had already shown depth of understanding. So far, this candidate is consistently demonstrating structured thinking, data-driven decision making, and strategic product management capabilities across multiple domains.","



I see your answer got cut off, but you've already provided excellent insights into your TAM approach. I appreciate how you used both top-down and bottom-up methodologies and then directly applied those insights to product decisions.

Let's shift gears to discuss MRD and PRD creation. Could you walk me through your process for developing these documents? I'm particularly interested in how you gather requirements and translate them into actionable specifications for your team.","Thanks for that great question about MRD and PRD development.

My approach to creating these crucial documents focuses on collaboration and clarity. At DataSense AI, I developed a process that ensured we built products that truly addressed market needs while providing clear direction for our engineering team.

For Market Requirements Documents (MRDs), I start by synthesizing insights from multiple sources: customer interviews, support tickets, sales feedback, and market research. I believe in speaking directly with users whenever possible - at TechMind AI, I instituted regular customer advisory sessions where I could hear pain points firsthand. These qualitative insights are complemented by quantitative data from usage analytics and market trends.

Once I have a comprehensive understanding of market needs, I draft the MRD outlining the market opportunity, target personas, use cases, and success metrics. I then validate this document with stakeholders, including sales, customer success, and executive leadership to ensure alignment.

For Product Requirements Documents (PRDs), I translate market requirements into detailed technical specifications. I work closely with engineering leads to understand technical constraints and possibilities. My PRDs typically include user stories, detailed feature specifications, acceptance criteria, and UI mockups or wireframes.

What I've found most effective is developing these documents iteratively. At TechMind, I would create a preliminary PRD, review it with engineering, refine based on their input, then create a final version. This collaborative approach",0,"[{""interviewer_response"": ""Interviewer: \n\nThank you for sharing that detailed example. I appreciate how you connected your positioning work to measurable outcomes like conversion rates. That's very insightful.\n\nLet's move on to competitive analysis. Could you walk me through your approach to analyzing competitors for a product? Perhaps share an example of how competitive insights influenced your product decisions?."", ""interviewee_response"": ""You answered: I'm glad you found the positioning example valuable!\n\nWhen it comes to competitive analysis, I've developed a structured approach that combines both quantitative and qualitative methods. At my previous company, DataSense AI, we were developing a data visualization platform for business intelligence.\n\nMy approach started with creating a competitive landscape map. I identified both direct competitors (other AI-powered data visualization tools) and indirect competitors (traditional BI solutions). I analyzed them across multiple dimensions: feature sets, pricing models, target segments, and user experience.\n\nFor the qualitative side, I conducted user interviews with customers who had switched from competitors to understand their pain points. I also regularly used competitors' products myself to experience their workflows firsthand. Our sales team provided invaluable insights about what prospects were comparing us against during their decision process.\n\nOne significant product decision influenced by this analysis was prioritizing our API development. I discovered through customer interviews that while competitors offered more visualization types, users were frustrated by their closed ecosystems. We shifted our roadmap to prioritize an open API and developer tools, which became our key differentiator.\n\nThis decision paid off when enterprise customers began building custom integrations with their existing workflows - something they couldn't do with competitor products. It led to a 25% increase in enterprise adoption and significantly improved our retention metrics.\n\nI believe competitive analysis should be ongoing rather than a one-time exercise. Markets evolve quickly, especially in AI, so.""}, {""interviewer_response"": ""Interviewer: \n\nYou make an excellent point about competitive analysis being an ongoing process rather than a one-time exercise. I completely agree, especially in fast-moving markets.\n\nLet's talk about TAM calculation now. Could you explain how you've approached calculating Total Addressable Market for a product, and how you've used that information to guide your product strategy?."", ""interviewee_response"": ""You answered: Thank you for that great question about TAM calculation.\n\nIn my experience, calculating Total Addressable Market has been crucial for setting realistic growth expectations and guiding product strategy. At TechMind AI, when we were developing our NLP tool for customer service teams, I approached TAM calculation through multiple angles to ensure accuracy.\n\nI started with a top-down analysis, looking at industry reports showing the total number of mid-sized B2B companies across our target markets, then calculating what percentage utilized customer service software. By estimating average annual spend on such tools and our potential capture rate, we established our initial TAM.\n\nI complemented this with a bottom-up approach, where I worked with our sales team to define our ideal customer profile, average contract value, and potential penetration within specific industries. This gave us a more grounded view of immediately addressable opportunities.\n\nThe TAM analysis significantly influenced our product strategy in several ways. First, it helped us prioritize feature development toward segments with the highest potential value. When we discovered that the technical support segment within SaaS companies represented a particularly valuable pocket of our TAM, we focused our initial product capabilities on solving their specific pain points.\n\nSecond, it guided our go-to-market strategy. The TAM analysis revealed that certain industries had higher willingness to pay but smaller total size, while others offered larger volume but at lower price points. This informed our tiered pricing model an.""}, {""interviewer_response"": ""Interviewer: \n\n\n\nI see your answer got cut off, but you've already provided excellent insights into your TAM approach. I appreciate how you used both top-down and bottom-up methodologies and then directly applied those insights to product decisions.\n\nLet's shift gears to discuss MRD and PRD creation. Could you walk me through your process for developing these documents? I'm particularly interested in how you gather requirements and translate them into actionable specifications for your team.."", ""interviewee_response"": ""You answered: Thanks for that great question about MRD and PRD development.\n\nMy approach to creating these crucial documents focuses on collaboration and clarity. At DataSense AI, I developed a process that ensured we built products that truly addressed market needs while providing clear direction for our engineering team.\n\nFor Market Requirements Documents (MRDs), I start by synthesizing insights from multiple sources: customer interviews, support tickets, sales feedback, and market research. I believe in speaking directly with users whenever possible - at TechMind AI, I instituted regular customer advisory sessions where I could hear pain points firsthand. These qualitative insights are complemented by quantitative data from usage analytics and market trends.\n\nOnce I have a comprehensive understanding of market needs, I draft the MRD outlining the market opportunity, target personas, use cases, and success metrics. I then validate this document with stakeholders, including sales, customer success, and executive leadership to ensure alignment.\n\nFor Product Requirements Documents (PRDs), I translate market requirements into detailed technical specifications. I work closely with engineering leads to understand technical constraints and possibilities. My PRDs typically include user stories, detailed feature specifications, acceptance criteria, and UI mockups or wireframes.\n\nWhat I've found most effective is developing these documents iteratively. At TechMind, I would create a preliminary PRD, review it with engineering, refine based on their input, then create a final version. This collaborative approach.""}]"
