interviewer_emotions,interviewer_emotion_score,interviewer_thoughts,interviewer_response,interviewee_response,reward,conversation_history
"I'm feeling very impressed and confident about this candidate. Their approach to product launches is comprehensive and well-structured. I appreciate how they've demonstrated clear cross-functional leadership skills by coordinating multiple teams with a single source of truth document. Their mention of both short-term and long-term success metrics shows mature thinking about product impact. They've consistently provided thoughtful, detailed responses throughout our conversation that demonstrate both strategic thinking and practical execution skills. I'm genuinely excited about their potential as a product leader.",85,"[assessment]This candidate continues to show strong product management expertise across all domains we've discussed. Their launch approach demonstrates excellent cross-functional leadership and organization, with a comprehensive plan that includes all relevant teams. They've shown they understand the importance of clear ownership and communication during critical launches. I like their balanced approach to success metrics, considering both immediate indicators and longer-term business impact. Though we had another cut-off answer, their consistent pattern of structured, detailed responses with specific examples from their experience gives me confidence they have both the methodological rigor and practical experience needed for successful product management. Overall, this candidate has impressed throughout the interview with their thoughtfulness, structure, and practical experience.","



Your approach to product launches is very comprehensive. I like how you establish both short and long-term metrics to gauge success, and your focus on cross-functional collaboration shows good leadership skills.

Let's cover our final area - maintenance and end-of-life cycles. Could you share your approach to product maintenance after launch, and how you make and execute decisions around sunsetting features or products that are no longer serving business needs?","Thank you for the question about product maintenance and end-of-life cyclesthis is actually a critical aspect of product management that sometimes gets less attention than launches and new features.

For post-launch maintenance, I implement a structured monitoring system. At TechMind, I established a quarterly product health review where we analyzed user engagement metrics, support tickets, and customer feedback to identify areas needing improvement. This proactive approach helped us catch issues before they became significant problems.

I believe in continuous iteration even after launch. At DataSense AI, we implemented a 30-60-90 day check-in process after major releases, where we specifically looked at adoption rates and gathered qualitative feedback. This allowed us to make quick adjustments to features that weren't performing as expected.

Regarding end-of-life decisions, I approach these with both empathy and analytical rigor. At TechMind, we had to sunset a sentiment analysis feature that was being used by approximately 15% of our users but required disproportionate engineering resources to maintain. I approached this by:

1. Conducting a thorough impact analysis, working with data analysts to understand exactly which customers used the feature and how critical it was to their workflows.

2. Creating a clear communication plan with our customer success team, giving users 90 days' notice and offering alternatives.

3. Personally reaching out to our highest-value customers who used the",0,"[{""interviewer_response"": ""Interviewer: \n\nThank you for sharing that detailed example. I appreciate how you connected your positioning work to measurable outcomes like conversion rates. That's very insightful.\n\nLet's move on to competitive analysis. Could you walk me through your approach to analyzing competitors for a product? Perhaps share an example of how competitive insights influenced your product decisions?."", ""interviewee_response"": ""You answered: I'm glad you found the positioning example valuable!\n\nWhen it comes to competitive analysis, I've developed a structured approach that combines both quantitative and qualitative methods. At my previous company, DataSense AI, we were developing a data visualization platform for business intelligence.\n\nMy approach started with creating a competitive landscape map. I identified both direct competitors (other AI-powered data visualization tools) and indirect competitors (traditional BI solutions). I analyzed them across multiple dimensions: feature sets, pricing models, target segments, and user experience.\n\nFor the qualitative side, I conducted user interviews with customers who had switched from competitors to understand their pain points. I also regularly used competitors' products myself to experience their workflows firsthand. Our sales team provided invaluable insights about what prospects were comparing us against during their decision process.\n\nOne significant product decision influenced by this analysis was prioritizing our API development. I discovered through customer interviews that while competitors offered more visualization types, users were frustrated by their closed ecosystems. We shifted our roadmap to prioritize an open API and developer tools, which became our key differentiator.\n\nThis decision paid off when enterprise customers began building custom integrations with their existing workflows - something they couldn't do with competitor products. It led to a 25% increase in enterprise adoption and significantly improved our retention metrics.\n\nI believe competitive analysis should be ongoing rather than a one-time exercise. Markets evolve quickly, especially in AI, so.""}, {""interviewer_response"": ""Interviewer: \n\nYou make an excellent point about competitive analysis being an ongoing process rather than a one-time exercise. I completely agree, especially in fast-moving markets.\n\nLet's talk about TAM calculation now. Could you explain how you've approached calculating Total Addressable Market for a product, and how you've used that information to guide your product strategy?."", ""interviewee_response"": ""You answered: Thank you for that great question about TAM calculation.\n\nIn my experience, calculating Total Addressable Market has been crucial for setting realistic growth expectations and guiding product strategy. At TechMind AI, when we were developing our NLP tool for customer service teams, I approached TAM calculation through multiple angles to ensure accuracy.\n\nI started with a top-down analysis, looking at industry reports showing the total number of mid-sized B2B companies across our target markets, then calculating what percentage utilized customer service software. By estimating average annual spend on such tools and our potential capture rate, we established our initial TAM.\n\nI complemented this with a bottom-up approach, where I worked with our sales team to define our ideal customer profile, average contract value, and potential penetration within specific industries. This gave us a more grounded view of immediately addressable opportunities.\n\nThe TAM analysis significantly influenced our product strategy in several ways. First, it helped us prioritize feature development toward segments with the highest potential value. When we discovered that the technical support segment within SaaS companies represented a particularly valuable pocket of our TAM, we focused our initial product capabilities on solving their specific pain points.\n\nSecond, it guided our go-to-market strategy. The TAM analysis revealed that certain industries had higher willingness to pay but smaller total size, while others offered larger volume but at lower price points. This informed our tiered pricing model an.""}, {""interviewer_response"": ""Interviewer: \n\n\n\nI see your answer got cut off, but you've already provided excellent insights into your TAM approach. I appreciate how you used both top-down and bottom-up methodologies and then directly applied those insights to product decisions.\n\nLet's shift gears to discuss MRD and PRD creation. Could you walk me through your process for developing these documents? I'm particularly interested in how you gather requirements and translate them into actionable specifications for your team.."", ""interviewee_response"": ""You answered: Thanks for that great question about MRD and PRD development.\n\nMy approach to creating these crucial documents focuses on collaboration and clarity. At DataSense AI, I developed a process that ensured we built products that truly addressed market needs while providing clear direction for our engineering team.\n\nFor Market Requirements Documents (MRDs), I start by synthesizing insights from multiple sources: customer interviews, support tickets, sales feedback, and market research. I believe in speaking directly with users whenever possible - at TechMind AI, I instituted regular customer advisory sessions where I could hear pain points firsthand. These qualitative insights are complemented by quantitative data from usage analytics and market trends.\n\nOnce I have a comprehensive understanding of market needs, I draft the MRD outlining the market opportunity, target personas, use cases, and success metrics. I then validate this document with stakeholders, including sales, customer success, and executive leadership to ensure alignment.\n\nFor Product Requirements Documents (PRDs), I translate market requirements into detailed technical specifications. I work closely with engineering leads to understand technical constraints and possibilities. My PRDs typically include user stories, detailed feature specifications, acceptance criteria, and UI mockups or wireframes.\n\nWhat I've found most effective is developing these documents iteratively. At TechMind, I would create a preliminary PRD, review it with engineering, refine based on their input, then create a final version. This collaborative approach.""}, {""interviewer_response"": ""Interviewer: \n\n\n\nI see we got cut off again, but you've provided an excellent overview of your approach to documentation. I appreciate how you emphasized collaboration with both business stakeholders and engineering teams - that's crucial for effective product development.\n\nLet's talk about your experience working with engineering teams. Could you describe how you prioritize feature development, manage technical debt, and ensure smooth communication between product and engineering throughout the development process?."", ""interviewee_response"": ""You answered: I appreciate you bringing up engineering collaboration - it's one of the aspects of product management I'm most passionate about.\n\nMy approach to prioritization starts with a clear framework that balances customer impact, strategic alignment, and technical feasibility. At DataSense AI, I implemented a modified RICE scoring system (Reach, Impact, Confidence, Effort) but added a \""Strategic Alignment\"" dimension to ensure we weren't just chasing tactical wins.\n\nFor prioritization sessions, I believe in transparency. I hold quarterly roadmap planning workshops where I bring together engineering leads and key stakeholders. Rather than presenting a predetermined roadmap, I share the prioritization criteria and customer data, then facilitate collaborative decision-making. This approach helped us achieve stronger buy-in on difficult trade-offs.\n\nRegarding technical debt, I've learned its importance through experience. At TechMind, we initially moved too fast and accumulated significant technical debt in our NLP processing pipeline. This eventually slowed down feature development dramatically. From that experience, I now advocate for allocating 20-30% of each sprint to technical debt reduction and proactively discuss with engineering leads which areas need refactoring.\n\nFor day-to-day communication, I maintain several practices that have proven effective. I hold brief daily check-ins with the engineering team, maintain comprehensive documentation in our wiki, and ensure requirements are clearly documented with acceptance criteria. I also make myself highly available to.""}, {""interviewer_response"": ""Interviewer: \n\n\n\n\nYour approach to engineering collaboration sounds very thoughtful. I particularly like how you've learned from past experiences with technical debt and now proactively address it. That kind of learning and adaptation is valuable.\n\nLet's move on to discuss pre-launch and launch activities. Could you walk me through how you prepare for and execute a product launch? What teams do you collaborate with, and how do you measure launch success?."", ""interviewee_response"": ""You answered: I'm glad you appreciate the engineering collaboration approach! Product launches are critical moments that require careful orchestration across multiple teams.\n\nFor pre-launch activities, I follow a structured process that begins 2-3 months before launch. At TechMind, I created a comprehensive launch plan template that included key milestones, responsibilities, and success metrics. This became our single source of truth throughout the process.\n\nCross-functional collaboration is essential for a successful launch. I typically work closely with:\n- Marketing: Developing messaging, preparing materials, and planning promotional activities\n- Sales: Creating enablement materials and training the team on new features\n- Customer Success: Preparing for user onboarding and addressing potential support issues\n- Engineering: Finalizing feature development and ensuring technical readiness\n- QA: Conducting thorough testing across different use cases\n\nAt DataSense, before launching our API platform, I organized weekly launch readiness meetings with representatives from each team. These meetings helped identify potential issues early and ensured everyone was aligned on timelines and responsibilities.\n\nFor measuring launch success, I establish both short-term and long-term metrics. Short-term metrics might include user adoption rates, feature engagement, and initial feedback. Long-term metrics focus on business impact such as revenue generation, retention improvements, or efficiency gains.\n\nAfter our visualization platform launch at DataSense, I conducted a retrospective with all teams involved to discuss what went.""}, {""interviewer_response"": ""Interviewer: \n\n\n\nYour approach to product launches is very comprehensive. I like how you establish both short and long-term metrics to gauge success, and your focus on cross-functional collaboration shows good leadership skills.\n\nLet's cover our final area - maintenance and end-of-life cycles. Could you share your approach to product maintenance after launch, and how you make and execute decisions around sunsetting features or products that are no longer serving business needs?."", ""interviewee_response"": ""You answered: Thank you for the question about product maintenance and end-of-life cycles\u2014this is actually a critical aspect of product management that sometimes gets less attention than launches and new features.\n\nFor post-launch maintenance, I implement a structured monitoring system. At TechMind, I established a quarterly product health review where we analyzed user engagement metrics, support tickets, and customer feedback to identify areas needing improvement. This proactive approach helped us catch issues before they became significant problems.\n\nI believe in continuous iteration even after launch. At DataSense AI, we implemented a 30-60-90 day check-in process after major releases, where we specifically looked at adoption rates and gathered qualitative feedback. This allowed us to make quick adjustments to features that weren't performing as expected.\n\nRegarding end-of-life decisions, I approach these with both empathy and analytical rigor. At TechMind, we had to sunset a sentiment analysis feature that was being used by approximately 15% of our users but required disproportionate engineering resources to maintain. I approached this by:\n\n1. Conducting a thorough impact analysis, working with data analysts to understand exactly which customers used the feature and how critical it was to their workflows.\n\n2. Creating a clear communication plan with our customer success team, giving users 90 days' notice and offering alternatives.\n\n3. Personally reaching out to our highest-value customers who used the.""}]"
