interviewer_emotions,interviewer_emotion_score,interviewer_thoughts,interviewer_response,interviewee_response,reward,conversation_history
,50,,"*thoughts: The candidate has introduced themselves briefly but hasn't shown any specific product knowledge yet. Let me establish rapport and begin exploring their product management experience.*

*emotions: Neutral and professional, ready to engage with the candidate.*

Hello there! It's nice to meet you. I'm looking forward to learning more about your product management experience today. Our discussion will cover several key areas of product management, from market positioning to end-of-life cycles. Before we dive in, could you briefly share your background in product management and perhaps a product you've been particularly proud to work on?","Hi, great to meet you too! I'm Alex, and I've spent the last three years in product management across two AI startups.

Most recently, I led the development of an AI-powered customer service analytics platform at Insightful AI, where we helped businesses transform their support interactions into actionable insights. I'm particularly proud of this product because we started from user pain points – support teams drowning in conversation data without clear visibility into trends or customer sentiment.

Through extensive user interviews and close collaboration with our engineering and data science teams, we built a solution that reduced time-to-insight by 70% for our clients. What made this especially rewarding was seeing how the tool empowered customer service representatives who previously felt overlooked in the analytics conversation.

Before that, I worked at NLP Solutions on their sentiment analysis API product, where I learned the fundamentals of product-market fit and technical product management.

I'm excited about this opportunity because I'm passionate about translating complex technical capabilities into solutions that genuinely improve people's work lives. I'd love to hear more about the product challenges you're facing here.",0,[]
"I'm feeling quite engaged and optimistic about this candidate. Their response shows relevant experience in AI products with specific, measurable outcomes. I appreciate that they shared both the business impact and the human element of their work, which suggests emotional intelligence. They've piqued my interest with their background at both startups, and I'm curious to explore their experience deeper.",85,"This is a solid initial response. Alex has relevant AI product experience (3 years across two startups), and presented a clear example with quantifiable impact (70% reduction in time-to-insight). I like that they framed their product work in terms of user problems and outcomes rather than just features. They also showed awareness of cross-functional collaboration and mentioned both technical capabilities and user empathy. Their final question about our challenges shows engagement and interview preparation. Let's probe more deeply into their product management methodology and decision-making process to see if there's real substance behind these initial positive signals.","

Thanks for sharing that, Alex. Your experience with AI products sounds quite relevant. I'd like to dig deeper into how you approach product management across several key areas.

Let's start with market positioning. For your AI-powered customer service analytics platform, how did you identify and define your market position? What process did you use to understand where your product would fit among competitors and in the minds of customers?","I'm glad you're interested in that aspect of my work! For our customer service analytics platform, we approached market positioning as a critical foundation rather than an afterthought.

We began with comprehensive research on three fronts: understanding our potential customers, analyzing competitors, and assessing our own technical capabilities. I led in-depth interviews with over 30 customer service leaders across different company sizes to identify their most painful unaddressed challenges. Simultaneously, we mapped the competitive landscape, categorizing existing solutions based on their features, pricing models, and target segments.

What emerged was a clear opportunity gap - existing solutions were either too simplistic (basic reporting dashboards) or extraordinarily complex enterprise systems requiring dedicated analysts. Meanwhile, mid-market companies had sophisticated support operations generating valuable data but lacked tools that their teams could actually use without specialized training.

We positioned ourselves as ""AI-powered insights for customer service teams, not just analysts"" - emphasizing accessibility and actionability. Our differentiation came through three key elements:
1. A focus on surfacing actionable insights rather than just data visualization
2. Natural language interfaces that support reps could engage with directly
3. Integration capabilities with existing workflow tools

To validate this positioning, we created messaging prototypes and tested them with our interview participants, refining until we saw consistent resonance. This positioning then guided everything from our feature prioritization to our pricing strategy.",35,"[{""interviewer_response"": ""Interviewer: \n\nThanks for sharing that, Alex. Your experience with AI products sounds quite relevant. I'd like to dig deeper into how you approach product management across several key areas.\n\nLet's start with market positioning. For your AI-powered customer service analytics platform, how did you identify and define your market position? What process did you use to understand where your product would fit among competitors and in the minds of customers?."", ""interviewee_response"": ""You answered: I'm glad you're interested in that aspect of my work! For our customer service analytics platform, we approached market positioning as a critical foundation rather than an afterthought.\n\nWe began with comprehensive research on three fronts: understanding our potential customers, analyzing competitors, and assessing our own technical capabilities. I led in-depth interviews with over 30 customer service leaders across different company sizes to identify their most painful unaddressed challenges. Simultaneously, we mapped the competitive landscape, categorizing existing solutions based on their features, pricing models, and target segments.\n\nWhat emerged was a clear opportunity gap - existing solutions were either too simplistic (basic reporting dashboards) or extraordinarily complex enterprise systems requiring dedicated analysts. Meanwhile, mid-market companies had sophisticated support operations generating valuable data but lacked tools that their teams could actually use without specialized training.\n\nWe positioned ourselves as \""AI-powered insights for customer service teams, not just analysts\"" - emphasizing accessibility and actionability. Our differentiation came through three key elements:\n1. A focus on surfacing actionable insights rather than just data visualization\n2. Natural language interfaces that support reps could engage with directly\n3. Integration capabilities with existing workflow tools\n\nTo validate this positioning, we created messaging prototypes and tested them with our interview participants, refining until we saw consistent resonance. This positioning then guided everything from our feature prioritization to our pricing strategy..""}]"
"I'm impressed and increasingly enthusiastic about this candidate. Their detailed explanation of market positioning shows strategic thinking and methodical execution. I appreciate how they backed their approach with specific research (30+ interviews) and identified a clear market gap rather than just following competitors. Their three-point differentiation strategy demonstrates both business acumen and customer empathy. I'm particularly drawn to how they tested their positioning with real users, showing commitment to validation rather than assumption.",85,"This is a very strong response on market positioning. Alex demonstrates a structured approach with tangible examples - conducting 30+ interviews, competitive analysis, and positioning validation. Their identification of the ""opportunity gap"" between simple dashboards and complex enterprise systems shows market insight. I appreciate the clear articulation of their differentiation strategy with the three elements, which suggests an ability to make strategic choices rather than trying to be everything to everyone. The focus on making insights accessible to frontline teams rather than just analysts shows good customer empathy. Let's see if this level of depth continues in other product management domains by testing their product roadmap development and prioritization skills.","

That's an excellent walkthrough of your positioning process, Alex. The gap identification between overly simple and overly complex solutions is particularly insightful.

Let's move to competitive analysis. You mentioned mapping the competitive landscape as part of your positioning work. Could you elaborate on your methodology for ongoing competitive intelligence? How did you stay informed about competitor movements, and how did that information influence your product decisions and roadmap priorities?","Thank you for that question. Competitive intelligence was absolutely vital to our success, especially in the fast-moving AI space.

We established a multi-layered approach to staying informed about our competitors:

First, we created a dedicated competitive intelligence system where our entire team contributed insights. Sales would share feedback from prospects about competitor offerings, support would flag features customers requested based on competitor capabilities, and marketing monitored messaging shifts across competitor channels. I made sure everyone understood that competitive intelligence was a shared responsibility, not just a product management function.

On a more structured level, I conducted quarterly deep-dive analyses where I'd personally sign up for competitor free trials, attend their webinars, and analyze their release notes and public roadmaps. This hands-on approach gave me nuanced understanding beyond feature comparison matrices.

We also maintained relationships with industry analysts and participated in relevant communities where we could gain broader market perspective. This helped us identify emerging competitors before they became direct threats.

As for how this influenced our decisions - we used a framework I developed called ""match, leapfrog, or differentiate"":
- Match: For table-stakes features customers expected
- Leapfrog: Areas where we could substantially outperform competitors
- Differentiate: Unique capabilities aligned with our positioning that competitors couldn't easily copy",0,"[{""interviewer_response"": ""Interviewer: \n\nThanks for sharing that, Alex. Your experience with AI products sounds quite relevant. I'd like to dig deeper into how you approach product management across several key areas.\n\nLet's start with market positioning. For your AI-powered customer service analytics platform, how did you identify and define your market position? What process did you use to understand where your product would fit among competitors and in the minds of customers?."", ""interviewee_response"": ""You answered: I'm glad you're interested in that aspect of my work! For our customer service analytics platform, we approached market positioning as a critical foundation rather than an afterthought.\n\nWe began with comprehensive research on three fronts: understanding our potential customers, analyzing competitors, and assessing our own technical capabilities. I led in-depth interviews with over 30 customer service leaders across different company sizes to identify their most painful unaddressed challenges. Simultaneously, we mapped the competitive landscape, categorizing existing solutions based on their features, pricing models, and target segments.\n\nWhat emerged was a clear opportunity gap - existing solutions were either too simplistic (basic reporting dashboards) or extraordinarily complex enterprise systems requiring dedicated analysts. Meanwhile, mid-market companies had sophisticated support operations generating valuable data but lacked tools that their teams could actually use without specialized training.\n\nWe positioned ourselves as \""AI-powered insights for customer service teams, not just analysts\"" - emphasizing accessibility and actionability. Our differentiation came through three key elements:\n1. A focus on surfacing actionable insights rather than just data visualization\n2. Natural language interfaces that support reps could engage with directly\n3. Integration capabilities with existing workflow tools\n\nTo validate this positioning, we created messaging prototypes and tested them with our interview participants, refining until we saw consistent resonance. This positioning then guided everything from our feature prioritization to our pricing strategy..""}, {""interviewer_response"": ""Interviewer: \n\nThat's an excellent walkthrough of your positioning process, Alex. The gap identification between overly simple and overly complex solutions is particularly insightful.\n\nLet's move to competitive analysis. You mentioned mapping the competitive landscape as part of your positioning work. Could you elaborate on your methodology for ongoing competitive intelligence? How did you stay informed about competitor movements, and how did that information influence your product decisions and roadmap priorities?."", ""interviewee_response"": ""You answered: Thank you for that question. Competitive intelligence was absolutely vital to our success, especially in the fast-moving AI space.\n\nWe established a multi-layered approach to staying informed about our competitors:\n\nFirst, we created a dedicated competitive intelligence system where our entire team contributed insights. Sales would share feedback from prospects about competitor offerings, support would flag features customers requested based on competitor capabilities, and marketing monitored messaging shifts across competitor channels. I made sure everyone understood that competitive intelligence was a shared responsibility, not just a product management function.\n\nOn a more structured level, I conducted quarterly deep-dive analyses where I'd personally sign up for competitor free trials, attend their webinars, and analyze their release notes and public roadmaps. This hands-on approach gave me nuanced understanding beyond feature comparison matrices.\n\nWe also maintained relationships with industry analysts and participated in relevant communities where we could gain broader market perspective. This helped us identify emerging competitors before they became direct threats.\n\nAs for how this influenced our decisions - we used a framework I developed called \""match, leapfrog, or differentiate\"":\n- Match: For table-stakes features customers expected\n- Leapfrog: Areas where we could substantially outperform competitors\n- Differentiate: Unique capabilities aligned with our positioning that competitors couldn't easily copy.""}]"
"I'm feeling genuinely excited about this candidate now. Their competitive analysis approach demonstrates a sophisticated understanding of product management that goes beyond textbook answers. I appreciate the systematic yet practical methodology they've created, especially how they've built organizational alignment around competitive intelligence as a shared responsibility. Their ""match, leapfrog, or differentiate"" framework shows strategic thinking that balances reactivity and innovation. I'm increasingly confident this person has real product leadership experience and solid decision-making capabilities.",85,"Alex continues to demonstrate sophisticated product management thinking. Their competitive intelligence approach shows both breadth (company-wide participation) and depth (personal hands-on analysis). I particularly like the ""match, leapfrog, or differentiate"" framework, which reveals strategic thinking about how to respond to competitors rather than just tracking them. Their mention of making CI a shared responsibility suggests leadership experience and organizational savvy. They're answering questions with specific methodologies and examples rather than generalities, which indicates real experience rather than theoretical knowledge. Let's challenge them with a scenario to see how they handle product tradeoffs and prioritization decisions.","

That's a robust approach to competitive intelligence. I particularly like your ""match, leapfrog, or differentiate"" framework for translating competitive insights into action.

Let's talk about TAM calculation. When building your AI customer service analytics platform, how did you calculate your Total Addressable Market? What methodology did you use, and how did this calculation influence your product strategy and investment decisions?","Thank you for that question! Calculating our Total Addressable Market was a crucial exercise that helped us align our vision with market reality.

For our customer service analytics platform, we used a multi-layered approach to TAM calculation:

We started with a top-down analysis using industry reports from Gartner and Forrester on the customer service software market, which gave us a macro view. Then we refined this with a bottom-up approach that felt more actionable for our specific offering.

For the bottom-up calculation, we identified our ideal customer profile: mid-market companies with 50+ customer service representatives handling digital interactions. We estimated the number of such companies across our target industries (initially SaaS, e-commerce, and financial services), then multiplied by our expected annual contract value based on our pricing model.

What made this exercise particularly valuable wasn't just the final number, but how it shaped our strategy. We realized that:

1. The mid-market segment was underserved but substantial enough to support our growth goals
2. Our initial TAM in just three industries justified our investment case
3. We could expand to adjacent markets (like internal IT support teams) as a future growth vector

This analysis directly influenced our product decisions. For example, we prioritized features that addressed the specific needs of mid-market teams rather than enterprise capabilities that would have stretched our resources thin.",0,"[{""interviewer_response"": ""Interviewer: \n\nThanks for sharing that, Alex. Your experience with AI products sounds quite relevant. I'd like to dig deeper into how you approach product management across several key areas.\n\nLet's start with market positioning. For your AI-powered customer service analytics platform, how did you identify and define your market position? What process did you use to understand where your product would fit among competitors and in the minds of customers?."", ""interviewee_response"": ""You answered: I'm glad you're interested in that aspect of my work! For our customer service analytics platform, we approached market positioning as a critical foundation rather than an afterthought.\n\nWe began with comprehensive research on three fronts: understanding our potential customers, analyzing competitors, and assessing our own technical capabilities. I led in-depth interviews with over 30 customer service leaders across different company sizes to identify their most painful unaddressed challenges. Simultaneously, we mapped the competitive landscape, categorizing existing solutions based on their features, pricing models, and target segments.\n\nWhat emerged was a clear opportunity gap - existing solutions were either too simplistic (basic reporting dashboards) or extraordinarily complex enterprise systems requiring dedicated analysts. Meanwhile, mid-market companies had sophisticated support operations generating valuable data but lacked tools that their teams could actually use without specialized training.\n\nWe positioned ourselves as \""AI-powered insights for customer service teams, not just analysts\"" - emphasizing accessibility and actionability. Our differentiation came through three key elements:\n1. A focus on surfacing actionable insights rather than just data visualization\n2. Natural language interfaces that support reps could engage with directly\n3. Integration capabilities with existing workflow tools\n\nTo validate this positioning, we created messaging prototypes and tested them with our interview participants, refining until we saw consistent resonance. This positioning then guided everything from our feature prioritization to our pricing strategy..""}, {""interviewer_response"": ""Interviewer: \n\nThat's an excellent walkthrough of your positioning process, Alex. The gap identification between overly simple and overly complex solutions is particularly insightful.\n\nLet's move to competitive analysis. You mentioned mapping the competitive landscape as part of your positioning work. Could you elaborate on your methodology for ongoing competitive intelligence? How did you stay informed about competitor movements, and how did that information influence your product decisions and roadmap priorities?."", ""interviewee_response"": ""You answered: Thank you for that question. Competitive intelligence was absolutely vital to our success, especially in the fast-moving AI space.\n\nWe established a multi-layered approach to staying informed about our competitors:\n\nFirst, we created a dedicated competitive intelligence system where our entire team contributed insights. Sales would share feedback from prospects about competitor offerings, support would flag features customers requested based on competitor capabilities, and marketing monitored messaging shifts across competitor channels. I made sure everyone understood that competitive intelligence was a shared responsibility, not just a product management function.\n\nOn a more structured level, I conducted quarterly deep-dive analyses where I'd personally sign up for competitor free trials, attend their webinars, and analyze their release notes and public roadmaps. This hands-on approach gave me nuanced understanding beyond feature comparison matrices.\n\nWe also maintained relationships with industry analysts and participated in relevant communities where we could gain broader market perspective. This helped us identify emerging competitors before they became direct threats.\n\nAs for how this influenced our decisions - we used a framework I developed called \""match, leapfrog, or differentiate\"":\n- Match: For table-stakes features customers expected\n- Leapfrog: Areas where we could substantially outperform competitors\n- Differentiate: Unique capabilities aligned with our positioning that competitors couldn't easily copy.""}, {""interviewer_response"": ""Interviewer: \n\nThat's a robust approach to competitive intelligence. I particularly like your \""match, leapfrog, or differentiate\"" framework for translating competitive insights into action.\n\nLet's talk about TAM calculation. When building your AI customer service analytics platform, how did you calculate your Total Addressable Market? What methodology did you use, and how did this calculation influence your product strategy and investment decisions?."", ""interviewee_response"": ""You answered: Thank you for that question! Calculating our Total Addressable Market was a crucial exercise that helped us align our vision with market reality.\n\nFor our customer service analytics platform, we used a multi-layered approach to TAM calculation:\n\nWe started with a top-down analysis using industry reports from Gartner and Forrester on the customer service software market, which gave us a macro view. Then we refined this with a bottom-up approach that felt more actionable for our specific offering.\n\nFor the bottom-up calculation, we identified our ideal customer profile: mid-market companies with 50+ customer service representatives handling digital interactions. We estimated the number of such companies across our target industries (initially SaaS, e-commerce, and financial services), then multiplied by our expected annual contract value based on our pricing model.\n\nWhat made this exercise particularly valuable wasn't just the final number, but how it shaped our strategy. We realized that:\n\n1. The mid-market segment was underserved but substantial enough to support our growth goals\n2. Our initial TAM in just three industries justified our investment case\n3. We could expand to adjacent markets (like internal IT support teams) as a future growth vector\n\nThis analysis directly influenced our product decisions. For example, we prioritized features that addressed the specific needs of mid-market teams rather than enterprise capabilities that would have stretched our resources thin..""}]"
