interviewer_emotions,interviewer_emotion_score,interviewer_thoughts,interviewer_response,interviewee_response,reward,conversation_history
"I'm very impressed with this candidate. Their thoughtful approach to documentation shows a practical understanding of how to make product documents truly useful in a fast-moving environment. I appreciate how they've created systems that balance structure with flexibility, particularly their modular approach and assumption tracking. What really resonates is their focus on adoption and utility - ensuring documents are actually used by the team rather than becoming shelf-ware. Their regular review process with engineering and design demonstrates cross-functional leadership skills and a collaborative mindset. This candidate clearly understands that documentation should enable teams rather than constrain them.",85,"Alex continues to demonstrate excellent product management practices with concrete examples. Their modular documentation approach, explicit assumptions tracking, and regular cross-functional reviews show they've thought deeply about making documentation valuable rather than burdensome. I particularly like their emphasis on utility - measuring success by whether teams actually use the documents rather than just completing them. Their final point about balancing thoroughness with pragmatism in startup environments shows good judgment and adaptability to context. Throughout all their answers, they've consistently shown both strategic thinking and practical implementation skills. Let's now test their experience with measuring product success and navigating tradeoffs.","



Thank you for that comprehensive view of your documentation approach. I particularly appreciate your emphasis on making documents useful tools rather than obligatory artifacts.

Let's talk about working with engineering teams. Could you describe your process for collaborating with engineering throughout the product development lifecycle? How do you handle technical constraints, scope negotiations, and unexpected challenges? Perhaps you could share a specific example of how you navigated a particularly challenging technical situation.","Thank you for that question. Collaboration with engineering is truly at the heart of successful product management, especially in AI startups where technical complexity is high.

My approach to working with engineering teams is based on partnership rather than a transactional relationship. I establish this from the beginning by involving engineers early in the problem definition phase, not just the solution phase.

At Insightful AI, my process typically looked like:

1. **Discovery phase**: I invited senior engineers to customer interviews so they could hear pain points firsthand.

2. **Solution exploration**: Before finalizing requirements, I'd host collaborative workshops where we'd explore technical approaches and constraints together.

3. **Planning and scoping**: I use a joint estimation process where we break down features into technical components and openly discuss risks and dependencies.

4. **Development**: Daily check-ins with a focus on removing obstacles and making quick decisions on emerging issues.

5. **Review and iteration**: Shared accountability for outcomes, not just delivery.

A specific example that comes to mind was when we were implementing real-time sentiment analysis for customer conversations. Our initial PRD specified accuracy requirements that our engineering team flagged as potentially requiring significant model retraining. Rather than pushing forward, I organized a collaborative session where we:

1. Unpacked the user need behind the accuracy requirement
2. Explored alternative technical approaches",0,"[{""interviewer_response"": ""Interviewer: \n\nThanks for sharing that, Alex. Your experience with AI products sounds quite relevant. I'd like to dig deeper into how you approach product management across several key areas.\n\nLet's start with market positioning. For your AI-powered customer service analytics platform, how did you identify and define your market position? What process did you use to understand where your product would fit among competitors and in the minds of customers?."", ""interviewee_response"": ""You answered: I'm glad you're interested in that aspect of my work! For our customer service analytics platform, we approached market positioning as a critical foundation rather than an afterthought.\n\nWe began with comprehensive research on three fronts: understanding our potential customers, analyzing competitors, and assessing our own technical capabilities. I led in-depth interviews with over 30 customer service leaders across different company sizes to identify their most painful unaddressed challenges. Simultaneously, we mapped the competitive landscape, categorizing existing solutions based on their features, pricing models, and target segments.\n\nWhat emerged was a clear opportunity gap - existing solutions were either too simplistic (basic reporting dashboards) or extraordinarily complex enterprise systems requiring dedicated analysts. Meanwhile, mid-market companies had sophisticated support operations generating valuable data but lacked tools that their teams could actually use without specialized training.\n\nWe positioned ourselves as \""AI-powered insights for customer service teams, not just analysts\"" - emphasizing accessibility and actionability. Our differentiation came through three key elements:\n1. A focus on surfacing actionable insights rather than just data visualization\n2. Natural language interfaces that support reps could engage with directly\n3. Integration capabilities with existing workflow tools\n\nTo validate this positioning, we created messaging prototypes and tested them with our interview participants, refining until we saw consistent resonance. This positioning then guided everything from our feature prioritization to our pricing strategy..""}, {""interviewer_response"": ""Interviewer: \n\nThat's an excellent walkthrough of your positioning process, Alex. The gap identification between overly simple and overly complex solutions is particularly insightful.\n\nLet's move to competitive analysis. You mentioned mapping the competitive landscape as part of your positioning work. Could you elaborate on your methodology for ongoing competitive intelligence? How did you stay informed about competitor movements, and how did that information influence your product decisions and roadmap priorities?."", ""interviewee_response"": ""You answered: Thank you for that question. Competitive intelligence was absolutely vital to our success, especially in the fast-moving AI space.\n\nWe established a multi-layered approach to staying informed about our competitors:\n\nFirst, we created a dedicated competitive intelligence system where our entire team contributed insights. Sales would share feedback from prospects about competitor offerings, support would flag features customers requested based on competitor capabilities, and marketing monitored messaging shifts across competitor channels. I made sure everyone understood that competitive intelligence was a shared responsibility, not just a product management function.\n\nOn a more structured level, I conducted quarterly deep-dive analyses where I'd personally sign up for competitor free trials, attend their webinars, and analyze their release notes and public roadmaps. This hands-on approach gave me nuanced understanding beyond feature comparison matrices.\n\nWe also maintained relationships with industry analysts and participated in relevant communities where we could gain broader market perspective. This helped us identify emerging competitors before they became direct threats.\n\nAs for how this influenced our decisions - we used a framework I developed called \""match, leapfrog, or differentiate\"":\n- Match: For table-stakes features customers expected\n- Leapfrog: Areas where we could substantially outperform competitors\n- Differentiate: Unique capabilities aligned with our positioning that competitors couldn't easily copy.""}, {""interviewer_response"": ""Interviewer: \n\nThat's a robust approach to competitive intelligence. I particularly like your \""match, leapfrog, or differentiate\"" framework for translating competitive insights into action.\n\nLet's talk about TAM calculation. When building your AI customer service analytics platform, how did you calculate your Total Addressable Market? What methodology did you use, and how did this calculation influence your product strategy and investment decisions?."", ""interviewee_response"": ""You answered: Thank you for that question! Calculating our Total Addressable Market was a crucial exercise that helped us align our vision with market reality.\n\nFor our customer service analytics platform, we used a multi-layered approach to TAM calculation:\n\nWe started with a top-down analysis using industry reports from Gartner and Forrester on the customer service software market, which gave us a macro view. Then we refined this with a bottom-up approach that felt more actionable for our specific offering.\n\nFor the bottom-up calculation, we identified our ideal customer profile: mid-market companies with 50+ customer service representatives handling digital interactions. We estimated the number of such companies across our target industries (initially SaaS, e-commerce, and financial services), then multiplied by our expected annual contract value based on our pricing model.\n\nWhat made this exercise particularly valuable wasn't just the final number, but how it shaped our strategy. We realized that:\n\n1. The mid-market segment was underserved but substantial enough to support our growth goals\n2. Our initial TAM in just three industries justified our investment case\n3. We could expand to adjacent markets (like internal IT support teams) as a future growth vector\n\nThis analysis directly influenced our product decisions. For example, we prioritized features that addressed the specific needs of mid-market teams rather than enterprise capabilities that would have stretched our resources thin..""}, {""interviewer_response"": ""Interviewer: \n\n\n\nExcellent walkthrough of your TAM approach, Alex. I appreciate how you connected the analysis directly to product strategy decisions.\n\nNow let's shift to documentation and product definition. Could you walk me through your approach to creating Market Requirements Documents (MRDs) and Product Requirements Documents (PRDs)? What information do you include in each, and how do you ensure these documents effectively guide your development team while remaining adaptable to changing market needs?."", ""interviewee_response"": ""You answered: Thank you for that question! Documentation is something I'm quite passionate about as it's critical for alignment and execution.\n\nFor Market Requirements Documents (MRDs), I focus on capturing the \""why\"" behind our product decisions. In my experience, an effective MRD includes:\n\n1. Market problem definition and supporting research data\n2. Target customer profiles with their key pain points\n3. Market size and segmentation analysis\n4. Competitive landscape overview\n5. High-level value proposition and positioning\n6. Success metrics tied to business objectives\n\nAt Insightful AI, I developed a collaborative MRD approach where I'd draft the initial document based on research, then workshop it with stakeholders from sales, marketing, and executive leadership to ensure buy-in and capture diverse perspectives.\n\nFor Product Requirements Documents (PRDs), I focus on translating market needs into specific, actionable requirements. My PRDs typically include:\n\n1. User stories with acceptance criteria\n2. Feature specifications with clear scope boundaries\n3. UI/UX requirements with wireframes or mockups\n4. Technical considerations and dependencies\n5. Success metrics for each feature\n6. Phasing recommendations for implementation\n\nTo ensure these documents remain valuable while staying adaptable, I've adopted a few key practices:\n\nFirst, I keep PRDs living documents in tools like Confluence that integrate with our project management system. This creates traceability from requirement to implementation..""}, {""interviewer_response"": ""Interviewer: \n\nI noticed you were continuing with your answer. Please feel free to finish your thoughts on PRDs and documentation adaptability.."", ""interviewee_response"": ""You answered: To complete my thoughts on PRDs and adaptability:\n\nSecond, I structure documents in modular components rather than monolithic specs. This allows us to adapt individual elements without disrupting the entire document when requirements evolve.\n\nThird, I include explicit assumptions sections that we review regularly. When assumptions change, we have a clear process to update the relevant requirements.\n\nFinally, I've found that documentation is only effective when the team actually uses it. At Insightful AI, I instituted regular \""requirements reviews\"" where engineering and design partners would actively provide feedback. This collaborative approach ensured our documents served as helpful guides rather than rigid constraints.\n\nWhat made this approach particularly effective was balancing thoroughness with pragmatism. In startup environments, we needed documents comprehensive enough to provide direction but flexible enough to adapt to new learnings. The strongest signal of success was when engineers and designers would proactively reference our PRDs during implementation discussions rather than viewing them as obligatory paperwork..""}, {""interviewer_response"": ""Interviewer: \n\n\n\nThank you for that comprehensive view of your documentation approach. I particularly appreciate your emphasis on making documents useful tools rather than obligatory artifacts.\n\nLet's talk about working with engineering teams. Could you describe your process for collaborating with engineering throughout the product development lifecycle? How do you handle technical constraints, scope negotiations, and unexpected challenges? Perhaps you could share a specific example of how you navigated a particularly challenging technical situation.."", ""interviewee_response"": ""You answered: Thank you for that question. Collaboration with engineering is truly at the heart of successful product management, especially in AI startups where technical complexity is high.\n\nMy approach to working with engineering teams is based on partnership rather than a transactional relationship. I establish this from the beginning by involving engineers early in the problem definition phase, not just the solution phase.\n\nAt Insightful AI, my process typically looked like:\n\n1. **Discovery phase**: I invited senior engineers to customer interviews so they could hear pain points firsthand.\n\n2. **Solution exploration**: Before finalizing requirements, I'd host collaborative workshops where we'd explore technical approaches and constraints together.\n\n3. **Planning and scoping**: I use a joint estimation process where we break down features into technical components and openly discuss risks and dependencies.\n\n4. **Development**: Daily check-ins with a focus on removing obstacles and making quick decisions on emerging issues.\n\n5. **Review and iteration**: Shared accountability for outcomes, not just delivery.\n\nA specific example that comes to mind was when we were implementing real-time sentiment analysis for customer conversations. Our initial PRD specified accuracy requirements that our engineering team flagged as potentially requiring significant model retraining. Rather than pushing forward, I organized a collaborative session where we:\n\n1. Unpacked the user need behind the accuracy requirement\n2. Explored alternative technical approaches.""}]"
