interviewer_emotions,interviewer_emotion_score,interviewer_thoughts,interviewer_response,interviewee_response,reward,conversation_history
,50,,"(thoughts: This candidate is just beginning. I'll start with a friendly introduction to set them at ease.)

(emotions: I'm feeling optimistic and curious to learn about this candidate's experience.)

Good morning! Thanks for joining me today. I'm looking forward to learning more about your product management experience. Today we'll be discussing various aspects of the product lifecycle, from market positioning to end-of-life management. I'd like to hear about your knowledge and specific examples from your experience.

Let's start with market positioning. Could you walk me through how you would approach positioning a new product in the market? Perhaps you could share an example of a product you've worked on and how you positioned it relative to competitors.","Good morning! Thanks for having me. I'm excited to be here and discuss my product management experience.

When it comes to market positioning, I approach it as a critical foundation that shapes everything from development to marketing. I believe effective positioning starts with deep understanding of three key elements: our users' needs, our product's unique value, and the competitive landscape.

At my current startup, Dialogic AI, I led the positioning for our conversational analytics platform. We initially thought we'd compete broadly in the customer service AI space, but through user interviews and market analysis, I discovered an underserved niche: mid-sized companies that needed advanced sentiment analysis but found enterprise solutions too complex and expensive.

I brought together our engineering, design, and marketing teams to align on a positioning strategy that emphasized our ""enterprise-grade insights with startup-friendly implementation."" This positioning informed our feature prioritization - we focused on creating intuitive visualizations of complex sentiment data rather than trying to match the feature depth of enterprise competitors.

What I found particularly valuable was gathering direct customer feedback on our positioning through beta testing. This collaborative approach allowed us to refine our messaging based on which aspects truly resonated with users, rather than just our internal assumptions. The result was a 40% higher conversion rate on our landing page and much more focused sales conversations.

I believe good positioning isn't just marketing - it's about crystallizing what makes your product uniquely valuable to specific users.",0,[]
"I'm feeling impressed and engaged by this candidate's thorough response. Their structured approach to positioning shows real strategic thinking, and they provided a specific, detailed example that demonstrated results. I appreciate how they connected positioning to actual business outcomes like conversion rates. I'm particularly drawn to their emphasis on user feedback and cross-functional collaboration. I'm feeling optimistic about their product management capabilities and curious to hear more examples of their work.",85,"This candidate demonstrates strong strategic thinking about positioning with a comprehensive framework. They provided a specific, detailed example from their startup experience that shows how they identified an underserved market segment through research. I appreciate how they connected positioning decisions to concrete business outcomes (40% higher conversion) and emphasized cross-functional collaboration. Their answer reflects solid product management fundamentals - user-centricity, competitive awareness, and data-driven decision making. They articulate the ""why"" behind their approach rather than just tactical steps. So far, they appear to have substantial experience and a mature understanding of product positioning.","

That's a great approach to positioning! I like how you identified that specific underserved niche and translated it into both messaging and product features. The 40% conversion improvement is particularly impressive.

Let's move on to competitive analysis. Could you walk me through your process for evaluating competitors? I'm especially interested in how you identify both direct and indirect competitors, what frameworks you use to analyze them, and how you translate competitive insights into actionable product decisions.","Good question! Competitive analysis is essential to product strategy, and I approach it systematically while keeping user needs at the center.

At Dialogic AI, I developed a three-phase competitive analysis process. First, I identify the competitive landscape by mapping both direct competitors (other conversational analytics tools) and indirect competitors (general analytics platforms with some conversational features). I gather this information through market research, customer interviews (""what would you use if our product didn't exist?""), and industry reports.

For the framework, I use a modified version of the Four Corners Analysis. We examine competitors' current strategy, capabilities, assumptions about the market, and likely future moves. I collaborate closely with our sales team to understand competitor positioning from customer conversations, and with engineering to assess technical capabilities.

For example, when Enterprise Solution X released an SMB-focused offering that overlapped with our target market, I organized a cross-functional workshop. We created a feature comparison matrix but also dug deeper into their user experience - I personally signed up for trials of competing products to experience their onboarding and core workflows.

The most important part is translating analysis into action. At my previous startup, we discovered competitors were weak in data visualization despite strong analytical capabilities. This insight led us to prioritize our interactive dashboard feature, which became a key differentiator mentioned in 70% of our customer testimonials.",35,"[{""interviewer_response"": ""Interviewer: \n\nThat's a great approach to positioning! I like how you identified that specific underserved niche and translated it into both messaging and product features. The 40% conversion improvement is particularly impressive.\n\nLet's move on to competitive analysis. Could you walk me through your process for evaluating competitors? I'm especially interested in how you identify both direct and indirect competitors, what frameworks you use to analyze them, and how you translate competitive insights into actionable product decisions.."", ""interviewee_response"": ""You answered: Good question! Competitive analysis is essential to product strategy, and I approach it systematically while keeping user needs at the center.\n\nAt Dialogic AI, I developed a three-phase competitive analysis process. First, I identify the competitive landscape by mapping both direct competitors (other conversational analytics tools) and indirect competitors (general analytics platforms with some conversational features). I gather this information through market research, customer interviews (\""what would you use if our product didn't exist?\""), and industry reports.\n\nFor the framework, I use a modified version of the Four Corners Analysis. We examine competitors' current strategy, capabilities, assumptions about the market, and likely future moves. I collaborate closely with our sales team to understand competitor positioning from customer conversations, and with engineering to assess technical capabilities.\n\nFor example, when Enterprise Solution X released an SMB-focused offering that overlapped with our target market, I organized a cross-functional workshop. We created a feature comparison matrix but also dug deeper into their user experience - I personally signed up for trials of competing products to experience their onboarding and core workflows.\n\nThe most important part is translating analysis into action. At my previous startup, we discovered competitors were weak in data visualization despite strong analytical capabilities. This insight led us to prioritize our interactive dashboard feature, which became a key differentiator mentioned in 70% of our customer testimonials..""}]"
I'm feeling increasingly confident about this candidate. They showed depth in their competitive analysis approach with a clear framework and methodology. I appreciate how they personally test competitor products and incorporate cross-functional insights from sales and engineering. Their example of translating competitive insights into a specific product feature that became a differentiator shows strong strategic thinking and execution. Their answers demonstrate both theoretical knowledge and practical application with measurable results. I'm feeling very positive about their product management capabilities.,85,"This candidate continues to impress with a structured approach to competitive analysis. They demonstrate sophistication by using an established framework (Four Corners Analysis) but adapting it to their context. Their process is comprehensive - covering direct/indirect competitors, using multiple data sources, and involving cross-functional teams. I particularly value that they personally test competitor products, showing hands-on commitment to understanding the market. Most importantly, they clearly tie competitive analysis to actionable product decisions with measurable outcomes (70% mention in testimonials). Their answers consistently show a blend of strategic thinking, methodological approach, and results orientation. They appear to be a seasoned product manager with solid experience.","

That's a comprehensive approach to competitive analysis! I appreciate how you personally test competitor products and translate insights into actionable features with measurable impact.

Let's talk about TAM calculation now. Could you explain your methodology for calculating Total Addressable Market for a new product? What data sources do you typically use, and how do you validate your assumptions? If possible, share a specific example of how you've calculated TAM in the past and how it influenced your product strategy.","Thank you for the feedback! Total Addressable Market calculation is indeed a crucial foundation for product strategy decisions.

My approach to TAM calculation typically follows both top-down and bottom-up methodologies to create a balanced view. For data sources, I rely on industry reports, public company filings, customer interviews, and market research services where budget allows.

At Dialogic AI, when we were exploring expanding our conversational analytics platform into the healthcare sector, I led a TAM analysis that started with identifying the total number of healthcare providers in our target regions using industry reports. I then narrowed this down using criteria like organization size and technology adoption patterns.

For validation, I cross-referenced our top-down estimates with a bottom-up approach. I worked closely with our sales team to determine average contract values based on early customer conversations, then calculated potential revenue by customer segment. What was particularly valuable was conducting interviews with potential customers to understand their budget allocation for similar solutions, which helped refine our pricing assumptions.

One challenge I faced was limited public data about technology spending in smaller healthcare organizations. To address this gap, I developed a survey in collaboration with a healthcare technology forum to gather insights directly from potential users.

This TAM analysis revealed that while the broader healthcare market was enormous, our serviceable obtainable market was more focused. This directly influenced our product roadmap - we prioritized features specifically addressing compliance and integration requirements of mid-sized healthcare providers.",0,"[{""interviewer_response"": ""Interviewer: \n\nThat's a great approach to positioning! I like how you identified that specific underserved niche and translated it into both messaging and product features. The 40% conversion improvement is particularly impressive.\n\nLet's move on to competitive analysis. Could you walk me through your process for evaluating competitors? I'm especially interested in how you identify both direct and indirect competitors, what frameworks you use to analyze them, and how you translate competitive insights into actionable product decisions.."", ""interviewee_response"": ""You answered: Good question! Competitive analysis is essential to product strategy, and I approach it systematically while keeping user needs at the center.\n\nAt Dialogic AI, I developed a three-phase competitive analysis process. First, I identify the competitive landscape by mapping both direct competitors (other conversational analytics tools) and indirect competitors (general analytics platforms with some conversational features). I gather this information through market research, customer interviews (\""what would you use if our product didn't exist?\""), and industry reports.\n\nFor the framework, I use a modified version of the Four Corners Analysis. We examine competitors' current strategy, capabilities, assumptions about the market, and likely future moves. I collaborate closely with our sales team to understand competitor positioning from customer conversations, and with engineering to assess technical capabilities.\n\nFor example, when Enterprise Solution X released an SMB-focused offering that overlapped with our target market, I organized a cross-functional workshop. We created a feature comparison matrix but also dug deeper into their user experience - I personally signed up for trials of competing products to experience their onboarding and core workflows.\n\nThe most important part is translating analysis into action. At my previous startup, we discovered competitors were weak in data visualization despite strong analytical capabilities. This insight led us to prioritize our interactive dashboard feature, which became a key differentiator mentioned in 70% of our customer testimonials..""}, {""interviewer_response"": ""Interviewer: \n\nThat's a comprehensive approach to competitive analysis! I appreciate how you personally test competitor products and translate insights into actionable features with measurable impact.\n\nLet's talk about TAM calculation now. Could you explain your methodology for calculating Total Addressable Market for a new product? What data sources do you typically use, and how do you validate your assumptions? If possible, share a specific example of how you've calculated TAM in the past and how it influenced your product strategy.."", ""interviewee_response"": ""You answered: Thank you for the feedback! Total Addressable Market calculation is indeed a crucial foundation for product strategy decisions.\n\nMy approach to TAM calculation typically follows both top-down and bottom-up methodologies to create a balanced view. For data sources, I rely on industry reports, public company filings, customer interviews, and market research services where budget allows.\n\nAt Dialogic AI, when we were exploring expanding our conversational analytics platform into the healthcare sector, I led a TAM analysis that started with identifying the total number of healthcare providers in our target regions using industry reports. I then narrowed this down using criteria like organization size and technology adoption patterns.\n\nFor validation, I cross-referenced our top-down estimates with a bottom-up approach. I worked closely with our sales team to determine average contract values based on early customer conversations, then calculated potential revenue by customer segment. What was particularly valuable was conducting interviews with potential customers to understand their budget allocation for similar solutions, which helped refine our pricing assumptions.\n\nOne challenge I faced was limited public data about technology spending in smaller healthcare organizations. To address this gap, I developed a survey in collaboration with a healthcare technology forum to gather insights directly from potential users.\n\nThis TAM analysis revealed that while the broader healthcare market was enormous, our serviceable obtainable market was more focused. This directly influenced our product roadmap - we prioritized features specifically addressing compliance and integration requirements of mid-sized healthcare providers..""}]"
