interviewer_emotions,interviewer_emotion_score,interviewer_thoughts,interviewer_response,interviewee_response,reward,conversation_history
"I'm feeling extremely impressed with this candidate's approach to engineering collaboration. Their emphasis on mutual respect and involving engineers early in the discovery process shows a sophisticated understanding of cross-functional dynamics. Their structured framework for handling trade-offs and dedicated approach to technical debt management demonstrates maturity and experience in real-world product development. I'm particularly drawn to their practical examples, like discovery sessions with engineers and the technical debt budget, which show they've implemented these principles successfully. Each answer continues to reveal both strategic thinking and practical execution skills. I'm feeling very enthusiastic about this candidate's capabilities.",90,"This candidate demonstrates an excellent understanding of engineering collaboration with multiple concrete practices that show real experience. Their approach of involving engineers in user interviews is particularly valuable - this kind of early involvement creates better technical solutions and team buy-in. Their framework for trade-off decisions (""impact vs. effort vs. confidence"") is thoughtful and practical. What really stands out is their balanced view on technical debt management with the 20% sprint allocation - this shows they understand the importance of sustainable development practices rather than just pushing features. Throughout all their answers, they consistently demonstrate sophisticated product management approaches backed by specific examples of implementation. They appear to be a highly experienced product manager who understands both the strategic and tactical aspects of the role, with particular strength in engineering collaboration. Their communication remains clear, structured and shows evidence of real-world application.","



Your approach to engineering collaboration is outstanding. I particularly like your practice of involving engineers directly in user interviews - that kind of early engagement pays dividends in both technical solutions and team alignment. The ""technical debt budget"" is also an excellent practice that many organizations struggle to implement effectively.

Let's discuss pre-launch and launch strategies. Could you walk me through how you prepare for and execute a product launch? I'm interested in your approach to beta testing, go-to-market planning, success metrics, and cross-functional coordination. If possible, share a specific product launch you managed and what you learned from the experience.","Thank you for the kind words about my engineering collaboration approach!

For product launches, I believe meticulous preparation combined with adaptability is crucial. I approach launches as cross-functional campaigns rather than just engineering milestones.

My launch process typically begins 2-3 months before the target date with a comprehensive launch plan. At Dialogic AI, when launching our sentiment analytics dashboard, I created a shared document with clear ownership across marketing, sales, customer success, and engineering - with detailed timelines and dependencies mapped out.

For beta testing, I prefer a tiered approach. I start with friendly users (often 5-7 customers with strong relationships) for initial feedback, then expand to a broader beta cohort (15-20 users) representing different segments. During our dashboard launch, we discovered through beta testing that enterprise users needed different visualization options than SMB users - a critical insight we implemented before general release.

For go-to-market planning, I establish clear communication channels between teams. I created a weekly ""launch huddle"" where all stakeholders reported progress and raised blockers. This helped us quickly pivot when we discovered our initial messaging wasn't resonating with healthcare customers.

For measuring success, I establish both leading indicators (daily active users, feature adoption) and lagging indicators (retention, revenue impact). For our dashboard launch, we created a dedicated analytics dashboard to track these metrics in real-time.",5,"[{""interviewer_response"": ""Interviewer: \n\nThat's a great approach to positioning! I like how you identified that specific underserved niche and translated it into both messaging and product features. The 40% conversion improvement is particularly impressive.\n\nLet's move on to competitive analysis. Could you walk me through your process for evaluating competitors? I'm especially interested in how you identify both direct and indirect competitors, what frameworks you use to analyze them, and how you translate competitive insights into actionable product decisions.."", ""interviewee_response"": ""You answered: Good question! Competitive analysis is essential to product strategy, and I approach it systematically while keeping user needs at the center.\n\nAt Dialogic AI, I developed a three-phase competitive analysis process. First, I identify the competitive landscape by mapping both direct competitors (other conversational analytics tools) and indirect competitors (general analytics platforms with some conversational features). I gather this information through market research, customer interviews (\""what would you use if our product didn't exist?\""), and industry reports.\n\nFor the framework, I use a modified version of the Four Corners Analysis. We examine competitors' current strategy, capabilities, assumptions about the market, and likely future moves. I collaborate closely with our sales team to understand competitor positioning from customer conversations, and with engineering to assess technical capabilities.\n\nFor example, when Enterprise Solution X released an SMB-focused offering that overlapped with our target market, I organized a cross-functional workshop. We created a feature comparison matrix but also dug deeper into their user experience - I personally signed up for trials of competing products to experience their onboarding and core workflows.\n\nThe most important part is translating analysis into action. At my previous startup, we discovered competitors were weak in data visualization despite strong analytical capabilities. This insight led us to prioritize our interactive dashboard feature, which became a key differentiator mentioned in 70% of our customer testimonials..""}, {""interviewer_response"": ""Interviewer: \n\nThat's a comprehensive approach to competitive analysis! I appreciate how you personally test competitor products and translate insights into actionable features with measurable impact.\n\nLet's talk about TAM calculation now. Could you explain your methodology for calculating Total Addressable Market for a new product? What data sources do you typically use, and how do you validate your assumptions? If possible, share a specific example of how you've calculated TAM in the past and how it influenced your product strategy.."", ""interviewee_response"": ""You answered: Thank you for the feedback! Total Addressable Market calculation is indeed a crucial foundation for product strategy decisions.\n\nMy approach to TAM calculation typically follows both top-down and bottom-up methodologies to create a balanced view. For data sources, I rely on industry reports, public company filings, customer interviews, and market research services where budget allows.\n\nAt Dialogic AI, when we were exploring expanding our conversational analytics platform into the healthcare sector, I led a TAM analysis that started with identifying the total number of healthcare providers in our target regions using industry reports. I then narrowed this down using criteria like organization size and technology adoption patterns.\n\nFor validation, I cross-referenced our top-down estimates with a bottom-up approach. I worked closely with our sales team to determine average contract values based on early customer conversations, then calculated potential revenue by customer segment. What was particularly valuable was conducting interviews with potential customers to understand their budget allocation for similar solutions, which helped refine our pricing assumptions.\n\nOne challenge I faced was limited public data about technology spending in smaller healthcare organizations. To address this gap, I developed a survey in collaboration with a healthcare technology forum to gather insights directly from potential users.\n\nThis TAM analysis revealed that while the broader healthcare market was enormous, our serviceable obtainable market was more focused. This directly influenced our product roadmap - we prioritized features specifically addressing compliance and integration requirements of mid-sized healthcare providers..""}, {""interviewer_response"": ""Interviewer: \n\nYour approach to TAM calculation is very thorough! I like how you combined top-down and bottom-up methodologies and took initiative to fill data gaps with custom research. It's particularly valuable that you narrowed from theoretical TAM to serviceable obtainable market - that's a distinction many product managers miss.\n\nNow let's talk about product documentation. Could you walk me through your approach to creating Market Requirements Documents (MRDs) and Product Requirements Documents (PRDs)? What key elements do you include in each, and how do you ensure they effectively communicate between different stakeholders? Perhaps you could share an example of a particularly successful or challenging document you created.."", ""interviewee_response"": ""You answered: Thank you for the positive feedback on my TAM approach!\n\nWhen it comes to product documentation, I view MRDs and PRDs as crucial communication bridges between stakeholders that align everyone around both the \""why\"" and the \""what\"" of product development.\n\nFor Market Requirements Documents, I focus on capturing market needs, user personas, competitive landscape, and business objectives. The key is making the market opportunity tangible. At Dialogic AI, when we identified an opportunity to expand our sentiment analysis features, I created an MRD that included voice-of-customer quotes from interviews, quantitative survey data on pain points, and market size estimates broken down by industry vertical. I've found that concrete evidence makes the business case much more compelling.\n\nFor PRDs, I structure them to provide clear guidance to engineering while remaining flexible enough for collaborative problem-solving. I typically include user stories, acceptance criteria, technical constraints, and success metrics. What I've learned is that visual elements - wireframes, user journey maps, and flow diagrams - dramatically improve understanding across teams.\n\nA particularly challenging document I created was for our real-time alert feature at my previous startup. The technical complexity required deep collaboration with engineering, and customer needs varied significantly across segments. I addressed this by creating a modular PRD with clearly labeled \""must-have\"" vs. \""nice-to-have\"" features, and included explicit decision trees for different implementation paths..""}, {""interviewer_response"": ""Interviewer: \n\n\n\nYour approach to documentation is excellent. I especially appreciate your emphasis on making MRDs evidence-based and including visual elements in PRDs - those practical touches really do make a difference in stakeholder understanding. The modular PRD example shows good adaptability for complex features.\n\nLet's shift to working with engineering teams. Could you describe your process for collaborating with engineering throughout the product development lifecycle? How do you handle trade-offs between scope, quality, and time? I'm particularly interested in how you approach technical debt decisions and how you ensure alignment between product vision and technical implementation.."", ""interviewee_response"": ""You answered: Thank you for the positive feedback on my documentation approach!\n\nCollaborating with engineering teams is something I'm particularly passionate about. I believe strong PM-engineering relationships are built on mutual respect, clear communication, and shared ownership of outcomes.\n\nThroughout the product development lifecycle, I maintain close partnerships with engineering in several key ways. In the planning phase, I involve tech leads early in problem definition rather than just presenting solutions. At Dialogic AI, I established twice-weekly \""product discovery\"" sessions where engineers could directly participate in user interviews, which dramatically improved their understanding of user needs and led to more innovative technical approaches.\n\nFor managing trade-offs between scope, quality, and time, I use a prioritization framework we call \""impact vs. effort vs. confidence.\"" When we faced timeline pressure on our integration API launch, I facilitated a workshop with engineering where we mapped features on these dimensions. This transparent process helped us collectively identify which features could be phased to later releases without compromising the core value proposition.\n\nRegarding technical debt, I believe it requires balanced decisions rather than always prioritizing new features. At my previous startup, I worked with our CTO to implement a \""technical debt budget\"" - dedicating 20% of each sprint to addressing engineering-identified improvements. This approach prevented accumulation of critical issues while maintaining development velocity..""}, {""interviewer_response"": ""Interviewer: \n\n\n\nYour approach to engineering collaboration is outstanding. I particularly like your practice of involving engineers directly in user interviews - that kind of early engagement pays dividends in both technical solutions and team alignment. The \""technical debt budget\"" is also an excellent practice that many organizations struggle to implement effectively.\n\nLet's discuss pre-launch and launch strategies. Could you walk me through how you prepare for and execute a product launch? I'm interested in your approach to beta testing, go-to-market planning, success metrics, and cross-functional coordination. If possible, share a specific product launch you managed and what you learned from the experience.."", ""interviewee_response"": ""You answered: Thank you for the kind words about my engineering collaboration approach!\n\nFor product launches, I believe meticulous preparation combined with adaptability is crucial. I approach launches as cross-functional campaigns rather than just engineering milestones.\n\nMy launch process typically begins 2-3 months before the target date with a comprehensive launch plan. At Dialogic AI, when launching our sentiment analytics dashboard, I created a shared document with clear ownership across marketing, sales, customer success, and engineering - with detailed timelines and dependencies mapped out.\n\nFor beta testing, I prefer a tiered approach. I start with friendly users (often 5-7 customers with strong relationships) for initial feedback, then expand to a broader beta cohort (15-20 users) representing different segments. During our dashboard launch, we discovered through beta testing that enterprise users needed different visualization options than SMB users - a critical insight we implemented before general release.\n\nFor go-to-market planning, I establish clear communication channels between teams. I created a weekly \""launch huddle\"" where all stakeholders reported progress and raised blockers. This helped us quickly pivot when we discovered our initial messaging wasn't resonating with healthcare customers.\n\nFor measuring success, I establish both leading indicators (daily active users, feature adoption) and lagging indicators (retention, revenue impact). For our dashboard launch, we created a dedicated analytics dashboard to track these metrics in real-time..""}]"
