interviewer_emotions,interviewer_emotion_score,interviewer_thoughts,interviewer_response,interviewee_response,reward,conversation_history
,50,,"*thoughts: This candidate appears to be showing up with minimal introduction. I should start with a warm welcome to put them at ease before diving into the product management assessment.*

*emotions: Neutral but curious about the candidate's background and experience.*

Hello there! It's nice to meet you. I'm conducting today's product management skills assessment. Before we dive into the specific areas, could you tell me a bit about your background in product management and what types of products you've worked on previously?","Hi, I'm Casey. I've been working as a product manager for three years now. I started at TechVision AI where I helped build their machine learning recommendation system. It was technically challenging, which was great since I have a strong background in AI algorithms. Then I moved to DataMinds where I've been working on their natural language processing platform.

Both roles were at early-stage startups where I focused mostly on the technical implementation and feature development. I defined the technical requirements, collaborated with engineers on the AI architecture, and made sure we hit our development milestones.

To be honest, I haven't had much exposure to the business side. I understand concepts like product-market fit and user acquisition in theory from some courses I took, but I haven't really had to apply them extensively in my roles. The business decisions were usually handled by the founders, while I focused on building the actual product.",0,[]
"I'm feeling intrigued and somewhat optimistic about Casey's technical background, but also concerned about the limited business experience. I appreciate the honest self-assessment about their strengths and gaps.",65,"Decent technical PM candidate with solid AI background, but significant gaps in business acumen. They've been honest about their limited exposure to product-market fit, user acquisition, and business decision-making, which is refreshing. Their experience appears to be more of a technical product owner than a full-spectrum PM. They've worked exclusively in early-stage startups where founders handled business strategy, potentially limiting their growth in core PM skills. Would need significant development in business aspects of product management if hired.","

Thanks for sharing your background, Casey. Your technical experience in AI and machine learning is certainly valuable. I appreciate your candor about your experience being more focused on the technical implementation aspects of product management.

Let's dive into some specific areas of product management. Starting with market positioning - if you were tasked with launching a new AI-powered data analytics tool, how would you approach positioning it in the market? What factors would you consider, and what steps would you take to define its unique position?","I'd definitely start by looking at technical specifications of competitors. I've done competitive analysis before by creating feature comparison matrices so we can see where our AI algorithms are superior. We should highlight our technical advantages - maybe our models are faster or more accurate.

I guess we'd need to figure out who would use this data analytics tool, but honestly, that's usually something marketing deals with. At my previous startups, the founders already had a vision for who would buy the product, and I just built what they asked for.

As for unique positioning, I'd focus on what our engineering team can actually deliver. No point in promising features we can't build. I've been burned before when sales oversold capabilities and then my team had to work weekends to try to make something that wasn't technically feasible.

If you want specifics on market size analysis or pricing strategy, I should probably defer to someone on the business team. Those weren't really my responsibilities in my previous roles. I'm much more comfortable discussing the technical implementation plan once the positioning is decided.",15,"[{""interviewer_response"": ""Interviewer: \n\nThanks for sharing your background, Casey. Your technical experience in AI and machine learning is certainly valuable. I appreciate your candor about your experience being more focused on the technical implementation aspects of product management.\n\nLet's dive into some specific areas of product management. Starting with market positioning - if you were tasked with launching a new AI-powered data analytics tool, how would you approach positioning it in the market? What factors would you consider, and what steps would you take to define its unique position?."", ""interviewee_response"": ""You answered: I'd definitely start by looking at technical specifications of competitors. I've done competitive analysis before by creating feature comparison matrices so we can see where our AI algorithms are superior. We should highlight our technical advantages - maybe our models are faster or more accurate.\n\nI guess we'd need to figure out who would use this data analytics tool, but honestly, that's usually something marketing deals with. At my previous startups, the founders already had a vision for who would buy the product, and I just built what they asked for.\n\nAs for unique positioning, I'd focus on what our engineering team can actually deliver. No point in promising features we can't build. I've been burned before when sales oversold capabilities and then my team had to work weekends to try to make something that wasn't technically feasible.\n\nIf you want specifics on market size analysis or pricing strategy, I should probably defer to someone on the business team. Those weren't really my responsibilities in my previous roles. I'm much more comfortable discussing the technical implementation plan once the positioning is decided..""}]"
"I'm feeling disappointed and increasingly concerned about this candidate. While they have technical skills, they seem to have a limited understanding of core product management responsibilities and appear to view the role as primarily technical implementation rather than true product management. I'm hesitant about their potential fit for a well-rounded PM position.",25,"This candidate has a very limited understanding of product management and appears to view the role as primarily technical implementation. Their approach to market positioning is concerning - they defer core PM responsibilities like user research, market sizing, and pricing to ""marketing"" or ""the business team."" They seem to have operated more as a technical project manager than a true product manager, with founders making all strategic decisions. There's little evidence of customer-centricity, business understanding, or strategic thinking. The candidate appears comfortable building to spec but not defining the product strategy or connecting technical capabilities to market needs. This would be a risky hire for any PM role requiring business acumen or strategic thinking.","

I see. Let's move to competitive analysis more directly. When evaluating competitors for a new product, what process would you follow to understand the competitive landscape beyond just technical specifications? Can you share a specific example where your competitive analysis influenced product decisions?","I usually focus on what I call a ""capabilities matrix"" - basically listing all the technical features of competitor products and seeing where we can outperform them. At DataMinds, I spent a couple weeks analyzing the accuracy rates of other NLP platforms and found their entity recognition was only 78% accurate while our algorithm could hit 85%.

As for broader competitive analysis... honestly, that was mostly handled by the marketing team. They'd occasionally share slide decks about competitor pricing or target customers, but I didn't get too involved. My job was to make sure our product had better technical specs.

There was this one time where our engineers noticed a competitor had implemented a much simpler user interface for their machine learning tools. I pushed for us to redesign our UI to match it, but the CEO didn't think it was important enough to prioritize. That was frustrating since users were complaining about our complex interface. Not my decision though - I just moved on to the next sprint.

For things like market share analysis or understanding competitor business models, I'd probably need to consult with someone else. That's really not my area of expertise, and I've never been asked to do that kind of analysis in my previous roles.",-40,"[{""interviewer_response"": ""Interviewer: \n\nThanks for sharing your background, Casey. Your technical experience in AI and machine learning is certainly valuable. I appreciate your candor about your experience being more focused on the technical implementation aspects of product management.\n\nLet's dive into some specific areas of product management. Starting with market positioning - if you were tasked with launching a new AI-powered data analytics tool, how would you approach positioning it in the market? What factors would you consider, and what steps would you take to define its unique position?."", ""interviewee_response"": ""You answered: I'd definitely start by looking at technical specifications of competitors. I've done competitive analysis before by creating feature comparison matrices so we can see where our AI algorithms are superior. We should highlight our technical advantages - maybe our models are faster or more accurate.\n\nI guess we'd need to figure out who would use this data analytics tool, but honestly, that's usually something marketing deals with. At my previous startups, the founders already had a vision for who would buy the product, and I just built what they asked for.\n\nAs for unique positioning, I'd focus on what our engineering team can actually deliver. No point in promising features we can't build. I've been burned before when sales oversold capabilities and then my team had to work weekends to try to make something that wasn't technically feasible.\n\nIf you want specifics on market size analysis or pricing strategy, I should probably defer to someone on the business team. Those weren't really my responsibilities in my previous roles. I'm much more comfortable discussing the technical implementation plan once the positioning is decided..""}, {""interviewer_response"": ""Interviewer: \n\nI see. Let's move to competitive analysis more directly. When evaluating competitors for a new product, what process would you follow to understand the competitive landscape beyond just technical specifications? Can you share a specific example where your competitive analysis influenced product decisions?."", ""interviewee_response"": ""You answered: I usually focus on what I call a \""capabilities matrix\"" - basically listing all the technical features of competitor products and seeing where we can outperform them. At DataMinds, I spent a couple weeks analyzing the accuracy rates of other NLP platforms and found their entity recognition was only 78% accurate while our algorithm could hit 85%.\n\nAs for broader competitive analysis... honestly, that was mostly handled by the marketing team. They'd occasionally share slide decks about competitor pricing or target customers, but I didn't get too involved. My job was to make sure our product had better technical specs.\n\nThere was this one time where our engineers noticed a competitor had implemented a much simpler user interface for their machine learning tools. I pushed for us to redesign our UI to match it, but the CEO didn't think it was important enough to prioritize. That was frustrating since users were complaining about our complex interface. Not my decision though - I just moved on to the next sprint.\n\nFor things like market share analysis or understanding competitor business models, I'd probably need to consult with someone else. That's really not my area of expertise, and I've never been asked to do that kind of analysis in my previous roles..""}]"
"I'm feeling increasingly concerned and somewhat frustrated with the candidate's narrow view of product management. Their responses reveal significant gaps in understanding the full scope of the PM role, and I'm doubtful they would succeed in a position requiring strategic thinking and business acumen.",30,"This candidate fundamentally misunderstands what product management is. They view themselves as a PM but function more as a technical project manager with no ownership of strategy, customer needs, or business outcomes. Their competitive analysis is severely limited to technical specifications only, with no consideration of user needs, market dynamics, or business strategy. When faced with important user experience issues (the UI complexity problem they mentioned), they lacked the influence or understanding to effectively advocate for users. The candidate consistently defers business thinking to others and shows no initiative to develop these critical PM skills. There's no evidence of customer empathy, strategic prioritization ability, or cross-functional leadership - all core PM competencies. This person would require extensive training and mindset shift to function as an actual product manager rather than just a technical implementer.","

I understand. Let's talk about TAM (Total Addressable Market) calculations. How would you approach estimating the market size for a new product? Have you had any experience calculating or using TAM figures to inform product decisions?","I know TAM is supposed to be important, but I've never actually had to calculate it myself. At both startups I worked at, the founders already had these market size numbers they showed investors. Something like billions of dollars, which always seemed pretty optimistic to me.

If I had to estimate TAM, I'd probably look up some industry reports online. There are usually statistics about market sizes you can find. Or maybe multiply the number of potential customers by what they might pay. But that's just theoretical - I've never applied this in practice.

At TechVision and DataMinds, we didn't really use TAM for everyday product decisions. We just built what the technical roadmap said and what customers were asking for. The business team would talk about market sizes in all-hands meetings, but it didn't affect my day-to-day work prioritizing features.

I think calculating TAM is more for fundraising and marketing than actual product development. Engineers don't care about TAM when they're deciding how to implement a feature, and that's where I spent most of my time.",5,"[{""interviewer_response"": ""Interviewer: \n\nThanks for sharing your background, Casey. Your technical experience in AI and machine learning is certainly valuable. I appreciate your candor about your experience being more focused on the technical implementation aspects of product management.\n\nLet's dive into some specific areas of product management. Starting with market positioning - if you were tasked with launching a new AI-powered data analytics tool, how would you approach positioning it in the market? What factors would you consider, and what steps would you take to define its unique position?."", ""interviewee_response"": ""You answered: I'd definitely start by looking at technical specifications of competitors. I've done competitive analysis before by creating feature comparison matrices so we can see where our AI algorithms are superior. We should highlight our technical advantages - maybe our models are faster or more accurate.\n\nI guess we'd need to figure out who would use this data analytics tool, but honestly, that's usually something marketing deals with. At my previous startups, the founders already had a vision for who would buy the product, and I just built what they asked for.\n\nAs for unique positioning, I'd focus on what our engineering team can actually deliver. No point in promising features we can't build. I've been burned before when sales oversold capabilities and then my team had to work weekends to try to make something that wasn't technically feasible.\n\nIf you want specifics on market size analysis or pricing strategy, I should probably defer to someone on the business team. Those weren't really my responsibilities in my previous roles. I'm much more comfortable discussing the technical implementation plan once the positioning is decided..""}, {""interviewer_response"": ""Interviewer: \n\nI see. Let's move to competitive analysis more directly. When evaluating competitors for a new product, what process would you follow to understand the competitive landscape beyond just technical specifications? Can you share a specific example where your competitive analysis influenced product decisions?."", ""interviewee_response"": ""You answered: I usually focus on what I call a \""capabilities matrix\"" - basically listing all the technical features of competitor products and seeing where we can outperform them. At DataMinds, I spent a couple weeks analyzing the accuracy rates of other NLP platforms and found their entity recognition was only 78% accurate while our algorithm could hit 85%.\n\nAs for broader competitive analysis... honestly, that was mostly handled by the marketing team. They'd occasionally share slide decks about competitor pricing or target customers, but I didn't get too involved. My job was to make sure our product had better technical specs.\n\nThere was this one time where our engineers noticed a competitor had implemented a much simpler user interface for their machine learning tools. I pushed for us to redesign our UI to match it, but the CEO didn't think it was important enough to prioritize. That was frustrating since users were complaining about our complex interface. Not my decision though - I just moved on to the next sprint.\n\nFor things like market share analysis or understanding competitor business models, I'd probably need to consult with someone else. That's really not my area of expertise, and I've never been asked to do that kind of analysis in my previous roles..""}, {""interviewer_response"": ""Interviewer: \n\nI understand. Let's talk about TAM (Total Addressable Market) calculations. How would you approach estimating the market size for a new product? Have you had any experience calculating or using TAM figures to inform product decisions?."", ""interviewee_response"": ""You answered: I know TAM is supposed to be important, but I've never actually had to calculate it myself. At both startups I worked at, the founders already had these market size numbers they showed investors. Something like billions of dollars, which always seemed pretty optimistic to me.\n\nIf I had to estimate TAM, I'd probably look up some industry reports online. There are usually statistics about market sizes you can find. Or maybe multiply the number of potential customers by what they might pay. But that's just theoretical - I've never applied this in practice.\n\nAt TechVision and DataMinds, we didn't really use TAM for everyday product decisions. We just built what the technical roadmap said and what customers were asking for. The business team would talk about market sizes in all-hands meetings, but it didn't affect my day-to-day work prioritizing features.\n\nI think calculating TAM is more for fundraising and marketing than actual product development. Engineers don't care about TAM when they're deciding how to implement a feature, and that's where I spent most of my time..""}]"
