interviewer_emotions,interviewer_emotion_score,interviewer_thoughts,interviewer_response,interviewee_response,reward,conversation_history
"I'm feeling disappointed and now convinced this candidate lacks the fundamental business understanding and strategic perspective needed for product management. Their dismissive attitude toward core PM concepts like TAM is concerning, and I'm not seeing the potential for growth in these critical areas.",20,"This candidate is clearly not a product manager, despite the title. They fundamentally misunderstand the purpose and role of product management in an organization. Their dismissal of market sizing as just ""for fundraising and marketing"" rather than a critical input to product strategy reveals a profound lack of business understanding. They view product development as simply building whatever's on the roadmap or what customers ask for, with no strategic prioritization or business case development. The candidate has been operating in environments where they've been sheltered from true product management responsibilities, focusing exclusively on technical execution. There's also a concerning attitude about business concepts - rather than acknowledging gaps in knowledge and expressing desire to learn, they dismiss these concepts as unimportant to their work. This person would not succeed in any product management role that requires business acumen, strategic thinking, or cross-functional leadership. They would be better suited to a technical product owner or project management role with clear direction from someone else handling the actual product strategy.","



Let's discuss MRD (Market Requirements Document) and PRD (Product Requirements Document) creation. Could you walk me through your process for developing these documents? What elements do you include, and how do you ensure they effectively communicate both market needs and technical requirements?","I'll be honest, I don't have a super formal process for those documents. At TechVision, we mostly used Jira tickets rather than comprehensive PRDs. 

For MRDs, that was usually handled by the founders based on their vision. They'd come to me with what they wanted, and I'd translate that into technical requirements. I never really wrote a full MRD myself.

For PRDs, I focus mainly on the technical specifications - what the feature needs to do, acceptance criteria, and implementation details. I'm pretty good at breaking down complex technical requirements for the engineering team. My PRDs usually include user stories, functional specifications, and technical constraints.

Sometimes I've been told my PRDs are too technical and don't provide enough context on the ""why"" behind features. But that's not really my strength - I'm more concerned with getting the technical details right. If engineers understand how to build it, that's what matters most.

If the business requirements aren't clear, that's not really my fault. I work with what I'm given. There have been times when requirements changed mid-development because someone didn't think through the market needs properly, but that wasn't my responsibility.",-10,"[{""interviewer_response"": ""Interviewer: \n\nThanks for sharing your background, Casey. Your technical experience in AI and machine learning is certainly valuable. I appreciate your candor about your experience being more focused on the technical implementation aspects of product management.\n\nLet's dive into some specific areas of product management. Starting with market positioning - if you were tasked with launching a new AI-powered data analytics tool, how would you approach positioning it in the market? What factors would you consider, and what steps would you take to define its unique position?."", ""interviewee_response"": ""You answered: I'd definitely start by looking at technical specifications of competitors. I've done competitive analysis before by creating feature comparison matrices so we can see where our AI algorithms are superior. We should highlight our technical advantages - maybe our models are faster or more accurate.\n\nI guess we'd need to figure out who would use this data analytics tool, but honestly, that's usually something marketing deals with. At my previous startups, the founders already had a vision for who would buy the product, and I just built what they asked for.\n\nAs for unique positioning, I'd focus on what our engineering team can actually deliver. No point in promising features we can't build. I've been burned before when sales oversold capabilities and then my team had to work weekends to try to make something that wasn't technically feasible.\n\nIf you want specifics on market size analysis or pricing strategy, I should probably defer to someone on the business team. Those weren't really my responsibilities in my previous roles. I'm much more comfortable discussing the technical implementation plan once the positioning is decided..""}, {""interviewer_response"": ""Interviewer: \n\nI see. Let's move to competitive analysis more directly. When evaluating competitors for a new product, what process would you follow to understand the competitive landscape beyond just technical specifications? Can you share a specific example where your competitive analysis influenced product decisions?."", ""interviewee_response"": ""You answered: I usually focus on what I call a \""capabilities matrix\"" - basically listing all the technical features of competitor products and seeing where we can outperform them. At DataMinds, I spent a couple weeks analyzing the accuracy rates of other NLP platforms and found their entity recognition was only 78% accurate while our algorithm could hit 85%.\n\nAs for broader competitive analysis... honestly, that was mostly handled by the marketing team. They'd occasionally share slide decks about competitor pricing or target customers, but I didn't get too involved. My job was to make sure our product had better technical specs.\n\nThere was this one time where our engineers noticed a competitor had implemented a much simpler user interface for their machine learning tools. I pushed for us to redesign our UI to match it, but the CEO didn't think it was important enough to prioritize. That was frustrating since users were complaining about our complex interface. Not my decision though - I just moved on to the next sprint.\n\nFor things like market share analysis or understanding competitor business models, I'd probably need to consult with someone else. That's really not my area of expertise, and I've never been asked to do that kind of analysis in my previous roles..""}, {""interviewer_response"": ""Interviewer: \n\nI understand. Let's talk about TAM (Total Addressable Market) calculations. How would you approach estimating the market size for a new product? Have you had any experience calculating or using TAM figures to inform product decisions?."", ""interviewee_response"": ""You answered: I know TAM is supposed to be important, but I've never actually had to calculate it myself. At both startups I worked at, the founders already had these market size numbers they showed investors. Something like billions of dollars, which always seemed pretty optimistic to me.\n\nIf I had to estimate TAM, I'd probably look up some industry reports online. There are usually statistics about market sizes you can find. Or maybe multiply the number of potential customers by what they might pay. But that's just theoretical - I've never applied this in practice.\n\nAt TechVision and DataMinds, we didn't really use TAM for everyday product decisions. We just built what the technical roadmap said and what customers were asking for. The business team would talk about market sizes in all-hands meetings, but it didn't affect my day-to-day work prioritizing features.\n\nI think calculating TAM is more for fundraising and marketing than actual product development. Engineers don't care about TAM when they're deciding how to implement a feature, and that's where I spent most of my time..""}, {""interviewer_response"": ""Interviewer: \n\n\n\nLet's discuss MRD (Market Requirements Document) and PRD (Product Requirements Document) creation. Could you walk me through your process for developing these documents? What elements do you include, and how do you ensure they effectively communicate both market needs and technical requirements?."", ""interviewee_response"": ""You answered: I'll be honest, I don't have a super formal process for those documents. At TechVision, we mostly used Jira tickets rather than comprehensive PRDs. \n\nFor MRDs, that was usually handled by the founders based on their vision. They'd come to me with what they wanted, and I'd translate that into technical requirements. I never really wrote a full MRD myself.\n\nFor PRDs, I focus mainly on the technical specifications - what the feature needs to do, acceptance criteria, and implementation details. I'm pretty good at breaking down complex technical requirements for the engineering team. My PRDs usually include user stories, functional specifications, and technical constraints.\n\nSometimes I've been told my PRDs are too technical and don't provide enough context on the \""why\"" behind features. But that's not really my strength - I'm more concerned with getting the technical details right. If engineers understand how to build it, that's what matters most.\n\nIf the business requirements aren't clear, that's not really my fault. I work with what I'm given. There have been times when requirements changed mid-development because someone didn't think through the market needs properly, but that wasn't my responsibility..""}]"
"I'm feeling highly concerned and now certain that this candidate is not a good fit for a true product management role. Their responses show a fundamental misalignment with the core responsibilities of product management, and I'm no longer seeing this as a development opportunity but rather a clear mismatch.",25,"This candidate is not a product manager and doesn't understand the fundamental responsibilities of the role. They view themselves as a technical translator rather than a product strategist and decision maker. Their approach to documentation reveals they've been operating as a technical requirements writer, not developing the market understanding or strategic direction that should inform these documents. The dismissive attitude toward providing context and the ""why"" behind features is particularly troubling - this is one of the most critical aspects of product management. Even more concerning is the lack of ownership when requirements change and the deflection of responsibility (""that's not really my fault""). A true product manager would own the problem-solution fit regardless of where initial inputs came from. The candidate continues to demonstrate that they don't see market understanding, customer needs, or business strategy as part of their responsibility. This person would be an extremely poor fit for any product management role that requires strategic thinking, market understanding, or business acumen - which is virtually all PM roles. They might be better suited to a technical product owner or business analyst role with significant oversight.","



I see. Let's move on to discuss your experience working with engineering teams. How do you manage the relationship between product and engineering? Can you describe how you prioritize features and handle technical debt in your product development process?","I work pretty closely with engineering since I understand the technical side well. I usually create a prioritized list of features based on what our technical roadmap says we need to deliver. The engineers typically like working with me because I speak their language and don't ask for impossible things like some product managers do.

For prioritization, I mainly look at what features are technically interesting or challenging. At DataMinds, I created a scoring system for our backlog based on technical complexity and expected performance improvements. Most of our prioritization discussions happen during sprint planning where I present what needs to be built next.

As for technical debt, I'll be honest - we accumulated quite a bit at both startups. Engineers would complain about it, but we were always under pressure to ship new features quickly. When something broke because of rushed code, I'd add bug fixes to the sprint, but there was always resistance from the founders when engineers wanted dedicated time to refactor.

There was this one time at TechVision when our recommendation algorithm kept failing because of some architectural issues. The engineers wanted two sprints to fix the underlying problems, but the CEO insisted we just patch it and keep adding features. Not much I could do about that - they make the final decisions. We just dealt with the occasional outages until we could sneak in fixes between feature work.",5,"[{""interviewer_response"": ""Interviewer: \n\nThanks for sharing your background, Casey. Your technical experience in AI and machine learning is certainly valuable. I appreciate your candor about your experience being more focused on the technical implementation aspects of product management.\n\nLet's dive into some specific areas of product management. Starting with market positioning - if you were tasked with launching a new AI-powered data analytics tool, how would you approach positioning it in the market? What factors would you consider, and what steps would you take to define its unique position?."", ""interviewee_response"": ""You answered: I'd definitely start by looking at technical specifications of competitors. I've done competitive analysis before by creating feature comparison matrices so we can see where our AI algorithms are superior. We should highlight our technical advantages - maybe our models are faster or more accurate.\n\nI guess we'd need to figure out who would use this data analytics tool, but honestly, that's usually something marketing deals with. At my previous startups, the founders already had a vision for who would buy the product, and I just built what they asked for.\n\nAs for unique positioning, I'd focus on what our engineering team can actually deliver. No point in promising features we can't build. I've been burned before when sales oversold capabilities and then my team had to work weekends to try to make something that wasn't technically feasible.\n\nIf you want specifics on market size analysis or pricing strategy, I should probably defer to someone on the business team. Those weren't really my responsibilities in my previous roles. I'm much more comfortable discussing the technical implementation plan once the positioning is decided..""}, {""interviewer_response"": ""Interviewer: \n\nI see. Let's move to competitive analysis more directly. When evaluating competitors for a new product, what process would you follow to understand the competitive landscape beyond just technical specifications? Can you share a specific example where your competitive analysis influenced product decisions?."", ""interviewee_response"": ""You answered: I usually focus on what I call a \""capabilities matrix\"" - basically listing all the technical features of competitor products and seeing where we can outperform them. At DataMinds, I spent a couple weeks analyzing the accuracy rates of other NLP platforms and found their entity recognition was only 78% accurate while our algorithm could hit 85%.\n\nAs for broader competitive analysis... honestly, that was mostly handled by the marketing team. They'd occasionally share slide decks about competitor pricing or target customers, but I didn't get too involved. My job was to make sure our product had better technical specs.\n\nThere was this one time where our engineers noticed a competitor had implemented a much simpler user interface for their machine learning tools. I pushed for us to redesign our UI to match it, but the CEO didn't think it was important enough to prioritize. That was frustrating since users were complaining about our complex interface. Not my decision though - I just moved on to the next sprint.\n\nFor things like market share analysis or understanding competitor business models, I'd probably need to consult with someone else. That's really not my area of expertise, and I've never been asked to do that kind of analysis in my previous roles..""}, {""interviewer_response"": ""Interviewer: \n\nI understand. Let's talk about TAM (Total Addressable Market) calculations. How would you approach estimating the market size for a new product? Have you had any experience calculating or using TAM figures to inform product decisions?."", ""interviewee_response"": ""You answered: I know TAM is supposed to be important, but I've never actually had to calculate it myself. At both startups I worked at, the founders already had these market size numbers they showed investors. Something like billions of dollars, which always seemed pretty optimistic to me.\n\nIf I had to estimate TAM, I'd probably look up some industry reports online. There are usually statistics about market sizes you can find. Or maybe multiply the number of potential customers by what they might pay. But that's just theoretical - I've never applied this in practice.\n\nAt TechVision and DataMinds, we didn't really use TAM for everyday product decisions. We just built what the technical roadmap said and what customers were asking for. The business team would talk about market sizes in all-hands meetings, but it didn't affect my day-to-day work prioritizing features.\n\nI think calculating TAM is more for fundraising and marketing than actual product development. Engineers don't care about TAM when they're deciding how to implement a feature, and that's where I spent most of my time..""}, {""interviewer_response"": ""Interviewer: \n\n\n\nLet's discuss MRD (Market Requirements Document) and PRD (Product Requirements Document) creation. Could you walk me through your process for developing these documents? What elements do you include, and how do you ensure they effectively communicate both market needs and technical requirements?."", ""interviewee_response"": ""You answered: I'll be honest, I don't have a super formal process for those documents. At TechVision, we mostly used Jira tickets rather than comprehensive PRDs. \n\nFor MRDs, that was usually handled by the founders based on their vision. They'd come to me with what they wanted, and I'd translate that into technical requirements. I never really wrote a full MRD myself.\n\nFor PRDs, I focus mainly on the technical specifications - what the feature needs to do, acceptance criteria, and implementation details. I'm pretty good at breaking down complex technical requirements for the engineering team. My PRDs usually include user stories, functional specifications, and technical constraints.\n\nSometimes I've been told my PRDs are too technical and don't provide enough context on the \""why\"" behind features. But that's not really my strength - I'm more concerned with getting the technical details right. If engineers understand how to build it, that's what matters most.\n\nIf the business requirements aren't clear, that's not really my fault. I work with what I'm given. There have been times when requirements changed mid-development because someone didn't think through the market needs properly, but that wasn't my responsibility..""}, {""interviewer_response"": ""Interviewer: \n\n\n\nI see. Let's move on to discuss your experience working with engineering teams. How do you manage the relationship between product and engineering? Can you describe how you prioritize features and handle technical debt in your product development process?."", ""interviewee_response"": ""You answered: I work pretty closely with engineering since I understand the technical side well. I usually create a prioritized list of features based on what our technical roadmap says we need to deliver. The engineers typically like working with me because I speak their language and don't ask for impossible things like some product managers do.\n\nFor prioritization, I mainly look at what features are technically interesting or challenging. At DataMinds, I created a scoring system for our backlog based on technical complexity and expected performance improvements. Most of our prioritization discussions happen during sprint planning where I present what needs to be built next.\n\nAs for technical debt, I'll be honest - we accumulated quite a bit at both startups. Engineers would complain about it, but we were always under pressure to ship new features quickly. When something broke because of rushed code, I'd add bug fixes to the sprint, but there was always resistance from the founders when engineers wanted dedicated time to refactor.\n\nThere was this one time at TechVision when our recommendation algorithm kept failing because of some architectural issues. The engineers wanted two sprints to fix the underlying problems, but the CEO insisted we just patch it and keep adding features. Not much I could do about that - they make the final decisions. We just dealt with the occasional outages until we could sneak in fixes between feature work..""}]"
