interviewer_emotions,interviewer_emotion_score,interviewer_thoughts,interviewer_response,interviewee_response,reward,conversation_history
"I'm feeling confirmed in my assessment that this candidate lacks the core competencies of product management. Their technical background could be valuable, but their approach to the role is fundamentally misaligned with what product management should be. I'm now certain they wouldn't be successful in a true PM position without significant mindset change.",30,"This candidate continues to demonstrate they are not a product manager by traditional definition. Their approach to prioritization is deeply concerning - they prioritize based on what's ""technically interesting"" rather than customer value or business impact. They view roadmapping as a primarily technical exercise rather than a strategic one. There's no mention of customer needs, business objectives, or data-driven decision making in their prioritization process. The technical debt situation reveals poor product leadership - rather than advocate effectively for balance between new features and stability, they simply accepted technical debt accumulation as inevitable. Most troubling is the consistent pattern of abdication of responsibility and leadership. Throughout the interview, they've repeatedly described situations where they simply implemented what others decided rather than driving the product strategy themselves. Their reference to ""they make the final decisions"" about technical debt shows they don't view themselves as accountable for the health of the product. This candidate would struggle significantly in any environment expecting actual product leadership, strategic thinking, or business acumen from their PMs. They operate more as a technical liaison or project manager than a true product manager.","





Let's talk about the pre-launch and launch phases of product development. Walk me through how you prepare a product for market launch, including how you determine launch readiness and what metrics you establish to measure launch success.","I'm generally not that involved in market launch planning - that's usually more of a marketing function. At TechVision, we had a pretty basic approach: once the features were working according to the technical specs, we'd just push it live. There wasn't much of a formal readiness assessment beyond ""does it work?""

For metrics, I mainly track technical KPIs like system performance, error rates, and algorithm accuracy. At DataMinds, we launched our NLP platform when it hit 85% accuracy in our internal tests, but we didn't really have a comprehensive launch plan. Marketing just sent some emails when we told them it was ready.

One time, we pushed a major feature update that had some bugs we didn't catch because we were rushing to meet a deadline the CEO set. Users were pretty upset, but that wasn't really my fault - QA should have caught those issues.

As for success metrics, engineering usually looked at adoption rates and whether the system was stable under load. The business team probably had other metrics they cared about, like conversion or revenue, but they didn't really share that data with me. They'd just come back with new feature requests regardless of how the launch performed.

If you're asking about things like go-to-market strategy or pricing adjustments for launch, that was all handled by other teams. I just made sure the product worked technically.",5,"[{""interviewer_response"": ""Interviewer: \n\nThanks for sharing your background, Casey. Your technical experience in AI and machine learning is certainly valuable. I appreciate your candor about your experience being more focused on the technical implementation aspects of product management.\n\nLet's dive into some specific areas of product management. Starting with market positioning - if you were tasked with launching a new AI-powered data analytics tool, how would you approach positioning it in the market? What factors would you consider, and what steps would you take to define its unique position?."", ""interviewee_response"": ""You answered: I'd definitely start by looking at technical specifications of competitors. I've done competitive analysis before by creating feature comparison matrices so we can see where our AI algorithms are superior. We should highlight our technical advantages - maybe our models are faster or more accurate.\n\nI guess we'd need to figure out who would use this data analytics tool, but honestly, that's usually something marketing deals with. At my previous startups, the founders already had a vision for who would buy the product, and I just built what they asked for.\n\nAs for unique positioning, I'd focus on what our engineering team can actually deliver. No point in promising features we can't build. I've been burned before when sales oversold capabilities and then my team had to work weekends to try to make something that wasn't technically feasible.\n\nIf you want specifics on market size analysis or pricing strategy, I should probably defer to someone on the business team. Those weren't really my responsibilities in my previous roles. I'm much more comfortable discussing the technical implementation plan once the positioning is decided..""}, {""interviewer_response"": ""Interviewer: \n\nI see. Let's move to competitive analysis more directly. When evaluating competitors for a new product, what process would you follow to understand the competitive landscape beyond just technical specifications? Can you share a specific example where your competitive analysis influenced product decisions?."", ""interviewee_response"": ""You answered: I usually focus on what I call a \""capabilities matrix\"" - basically listing all the technical features of competitor products and seeing where we can outperform them. At DataMinds, I spent a couple weeks analyzing the accuracy rates of other NLP platforms and found their entity recognition was only 78% accurate while our algorithm could hit 85%.\n\nAs for broader competitive analysis... honestly, that was mostly handled by the marketing team. They'd occasionally share slide decks about competitor pricing or target customers, but I didn't get too involved. My job was to make sure our product had better technical specs.\n\nThere was this one time where our engineers noticed a competitor had implemented a much simpler user interface for their machine learning tools. I pushed for us to redesign our UI to match it, but the CEO didn't think it was important enough to prioritize. That was frustrating since users were complaining about our complex interface. Not my decision though - I just moved on to the next sprint.\n\nFor things like market share analysis or understanding competitor business models, I'd probably need to consult with someone else. That's really not my area of expertise, and I've never been asked to do that kind of analysis in my previous roles..""}, {""interviewer_response"": ""Interviewer: \n\nI understand. Let's talk about TAM (Total Addressable Market) calculations. How would you approach estimating the market size for a new product? Have you had any experience calculating or using TAM figures to inform product decisions?."", ""interviewee_response"": ""You answered: I know TAM is supposed to be important, but I've never actually had to calculate it myself. At both startups I worked at, the founders already had these market size numbers they showed investors. Something like billions of dollars, which always seemed pretty optimistic to me.\n\nIf I had to estimate TAM, I'd probably look up some industry reports online. There are usually statistics about market sizes you can find. Or maybe multiply the number of potential customers by what they might pay. But that's just theoretical - I've never applied this in practice.\n\nAt TechVision and DataMinds, we didn't really use TAM for everyday product decisions. We just built what the technical roadmap said and what customers were asking for. The business team would talk about market sizes in all-hands meetings, but it didn't affect my day-to-day work prioritizing features.\n\nI think calculating TAM is more for fundraising and marketing than actual product development. Engineers don't care about TAM when they're deciding how to implement a feature, and that's where I spent most of my time..""}, {""interviewer_response"": ""Interviewer: \n\n\n\nLet's discuss MRD (Market Requirements Document) and PRD (Product Requirements Document) creation. Could you walk me through your process for developing these documents? What elements do you include, and how do you ensure they effectively communicate both market needs and technical requirements?."", ""interviewee_response"": ""You answered: I'll be honest, I don't have a super formal process for those documents. At TechVision, we mostly used Jira tickets rather than comprehensive PRDs. \n\nFor MRDs, that was usually handled by the founders based on their vision. They'd come to me with what they wanted, and I'd translate that into technical requirements. I never really wrote a full MRD myself.\n\nFor PRDs, I focus mainly on the technical specifications - what the feature needs to do, acceptance criteria, and implementation details. I'm pretty good at breaking down complex technical requirements for the engineering team. My PRDs usually include user stories, functional specifications, and technical constraints.\n\nSometimes I've been told my PRDs are too technical and don't provide enough context on the \""why\"" behind features. But that's not really my strength - I'm more concerned with getting the technical details right. If engineers understand how to build it, that's what matters most.\n\nIf the business requirements aren't clear, that's not really my fault. I work with what I'm given. There have been times when requirements changed mid-development because someone didn't think through the market needs properly, but that wasn't my responsibility..""}, {""interviewer_response"": ""Interviewer: \n\n\n\nI see. Let's move on to discuss your experience working with engineering teams. How do you manage the relationship between product and engineering? Can you describe how you prioritize features and handle technical debt in your product development process?."", ""interviewee_response"": ""You answered: I work pretty closely with engineering since I understand the technical side well. I usually create a prioritized list of features based on what our technical roadmap says we need to deliver. The engineers typically like working with me because I speak their language and don't ask for impossible things like some product managers do.\n\nFor prioritization, I mainly look at what features are technically interesting or challenging. At DataMinds, I created a scoring system for our backlog based on technical complexity and expected performance improvements. Most of our prioritization discussions happen during sprint planning where I present what needs to be built next.\n\nAs for technical debt, I'll be honest - we accumulated quite a bit at both startups. Engineers would complain about it, but we were always under pressure to ship new features quickly. When something broke because of rushed code, I'd add bug fixes to the sprint, but there was always resistance from the founders when engineers wanted dedicated time to refactor.\n\nThere was this one time at TechVision when our recommendation algorithm kept failing because of some architectural issues. The engineers wanted two sprints to fix the underlying problems, but the CEO insisted we just patch it and keep adding features. Not much I could do about that - they make the final decisions. We just dealt with the occasional outages until we could sneak in fixes between feature work..""}, {""interviewer_response"": ""Interviewer: \n\n\n\n\n\nLet's talk about the pre-launch and launch phases of product development. Walk me through how you prepare a product for market launch, including how you determine launch readiness and what metrics you establish to measure launch success.."", ""interviewee_response"": ""You answered: I'm generally not that involved in market launch planning - that's usually more of a marketing function. At TechVision, we had a pretty basic approach: once the features were working according to the technical specs, we'd just push it live. There wasn't much of a formal readiness assessment beyond \""does it work?\""\n\nFor metrics, I mainly track technical KPIs like system performance, error rates, and algorithm accuracy. At DataMinds, we launched our NLP platform when it hit 85% accuracy in our internal tests, but we didn't really have a comprehensive launch plan. Marketing just sent some emails when we told them it was ready.\n\nOne time, we pushed a major feature update that had some bugs we didn't catch because we were rushing to meet a deadline the CEO set. Users were pretty upset, but that wasn't really my fault - QA should have caught those issues.\n\nAs for success metrics, engineering usually looked at adoption rates and whether the system was stable under load. The business team probably had other metrics they cared about, like conversion or revenue, but they didn't really share that data with me. They'd just come back with new feature requests regardless of how the launch performed.\n\nIf you're asking about things like go-to-market strategy or pricing adjustments for launch, that was all handled by other teams. I just made sure the product worked technically..""}]"
