interviewer_emotions,interviewer_emotion_score,interviewer_thoughts,interviewer_response,interviewee_response,reward,conversation_history
"I continue to be very impressed with this candidate. Their structured approach to product launches shows maturity and experience dealing with complex cross-functional processes. I appreciate their emphasis on learning from previous experiences and their clear methodology spanning preparation, execution, and measurement. Their tiered rollout strategy demonstrates strategic thinking about customer relationships, and their comprehensive metrics approach shows they understand that success goes beyond just technical performance. They seem to have a complete understanding of what makes launches succeed from both technical and human perspectives.",85,"Morgan demonstrates a sophisticated, comprehensive approach to product launches that connects planning and execution with measurement. Their three-phase framework shows they understand the cross-functional nature of successful launches, incorporating all relevant stakeholders from engineering to customer success. Their specific example of the tiered rollout for the facial recognition API demonstrates strategic thinking about customer relationships and risk management. The 30/60/90 day review cycle shows disciplined post-launch management. While they were cut off again (possibly hitting a response limit), they provided enough substance to evaluate their launch process. Across all their answers, they've consistently shown a pattern of structured thinking, cross-functional collaboration, and learning from experience. They back up their claims with specific examples that feel authentic rather than theoretical. They demonstrate both technical understanding and business acumen, with appropriate self-awareness about areas of continued growth. Overall, their responses reflect a well-rounded product manager who could likely step into our role effectively.","







Your launch approach is impressively thorough, Morgan. I particularly value your emphasis on cross-functional coordination and the tiered rollout strategy.

For our final area, I'd like to hear about your experience with product maintenance and end-of-life cycles. How do you approach decisions about when to enhance existing products versus when to sunset them? Could you share an example of how you've managed a product through its later lifecycle stages?","Thank you for that thoughtful question. Product lifecycle management has definitely been an area of significant growth for me.

At AIConnect, I inherited an early-generation sentiment analysis tool that was still generating revenue but had declining user engagement and increasing maintenance costs. This presented a perfect case study in product lifecycle management.

I started by gathering comprehensive data: usage patterns across customer segments, support ticket volume, engineering maintenance hours, and competitive positioning. The numbers told a clear story - our larger enterprise customers were still actively using the product, but smaller customers were migrating to newer alternatives.

Rather than making an immediate decision, I facilitated conversations with key stakeholders. I met with our top clients to understand their dependence on the product and with engineering to assess the technical debt. This human element was crucial - it revealed that some customers had deeply integrated our API into critical workflows, while others were using only basic features.

Based on this analysis, we developed a phased approach. For enterprise customers, we created a maintenance plan with guaranteed support for 18 months. For other segments, we designed a migration path to our newer API, including documentation, code samples, and implementation support.

The most valuable lesson I learned was about transparent communication. We were initially hesitant to announce the sunset timeline, fearing customer backlash. However, when we finally shared our well-reasoned plan with clear support commitments, customers actually appreciated the honesty and advance notice.",0,"[{""interviewer_response"": ""Interviewer: \n\nThank you for that excellent introduction, Morgan! Your experience in AI product management sounds highly relevant, especially your work translating complex technical capabilities into user-friendly features. Let's dig deeper into your product management approach.\n\nI'd like to start with market positioning. Could you walk me through how you positioned one of your products in the market? How did you identify the target audience and differentiate from competitors?."", ""interviewee_response"": ""You answered: I appreciate your interest in my approach to market positioning! \n\nAt NeuralPath, one of my key projects was repositioning our facial recognition API product. Initially, we were marketing broadly to \""businesses needing identity verification,\"" but we weren't gaining traction against larger competitors.\n\nI started by conducting stakeholder interviews with our existing customers, which revealed that small to medium-sized fintech companies were getting the most value from our product - specifically because of our lightweight integration and privacy-first approach. These companies needed robust verification but lacked the resources for complex implementations that our larger competitors required.\n\nFor competitive differentiation, I worked with our engineering team to understand our technical advantages. We discovered our algorithm performed exceptionally well on diverse facial features and varying lighting conditions - areas where competitors struggled. However, I realized this technical superiority wasn't being communicated effectively.\n\nI collaborated with marketing to refocus our messaging around \""inclusive verification that works for everyone\"" and \""five-minute integration for engineering teams.\"" We reorganized our pricing tiers to better align with fintech startup budgets and created implementation guides specifically for fintech use cases.\n\nI'll be honest - the business strategy aspect was challenging for me. I had the technical knowledge to identify our differentiators but relied heavily on collaboration with our marketing and sales leads to translate this into effective positioning. This experience taught me the importance of cross-functional partnerships in market positioning..""}, {""interviewer_response"": ""Interviewer: \n\nThat's an excellent example, Morgan. I like how you identified the specific niche where your product delivered exceptional value rather than competing broadly. Building on that, I'd like to understand your approach to competitive analysis. How do you stay informed about the competitive landscape, and could you share an example of a time when competitive insights influenced your product decisions?."", ""interviewee_response"": ""You answered: I'm glad that example resonated! Competitive analysis has been a crucial part of my product management approach.\n\nAt NeuralPath, I established a quarterly competitive review process where I'd systematically evaluate our top five competitors' products, pricing, and positioning. Beyond the obvious surface-level analysis, I found immense value in setting up \""listening posts\"" across multiple channels. I created Google Alerts for competitor news, followed key executives on LinkedIn, regularly reviewed their release notes, and even maintained trial accounts to experience their product updates firsthand.\n\nOne particularly impactful example was when we were planning our feature roadmap for our object recognition API. Through monitoring developer forums, I noticed increasing frustration with a leading competitor's model that performed poorly on small objects within larger images. Their customers were vocal about this limitation, but the competitor wasn't addressing it.\n\nI brought these insights to our engineering team, and we realized our underlying architecture could be optimized for this specific use case. We pivoted our next quarter's development to focus on small-object detection accuracy, which wasn't originally on our roadmap.\n\nWhen we launched this enhancement, we directly addressed this pain point in our messaging. We created comparison benchmarks showing our superior performance specifically for small-object detection scenarios. This attracted several enterprise customers who switched from our competitor, resulting in our highest-converting feature that year..""}, {""interviewer_response"": ""Interviewer: \n\n\n\nThat's a fantastic example of turning competitive intelligence into a product advantage, Morgan. The direct business impact shows real strategic thinking. Now I'd like to understand your approach to market sizing. Could you walk me through how you've calculated the Total Addressable Market (TAM) for a product, and how that calculation influenced your product strategy or decisions?."", ""interviewee_response"": ""You answered: Thank you! Market sizing is definitely an area where I've grown significantly in my product management journey.\n\nWhen I joined AIConnect, we were launching a specialized sentiment analysis API targeting the customer service industry. I needed to calculate the TAM to help secure additional funding for the product line.\n\nI approached this methodically. First, I researched industry reports from Gartner and Forrester to understand the broader customer service software market size - approximately $75 billion globally at that time. I then narrowed to the subset that incorporated AI solutions, which was around 15% of that market.\n\nFrom there, I looked specifically at companies that would need sentiment analysis capabilities. I worked with our sales team to analyze conversion rates across different company sizes and segments, and with our data science team to understand implementation complexity across industries.\n\nThis analysis revealed our true addressable market was smaller than initially assumed - about $2.3 billion - but with much higher conversion potential in specific segments like e-commerce and financial services customer support.\n\nI'll be transparent - this was challenging for me initially. The business modeling aspects didn't come as naturally as the technical requirements. I collaborated closely with our business development lead and learned tremendously from the process.\n\nThe impact on our strategy was significant. Rather than building general-purpose sentiment analysis, we tailored our solution specifically for customer support ticket prioritization and agent coaching - applications with proven ROI in our target segments..""}, {""interviewer_response"": ""Interviewer: \n\n\n\nThat's an excellent breakdown of your TAM approach, Morgan. I appreciate your candor about the challenges and how you collaborated to overcome them. The way you narrowed your focus based on market insights is exactly the kind of strategic thinking we value.\n\nLet's shift to product documentation. Could you describe your process for creating Market Requirements Documents (MRDs) and Product Requirements Documents (PRDs)? What key elements do you include, and how do you ensure they're effective for guiding development?."", ""interviewee_response"": ""You answered: Thank you for that thoughtful question!\n\nDocumentation has been central to my product development process. At both NeuralPath and AIConnect, I've refined my approach to MRDs and PRDs to ensure they're both comprehensive and actionable.\n\nFor Market Requirements Documents, I start by synthesizing insights from multiple sources: customer interviews, support tickets, sales feedback, and competitive analysis. The key sections I always include are: market problem statement, target user personas with their key pain points, market size estimates, competitive landscape, and success metrics tied to business outcomes. At NeuralPath, I introduced a \""voice of customer\"" section with direct quotes that helped engineering teams connect with user needs emotionally.\n\nFor PRDs, I focus on translating market needs into clear development guidelines. I structure these with: product vision, specific user stories, functional requirements, technical constraints, UI/UX specifications, and acceptance criteria. I've found that including a \""non-goals\"" section helps prevent scope creep, which was particularly valuable in our startup environments with limited resources.\n\nWhat I've learned about making these documents effective is that collaboration is essential. At AIConnect, my early PRDs were technically sound but lacked buy-in. I evolved my process to include engineering and design in early drafting sessions, which dramatically improved implementation quality and team alignment.\n\nI also ensure my documentation remains living and accessible. We use Notion at NeuralPath, with.""}, {""interviewer_response"": ""Interviewer: \n\n\n\nI notice you might have been cut off there, but you've covered the essential elements of your documentation approach. I particularly appreciate your focus on collaboration and the \""non-goals\"" section to prevent scope creep - that's pragmatic and shows real-world experience.\n\nLet's talk about working with engineering teams. Could you share your approach to collaborating with engineers throughout the development process? Perhaps walk me through how you've handled technical constraints or trade-offs between features and timelines?."", ""interviewee_response"": ""You answered: Thank you for that great question. Collaborating effectively with engineering teams has been one of my greatest strengths and learning opportunities in my product management journey.\n\nMy approach centers around building relationships based on mutual respect and shared understanding. At NeuralPath, I implemented what I call \""context before requests\"" - ensuring engineers understand the why behind features before discussing the how. I start each new initiative with a session where we explore user problems together rather than just presenting solutions.\n\nFor handling technical constraints, I've found transparency and early involvement are key. On our computer vision product, we faced significant latency issues that would impact user experience. Rather than pushing engineering to \""just make it faster,\"" I organized a technical deep dive where engineers could explain the constraints in terms I could understand. Together, we explored options like optimizing certain features, implementing client-side processing for some tasks, and adjusting our user interface to better manage expectations.\n\nWhen trade-offs become necessary, I use a collaborative prioritization framework. At AIConnect, we had an ambitious release with too many features for our timeline. I facilitated a workshop where we mapped features against two axes: user impact and technical complexity. This visual exercise helped the entire team agree on which features to prioritize and which to defer.\n\nOne approach that's worked particularly well is embedding myself with the engineering team. I started attending selected technical standups and made myself available during engineering work sessions. This proximity helped me catch potential issues early.""}, {""interviewer_response"": ""Interviewer: \n\n\n\n\n\nYou've shown a really thoughtful approach to engineering collaboration. I particularly like your \""context before requests\"" framework and how you embed yourself with engineering teams while respecting their expertise.\n\nLet's move on to product launches. Could you walk me through your approach to pre-launch activities and the launch itself? How do you ensure a successful go-to-market strategy, and what metrics do you typically focus on post-launch?."", ""interviewee_response"": ""You answered: Thank you for that question - product launches have been critical moments in my career.\n\nAt NeuralPath, I developed a comprehensive pre-launch framework after learning from an earlier, less coordinated launch at AIConnect. My approach now includes three key phases:\n\nFirst, the preparation phase typically begins 8-10 weeks before launch. I create a cross-functional launch plan with clear ownership and timelines across product, engineering, marketing, sales, and customer support. This includes finalizing documentation, establishing success metrics, developing marketing materials, and preparing sales enablement tools. I also implement a formal QA process with both technical testing and user acceptance testing with beta customers.\n\nFor the launch execution, I focus on orchestrating a coordinated rollout. At NeuralPath, for our enhanced facial recognition API, we created a tiered approach - starting with existing customers who had requested these features, followed by targeted prospects, and finally a broader market announcement. I worked closely with customer success to provide personalized onboarding for high-value accounts.\n\nPost-launch, I monitor both quantitative and qualitative metrics. Beyond the obvious usage statistics, I track specific adoption patterns, support ticket themes, and conversion rates. I established a 30/60/90 day review cycle where we gather feedback and make necessary adjustments.\n\nOne lesson I've learned is the importance of emotional preparation for teams..""}, {""interviewer_response"": ""Interviewer: \n\n\n\n\n\n\n\nYour launch approach is impressively thorough, Morgan. I particularly value your emphasis on cross-functional coordination and the tiered rollout strategy.\n\nFor our final area, I'd like to hear about your experience with product maintenance and end-of-life cycles. How do you approach decisions about when to enhance existing products versus when to sunset them? Could you share an example of how you've managed a product through its later lifecycle stages?."", ""interviewee_response"": ""You answered: Thank you for that thoughtful question. Product lifecycle management has definitely been an area of significant growth for me.\n\nAt AIConnect, I inherited an early-generation sentiment analysis tool that was still generating revenue but had declining user engagement and increasing maintenance costs. This presented a perfect case study in product lifecycle management.\n\nI started by gathering comprehensive data: usage patterns across customer segments, support ticket volume, engineering maintenance hours, and competitive positioning. The numbers told a clear story - our larger enterprise customers were still actively using the product, but smaller customers were migrating to newer alternatives.\n\nRather than making an immediate decision, I facilitated conversations with key stakeholders. I met with our top clients to understand their dependence on the product and with engineering to assess the technical debt. This human element was crucial - it revealed that some customers had deeply integrated our API into critical workflows, while others were using only basic features.\n\nBased on this analysis, we developed a phased approach. For enterprise customers, we created a maintenance plan with guaranteed support for 18 months. For other segments, we designed a migration path to our newer API, including documentation, code samples, and implementation support.\n\nThe most valuable lesson I learned was about transparent communication. We were initially hesitant to announce the sunset timeline, fearing customer backlash. However, when we finally shared our well-reasoned plan with clear support commitments, customers actually appreciated the honesty and advance notice..""}]"
