interviewer_emotions,interviewer_emotion_score,interviewer_thoughts,interviewer_response,interviewee_response,reward,conversation_history
,50,,"*thoughts: New candidate. Let's start with a friendly introduction and then move into the product management assessment.*

*emotions: Curious, open-minded, ready to engage*

Hi there! Thanks for joining us today. I'm looking forward to learning more about your product management experience. Today, we'll explore several key areas of product management to understand your approach and expertise.

Let's start with market positioning. Could you walk me through how you typically approach positioning a new product in the market? Perhaps you could share a specific example from your experience.","Hi there! Thanks for having me today. I'm really excited about this opportunity!

When positioning a new product, I believe in starting with deep customer understanding. At my current startup, Pathfinder AI, we developed a natural language processing tool for content creators. My approach involved:

First, conducting extensive user interviews with our target audience to identify their pain points. I personally led 25+ user sessions to hear directly from content creators about their workflow challenges.

Next, mapping the competitive landscape to find our unique value proposition. We discovered that while many tools offered grammar checking, none provided real-time tone and brand voice alignment.

From there, I worked closely with marketing to craft messaging that emphasized our differentiator: ""AI that preserves your authentic voice while enhancing your content quality.""

We then validated this positioning through A/B testing of landing page messaging and measured engagement metrics to refine our approach.

What made this successful was bringing together customer insights, technical capabilities, and business objectives into a cohesive story that resonated with our users. I find the human element of positioning just as important as the data - understanding the emotional needs behind feature requests often reveals the most compelling value proposition.",0,[]
"I'm feeling engaged and impressed by this candidate's structured approach. Their example shows real experience with a clear methodology. I appreciate how they balanced customer research, competitive analysis, and testing in their answer. I'm warming up to them and curious to hear more specific details about their work.",75,"This candidate is demonstrating solid product management fundamentals. They've shared a concrete example from their startup with a clear methodology that covers the key aspects of positioning - customer research (with quantifiable detail of 25+ sessions), competitive analysis, value proposition development, and validation. They show understanding of both the analytical and emotional aspects of product work. Their answer suggests hands-on experience rather than theoretical knowledge. I'd like to probe deeper on metrics and outcomes to evaluate impact, but this is a promising start that demonstrates both technical and interpersonal competence.","

That's a strong example! I appreciate how you integrated user research directly into your positioning strategy. The focus on finding that gap in the market around tone and brand voice is particularly interesting.

Let's move to competitive analysis. Beyond finding your unique value proposition, how do you typically structure a competitive analysis? And I'm curious - for your NLP tool, how did you anticipate competitors' potential responses to your market entry?","Thank you for the positive feedback! I'm passionate about finding those unmet needs that can truly differentiate a product.

For competitive analysis, I use a structured approach that combines both quantitative and qualitative elements:

1. First, I create a comprehensive competitor matrix mapping key features, pricing models, target audiences, and go-to-market strategies. For our NLP tool, I tracked 8 direct competitors and 4 adjacent solutions.

2. Then I go deeper by actually using competitors' products myself. I believe in experiencing the user journey firsthand rather than just reading about features. This hands-on testing revealed usability gaps in competitor offerings that our engineering team might not have discovered otherwise.

3. I also gather sentiment analysis from user reviews and social media to understand emotional pain points with existing solutions.

For anticipating competitive responses to our market entry, I led cross-functional workshops with our engineering, marketing, and sales teams to game out scenarios. We identified that larger competitors would likely respond by:

1. Bundling similar features into their existing offerings at no additional cost
2. Highlighting our startup status as a potential reliability concern

To counter these, we preemptively built a robust early adopter program with influential content creators who became our advocates, and we focused on integration capabilities that would make our tool complementary rather than competitive to existing workflows.",25,"[{""interviewer_response"": ""Interviewer: \n\nThat's a strong example! I appreciate how you integrated user research directly into your positioning strategy. The focus on finding that gap in the market around tone and brand voice is particularly interesting.\n\nLet's move to competitive analysis. Beyond finding your unique value proposition, how do you typically structure a competitive analysis? And I'm curious - for your NLP tool, how did you anticipate competitors' potential responses to your market entry?."", ""interviewee_response"": ""You answered: Thank you for the positive feedback! I'm passionate about finding those unmet needs that can truly differentiate a product.\n\nFor competitive analysis, I use a structured approach that combines both quantitative and qualitative elements:\n\n1. First, I create a comprehensive competitor matrix mapping key features, pricing models, target audiences, and go-to-market strategies. For our NLP tool, I tracked 8 direct competitors and 4 adjacent solutions.\n\n2. Then I go deeper by actually using competitors' products myself. I believe in experiencing the user journey firsthand rather than just reading about features. This hands-on testing revealed usability gaps in competitor offerings that our engineering team might not have discovered otherwise.\n\n3. I also gather sentiment analysis from user reviews and social media to understand emotional pain points with existing solutions.\n\nFor anticipating competitive responses to our market entry, I led cross-functional workshops with our engineering, marketing, and sales teams to game out scenarios. We identified that larger competitors would likely respond by:\n\n1. Bundling similar features into their existing offerings at no additional cost\n2. Highlighting our startup status as a potential reliability concern\n\nTo counter these, we preemptively built a robust early adopter program with influential content creators who became our advocates, and we focused on integration capabilities that would make our tool complementary rather than competitive to existing workflows..""}]"
I'm feeling increasingly enthusiastic about this candidate. Their detailed and methodical approach to competitive analysis shows strong strategic thinking. I appreciate that they don't just rely on surface-level research but actually use competitors' products themselves. Their foresight in anticipating competitive responses demonstrates real product leadership experience. I'm genuinely impressed and excited about their potential.,85,"This candidate continues to demonstrate a sophisticated understanding of product management with concrete examples. Their competitive analysis approach is comprehensive and shows both analytical rigor (the competitor matrix with specific numbers) and user-centric thinking (hands-on testing, sentiment analysis). Most impressive is their proactive strategy for competitive responses - they didn't just analyze the market but prepared tactical countermeasures with cross-functional input. The early adopter program and focus on integrations shows strategic thinking and go-to-market savvy. They're showing strong evidence of both systematic methodology and practical execution experience. This isn't theoretical knowledge - they've clearly done this work before and understand the nuances of competitive positioning.","

That's excellent. Your hands-on approach to competitor analysis and proactive strategy for potential competitive responses shows real depth. I particularly like how you leveraged early adopters as advocates - very smart positioning move.

Let's shift to TAM calculation. Could you walk me through your methodology for calculating Total Addressable Market for a new product? With your NLP tool example or another product you've worked on, how did you approach sizing the market opportunity, and how did that influence your product strategy?","Thank you for the kind words! Market sizing is a fascinating process that combines art and science.

For calculating TAM, I follow a structured approach while remaining flexible based on available data:

1. I typically start with a top-down analysis using industry reports and market research. For our NLP tool, I identified the broader content creation software market ($14B) and then narrowed to the relevant segment for AI-assisted content tools.

2. I complement this with a bottom-up approach, which I find more actionable. For Pathfinder AI, we defined our initial target as professional content creators, multiplied by average annual spend on productivity tools, and estimated realistic conversion rates based on early adoption signals.

3. I also segment the market into tiers based on willingness to pay and feature requirements to create a more nuanced view of our immediate, near-term, and aspirational market opportunities.

What I've learned is that the process itself often yields more strategic insights than the final number. During our TAM analysis for Pathfinder, we discovered an underserved middle segment of semi-professional content creators who weren't being addressed by either enterprise solutions or basic free tools.

This directly influenced our product strategy - we prioritized features that would appeal to this segment first, designed a tiered pricing model to capture different willingness-to-pay levels, and focused our initial marketing efforts on channels where these users gathered.",10,"[{""interviewer_response"": ""Interviewer: \n\nThat's a strong example! I appreciate how you integrated user research directly into your positioning strategy. The focus on finding that gap in the market around tone and brand voice is particularly interesting.\n\nLet's move to competitive analysis. Beyond finding your unique value proposition, how do you typically structure a competitive analysis? And I'm curious - for your NLP tool, how did you anticipate competitors' potential responses to your market entry?."", ""interviewee_response"": ""You answered: Thank you for the positive feedback! I'm passionate about finding those unmet needs that can truly differentiate a product.\n\nFor competitive analysis, I use a structured approach that combines both quantitative and qualitative elements:\n\n1. First, I create a comprehensive competitor matrix mapping key features, pricing models, target audiences, and go-to-market strategies. For our NLP tool, I tracked 8 direct competitors and 4 adjacent solutions.\n\n2. Then I go deeper by actually using competitors' products myself. I believe in experiencing the user journey firsthand rather than just reading about features. This hands-on testing revealed usability gaps in competitor offerings that our engineering team might not have discovered otherwise.\n\n3. I also gather sentiment analysis from user reviews and social media to understand emotional pain points with existing solutions.\n\nFor anticipating competitive responses to our market entry, I led cross-functional workshops with our engineering, marketing, and sales teams to game out scenarios. We identified that larger competitors would likely respond by:\n\n1. Bundling similar features into their existing offerings at no additional cost\n2. Highlighting our startup status as a potential reliability concern\n\nTo counter these, we preemptively built a robust early adopter program with influential content creators who became our advocates, and we focused on integration capabilities that would make our tool complementary rather than competitive to existing workflows..""}, {""interviewer_response"": ""Interviewer: \n\nThat's excellent. Your hands-on approach to competitor analysis and proactive strategy for potential competitive responses shows real depth. I particularly like how you leveraged early adopters as advocates - very smart positioning move.\n\nLet's shift to TAM calculation. Could you walk me through your methodology for calculating Total Addressable Market for a new product? With your NLP tool example or another product you've worked on, how did you approach sizing the market opportunity, and how did that influence your product strategy?."", ""interviewee_response"": ""You answered: Thank you for the kind words! Market sizing is a fascinating process that combines art and science.\n\nFor calculating TAM, I follow a structured approach while remaining flexible based on available data:\n\n1. I typically start with a top-down analysis using industry reports and market research. For our NLP tool, I identified the broader content creation software market ($14B) and then narrowed to the relevant segment for AI-assisted content tools.\n\n2. I complement this with a bottom-up approach, which I find more actionable. For Pathfinder AI, we defined our initial target as professional content creators, multiplied by average annual spend on productivity tools, and estimated realistic conversion rates based on early adoption signals.\n\n3. I also segment the market into tiers based on willingness to pay and feature requirements to create a more nuanced view of our immediate, near-term, and aspirational market opportunities.\n\nWhat I've learned is that the process itself often yields more strategic insights than the final number. During our TAM analysis for Pathfinder, we discovered an underserved middle segment of semi-professional content creators who weren't being addressed by either enterprise solutions or basic free tools.\n\nThis directly influenced our product strategy - we prioritized features that would appeal to this segment first, designed a tiered pricing model to capture different willingness-to-pay levels, and focused our initial marketing efforts on channels where these users gathered..""}]"
"I'm genuinely impressed and growing more enthusiastic with each response. The candidate demonstrates not just theoretical knowledge but practical wisdom in their approach to market sizing. I appreciate how they balance rigorous methodology with strategic flexibility. Their insight about the process yielding more value than the final number shows real-world maturity, and their discovery of that underserved middle segment reveals the kind of business instinct that can't be taught. I'm feeling increasingly confident about their potential fit.",85,"This candidate continues to showcase excellent product management skills with depth and nuance. Their TAM methodology is sophisticated, combining both top-down and bottom-up approaches with specific examples and numbers ($14B market). I'm particularly impressed by their strategic insight about market segmentation by willingness to pay and how they translated market analysis directly into product strategy and pricing decisions. They identified an underserved segment and built their approach around it - this shows they understand that product management isn't just about features but about business outcomes. They're demonstrating pattern recognition from experience and the ability to turn analysis into action. This is exactly what I'd want to see in a strategic product leader who can connect market opportunity to execution.","

Your approach to TAM is quite thoughtful - I especially like how you identified that underserved middle segment during your analysis. That's a great example of how market sizing can actually drive strategic direction beyond just validating an opportunity.

Let's talk about product documentation now. Could you explain your approach to creating Market Requirements Documents (MRDs) and Product Requirements Documents (PRDs)? What key components do you include, and how do you ensure they effectively bridge customer needs with engineering implementations?","Thank you for the feedback! Documentation is absolutely crucial for aligning teams and creating successful products.

For Market Requirements Documents (MRDs), my approach centers on telling the complete market story:

1. I begin with a clear problem statement supported by customer insights. At Pathfinder AI, I included direct quotes from user interviews and data visualizations of pain points to make customer needs tangible.

2. I define our target personas with detailed descriptions of their goals, challenges, and workflows to create empathy across the organization.

3. I outline market opportunities, competitive landscape, and strategic differentiators to provide context on why we're building this specific solution.

For Product Requirements Documents (PRDs), I focus on translating market needs into actionable development guidelines:

1. I structure PRDs with clear user stories and acceptance criteria, always tying back to specific user needs identified in the MRD.

2. I collaborate closely with engineering leads early in the drafting process. At my previous startup, I established regular ""pre-PRD"" workshops where engineers could provide input on technical feasibility before requirements were finalized.

3. I include success metrics for each feature to ensure we're measuring what matters.

The most important aspect is ensuring these documents facilitate conversation rather than simply serving as static deliverables. I've found that bringing designers and engineers into user interviews helps create shared understanding that no document alone can achieve.",0,"[{""interviewer_response"": ""Interviewer: \n\nThat's a strong example! I appreciate how you integrated user research directly into your positioning strategy. The focus on finding that gap in the market around tone and brand voice is particularly interesting.\n\nLet's move to competitive analysis. Beyond finding your unique value proposition, how do you typically structure a competitive analysis? And I'm curious - for your NLP tool, how did you anticipate competitors' potential responses to your market entry?."", ""interviewee_response"": ""You answered: Thank you for the positive feedback! I'm passionate about finding those unmet needs that can truly differentiate a product.\n\nFor competitive analysis, I use a structured approach that combines both quantitative and qualitative elements:\n\n1. First, I create a comprehensive competitor matrix mapping key features, pricing models, target audiences, and go-to-market strategies. For our NLP tool, I tracked 8 direct competitors and 4 adjacent solutions.\n\n2. Then I go deeper by actually using competitors' products myself. I believe in experiencing the user journey firsthand rather than just reading about features. This hands-on testing revealed usability gaps in competitor offerings that our engineering team might not have discovered otherwise.\n\n3. I also gather sentiment analysis from user reviews and social media to understand emotional pain points with existing solutions.\n\nFor anticipating competitive responses to our market entry, I led cross-functional workshops with our engineering, marketing, and sales teams to game out scenarios. We identified that larger competitors would likely respond by:\n\n1. Bundling similar features into their existing offerings at no additional cost\n2. Highlighting our startup status as a potential reliability concern\n\nTo counter these, we preemptively built a robust early adopter program with influential content creators who became our advocates, and we focused on integration capabilities that would make our tool complementary rather than competitive to existing workflows..""}, {""interviewer_response"": ""Interviewer: \n\nThat's excellent. Your hands-on approach to competitor analysis and proactive strategy for potential competitive responses shows real depth. I particularly like how you leveraged early adopters as advocates - very smart positioning move.\n\nLet's shift to TAM calculation. Could you walk me through your methodology for calculating Total Addressable Market for a new product? With your NLP tool example or another product you've worked on, how did you approach sizing the market opportunity, and how did that influence your product strategy?."", ""interviewee_response"": ""You answered: Thank you for the kind words! Market sizing is a fascinating process that combines art and science.\n\nFor calculating TAM, I follow a structured approach while remaining flexible based on available data:\n\n1. I typically start with a top-down analysis using industry reports and market research. For our NLP tool, I identified the broader content creation software market ($14B) and then narrowed to the relevant segment for AI-assisted content tools.\n\n2. I complement this with a bottom-up approach, which I find more actionable. For Pathfinder AI, we defined our initial target as professional content creators, multiplied by average annual spend on productivity tools, and estimated realistic conversion rates based on early adoption signals.\n\n3. I also segment the market into tiers based on willingness to pay and feature requirements to create a more nuanced view of our immediate, near-term, and aspirational market opportunities.\n\nWhat I've learned is that the process itself often yields more strategic insights than the final number. During our TAM analysis for Pathfinder, we discovered an underserved middle segment of semi-professional content creators who weren't being addressed by either enterprise solutions or basic free tools.\n\nThis directly influenced our product strategy - we prioritized features that would appeal to this segment first, designed a tiered pricing model to capture different willingness-to-pay levels, and focused our initial marketing efforts on channels where these users gathered..""}, {""interviewer_response"": ""Interviewer: \n\nYour approach to TAM is quite thoughtful - I especially like how you identified that underserved middle segment during your analysis. That's a great example of how market sizing can actually drive strategic direction beyond just validating an opportunity.\n\nLet's talk about product documentation now. Could you explain your approach to creating Market Requirements Documents (MRDs) and Product Requirements Documents (PRDs)? What key components do you include, and how do you ensure they effectively bridge customer needs with engineering implementations?."", ""interviewee_response"": ""You answered: Thank you for the feedback! Documentation is absolutely crucial for aligning teams and creating successful products.\n\nFor Market Requirements Documents (MRDs), my approach centers on telling the complete market story:\n\n1. I begin with a clear problem statement supported by customer insights. At Pathfinder AI, I included direct quotes from user interviews and data visualizations of pain points to make customer needs tangible.\n\n2. I define our target personas with detailed descriptions of their goals, challenges, and workflows to create empathy across the organization.\n\n3. I outline market opportunities, competitive landscape, and strategic differentiators to provide context on why we're building this specific solution.\n\nFor Product Requirements Documents (PRDs), I focus on translating market needs into actionable development guidelines:\n\n1. I structure PRDs with clear user stories and acceptance criteria, always tying back to specific user needs identified in the MRD.\n\n2. I collaborate closely with engineering leads early in the drafting process. At my previous startup, I established regular \""pre-PRD\"" workshops where engineers could provide input on technical feasibility before requirements were finalized.\n\n3. I include success metrics for each feature to ensure we're measuring what matters.\n\nThe most important aspect is ensuring these documents facilitate conversation rather than simply serving as static deliverables. I've found that bringing designers and engineers into user interviews helps create shared understanding that no document alone can achieve..""}]"
