interviewer_emotions,interviewer_emotion_score,interviewer_thoughts,interviewer_response,interviewee_response,reward,conversation_history
"I'm deeply impressed with this candidate at this point. Their approach to engineering collaboration demonstrates exactly the kind of technical credibility and relationship-building we need. I particularly value their ""context before requests"" philosophy and how they prioritize understanding technical constraints rather than making unreasonable demands. The example of facilitating prioritization through a visual impact/complexity framework shows practical leadership skills. Their commitment to embedding with the engineering team reflects a collaborative spirit that would fit well in our culture.",85,"Morgan continues to show strong product management fundamentals with concrete examples that feel authentic. Their approach to engineering collaboration demonstrates technical empathy without overstepping boundaries. The candidate shows they understand that effective product management isn't about dictating solutions but facilitating the right conversations and decisions. Their ""context before requests"" approach and embedding with engineering teams are practices we've found effective in our own organization. Their example of the technical constraints conversation around latency issues shows they can navigate technical complexity effectively. The priority mapping exercise demonstrates structured decision-making skills for handling trade-offs. Once again, they were cut off mid-response, but provided enough substance to evaluate their approach. Across all questions, they've consistently demonstrated user-centered thinking, collaborative leadership, and specific examples that validate their claimed experiences. I've seen strong evidence of both technical understanding and product thinking.","





You've shown a really thoughtful approach to engineering collaboration. I particularly like your ""context before requests"" framework and how you embed yourself with engineering teams while respecting their expertise.

Let's move on to product launches. Could you walk me through your approach to pre-launch activities and the launch itself? How do you ensure a successful go-to-market strategy, and what metrics do you typically focus on post-launch?","Thank you for that question - product launches have been critical moments in my career.

At NeuralPath, I developed a comprehensive pre-launch framework after learning from an earlier, less coordinated launch at AIConnect. My approach now includes three key phases:

First, the preparation phase typically begins 8-10 weeks before launch. I create a cross-functional launch plan with clear ownership and timelines across product, engineering, marketing, sales, and customer support. This includes finalizing documentation, establishing success metrics, developing marketing materials, and preparing sales enablement tools. I also implement a formal QA process with both technical testing and user acceptance testing with beta customers.

For the launch execution, I focus on orchestrating a coordinated rollout. At NeuralPath, for our enhanced facial recognition API, we created a tiered approach - starting with existing customers who had requested these features, followed by targeted prospects, and finally a broader market announcement. I worked closely with customer success to provide personalized onboarding for high-value accounts.

Post-launch, I monitor both quantitative and qualitative metrics. Beyond the obvious usage statistics, I track specific adoption patterns, support ticket themes, and conversion rates. I established a 30/60/90 day review cycle where we gather feedback and make necessary adjustments.

One lesson I've learned is the importance of emotional preparation for teams.",0,"[{""interviewer_response"": ""Interviewer: \n\nThank you for that excellent introduction, Morgan! Your experience in AI product management sounds highly relevant, especially your work translating complex technical capabilities into user-friendly features. Let's dig deeper into your product management approach.\n\nI'd like to start with market positioning. Could you walk me through how you positioned one of your products in the market? How did you identify the target audience and differentiate from competitors?."", ""interviewee_response"": ""You answered: I appreciate your interest in my approach to market positioning! \n\nAt NeuralPath, one of my key projects was repositioning our facial recognition API product. Initially, we were marketing broadly to \""businesses needing identity verification,\"" but we weren't gaining traction against larger competitors.\n\nI started by conducting stakeholder interviews with our existing customers, which revealed that small to medium-sized fintech companies were getting the most value from our product - specifically because of our lightweight integration and privacy-first approach. These companies needed robust verification but lacked the resources for complex implementations that our larger competitors required.\n\nFor competitive differentiation, I worked with our engineering team to understand our technical advantages. We discovered our algorithm performed exceptionally well on diverse facial features and varying lighting conditions - areas where competitors struggled. However, I realized this technical superiority wasn't being communicated effectively.\n\nI collaborated with marketing to refocus our messaging around \""inclusive verification that works for everyone\"" and \""five-minute integration for engineering teams.\"" We reorganized our pricing tiers to better align with fintech startup budgets and created implementation guides specifically for fintech use cases.\n\nI'll be honest - the business strategy aspect was challenging for me. I had the technical knowledge to identify our differentiators but relied heavily on collaboration with our marketing and sales leads to translate this into effective positioning. This experience taught me the importance of cross-functional partnerships in market positioning..""}, {""interviewer_response"": ""Interviewer: \n\nThat's an excellent example, Morgan. I like how you identified the specific niche where your product delivered exceptional value rather than competing broadly. Building on that, I'd like to understand your approach to competitive analysis. How do you stay informed about the competitive landscape, and could you share an example of a time when competitive insights influenced your product decisions?."", ""interviewee_response"": ""You answered: I'm glad that example resonated! Competitive analysis has been a crucial part of my product management approach.\n\nAt NeuralPath, I established a quarterly competitive review process where I'd systematically evaluate our top five competitors' products, pricing, and positioning. Beyond the obvious surface-level analysis, I found immense value in setting up \""listening posts\"" across multiple channels. I created Google Alerts for competitor news, followed key executives on LinkedIn, regularly reviewed their release notes, and even maintained trial accounts to experience their product updates firsthand.\n\nOne particularly impactful example was when we were planning our feature roadmap for our object recognition API. Through monitoring developer forums, I noticed increasing frustration with a leading competitor's model that performed poorly on small objects within larger images. Their customers were vocal about this limitation, but the competitor wasn't addressing it.\n\nI brought these insights to our engineering team, and we realized our underlying architecture could be optimized for this specific use case. We pivoted our next quarter's development to focus on small-object detection accuracy, which wasn't originally on our roadmap.\n\nWhen we launched this enhancement, we directly addressed this pain point in our messaging. We created comparison benchmarks showing our superior performance specifically for small-object detection scenarios. This attracted several enterprise customers who switched from our competitor, resulting in our highest-converting feature that year..""}, {""interviewer_response"": ""Interviewer: \n\n\n\nThat's a fantastic example of turning competitive intelligence into a product advantage, Morgan. The direct business impact shows real strategic thinking. Now I'd like to understand your approach to market sizing. Could you walk me through how you've calculated the Total Addressable Market (TAM) for a product, and how that calculation influenced your product strategy or decisions?."", ""interviewee_response"": ""You answered: Thank you! Market sizing is definitely an area where I've grown significantly in my product management journey.\n\nWhen I joined AIConnect, we were launching a specialized sentiment analysis API targeting the customer service industry. I needed to calculate the TAM to help secure additional funding for the product line.\n\nI approached this methodically. First, I researched industry reports from Gartner and Forrester to understand the broader customer service software market size - approximately $75 billion globally at that time. I then narrowed to the subset that incorporated AI solutions, which was around 15% of that market.\n\nFrom there, I looked specifically at companies that would need sentiment analysis capabilities. I worked with our sales team to analyze conversion rates across different company sizes and segments, and with our data science team to understand implementation complexity across industries.\n\nThis analysis revealed our true addressable market was smaller than initially assumed - about $2.3 billion - but with much higher conversion potential in specific segments like e-commerce and financial services customer support.\n\nI'll be transparent - this was challenging for me initially. The business modeling aspects didn't come as naturally as the technical requirements. I collaborated closely with our business development lead and learned tremendously from the process.\n\nThe impact on our strategy was significant. Rather than building general-purpose sentiment analysis, we tailored our solution specifically for customer support ticket prioritization and agent coaching - applications with proven ROI in our target segments..""}, {""interviewer_response"": ""Interviewer: \n\n\n\nThat's an excellent breakdown of your TAM approach, Morgan. I appreciate your candor about the challenges and how you collaborated to overcome them. The way you narrowed your focus based on market insights is exactly the kind of strategic thinking we value.\n\nLet's shift to product documentation. Could you describe your process for creating Market Requirements Documents (MRDs) and Product Requirements Documents (PRDs)? What key elements do you include, and how do you ensure they're effective for guiding development?."", ""interviewee_response"": ""You answered: Thank you for that thoughtful question!\n\nDocumentation has been central to my product development process. At both NeuralPath and AIConnect, I've refined my approach to MRDs and PRDs to ensure they're both comprehensive and actionable.\n\nFor Market Requirements Documents, I start by synthesizing insights from multiple sources: customer interviews, support tickets, sales feedback, and competitive analysis. The key sections I always include are: market problem statement, target user personas with their key pain points, market size estimates, competitive landscape, and success metrics tied to business outcomes. At NeuralPath, I introduced a \""voice of customer\"" section with direct quotes that helped engineering teams connect with user needs emotionally.\n\nFor PRDs, I focus on translating market needs into clear development guidelines. I structure these with: product vision, specific user stories, functional requirements, technical constraints, UI/UX specifications, and acceptance criteria. I've found that including a \""non-goals\"" section helps prevent scope creep, which was particularly valuable in our startup environments with limited resources.\n\nWhat I've learned about making these documents effective is that collaboration is essential. At AIConnect, my early PRDs were technically sound but lacked buy-in. I evolved my process to include engineering and design in early drafting sessions, which dramatically improved implementation quality and team alignment.\n\nI also ensure my documentation remains living and accessible. We use Notion at NeuralPath, with.""}, {""interviewer_response"": ""Interviewer: \n\n\n\nI notice you might have been cut off there, but you've covered the essential elements of your documentation approach. I particularly appreciate your focus on collaboration and the \""non-goals\"" section to prevent scope creep - that's pragmatic and shows real-world experience.\n\nLet's talk about working with engineering teams. Could you share your approach to collaborating with engineers throughout the development process? Perhaps walk me through how you've handled technical constraints or trade-offs between features and timelines?."", ""interviewee_response"": ""You answered: Thank you for that great question. Collaborating effectively with engineering teams has been one of my greatest strengths and learning opportunities in my product management journey.\n\nMy approach centers around building relationships based on mutual respect and shared understanding. At NeuralPath, I implemented what I call \""context before requests\"" - ensuring engineers understand the why behind features before discussing the how. I start each new initiative with a session where we explore user problems together rather than just presenting solutions.\n\nFor handling technical constraints, I've found transparency and early involvement are key. On our computer vision product, we faced significant latency issues that would impact user experience. Rather than pushing engineering to \""just make it faster,\"" I organized a technical deep dive where engineers could explain the constraints in terms I could understand. Together, we explored options like optimizing certain features, implementing client-side processing for some tasks, and adjusting our user interface to better manage expectations.\n\nWhen trade-offs become necessary, I use a collaborative prioritization framework. At AIConnect, we had an ambitious release with too many features for our timeline. I facilitated a workshop where we mapped features against two axes: user impact and technical complexity. This visual exercise helped the entire team agree on which features to prioritize and which to defer.\n\nOne approach that's worked particularly well is embedding myself with the engineering team. I started attending selected technical standups and made myself available during engineering work sessions. This proximity helped me catch potential issues early.""}, {""interviewer_response"": ""Interviewer: \n\n\n\n\n\nYou've shown a really thoughtful approach to engineering collaboration. I particularly like your \""context before requests\"" framework and how you embed yourself with engineering teams while respecting their expertise.\n\nLet's move on to product launches. Could you walk me through your approach to pre-launch activities and the launch itself? How do you ensure a successful go-to-market strategy, and what metrics do you typically focus on post-launch?."", ""interviewee_response"": ""You answered: Thank you for that question - product launches have been critical moments in my career.\n\nAt NeuralPath, I developed a comprehensive pre-launch framework after learning from an earlier, less coordinated launch at AIConnect. My approach now includes three key phases:\n\nFirst, the preparation phase typically begins 8-10 weeks before launch. I create a cross-functional launch plan with clear ownership and timelines across product, engineering, marketing, sales, and customer support. This includes finalizing documentation, establishing success metrics, developing marketing materials, and preparing sales enablement tools. I also implement a formal QA process with both technical testing and user acceptance testing with beta customers.\n\nFor the launch execution, I focus on orchestrating a coordinated rollout. At NeuralPath, for our enhanced facial recognition API, we created a tiered approach - starting with existing customers who had requested these features, followed by targeted prospects, and finally a broader market announcement. I worked closely with customer success to provide personalized onboarding for high-value accounts.\n\nPost-launch, I monitor both quantitative and qualitative metrics. Beyond the obvious usage statistics, I track specific adoption patterns, support ticket themes, and conversion rates. I established a 30/60/90 day review cycle where we gather feedback and make necessary adjustments.\n\nOne lesson I've learned is the importance of emotional preparation for teams..""}]"
