interviewer_emotions,interviewer_emotion_score,interviewer_thoughts,interviewer_response,interviewee_response,reward,conversation_history
,50,,"*thoughts: This candidate is here for the Product Management role. They seem prompt but haven't introduced themselves or shown much enthusiasm yet. I'll start friendly but professional to set the right tone.*

*emotions: Neutral, professionally curious*

Hello there! It's nice to meet you. I'm conducting today's product management assessment interview. Before we dive in, could you tell me a bit about your background in product management and what interests you about this role?","Hi, it's great to meet you too! I'm Morgan, and I'm really excited to be here today. 

I've spent the last three years as a product manager working across two AI startups. In my current role at NeuralPath, I've been leading our computer vision product suite, working closely with engineers to translate complex technical capabilities into user-friendly features. Before that, I was at AIConnect, where I started as an associate PM and quickly moved into managing our natural language processing API product.

What really draws me to this role is the opportunity to work on technology that solves meaningful problems at a larger scale. I've developed strong skills in bridging technical complexity with user needs, and I'm particularly proud of how I've built collaborative relationships across engineering, design, and customer-facing teams. While I've gained solid experience with the technical aspects of product development, I'm especially excited about this position as a chance to further develop the business strategy side of product management.

I value creating environments where teams feel empowered to innovate, and I believe my ability to understand both the technical nuances and human elements of product development could be valuable here. I'd love to hear more about the specific challenges your team is currently tackling.",0,[]
"I'm feeling warmly impressed by this candidate's introduction. Their experience at AI startups seems directly relevant, and I appreciate how they articulated both technical and collaborative aspects of their work. I'm particularly drawn to their enthusiasm and the thoughtful way they expressed interest in our role's strategic dimension. I'm genuinely looking forward to exploring their experience more deeply.",85,"The candidate has made a strong first impression with a clear, well-articulated introduction. Their three years of PM experience at AI startups shows relevant background, and I like that they've had progression from associate PM to leading a product suite. They've proactively addressed the technical-to-user translation skills that are crucial for our role, and their interest in developing business strategy suggests appropriate self-awareness about growth areas. Their communication style is polished but genuine, with a good balance of confidence and humility. I'll need to dig into specific examples of their work and decision-making process to validate these initial positive signals.","

Thank you for that excellent introduction, Morgan! Your experience in AI product management sounds highly relevant, especially your work translating complex technical capabilities into user-friendly features. Let's dig deeper into your product management approach.

I'd like to start with market positioning. Could you walk me through how you positioned one of your products in the market? How did you identify the target audience and differentiate from competitors?","I appreciate your interest in my approach to market positioning! 

At NeuralPath, one of my key projects was repositioning our facial recognition API product. Initially, we were marketing broadly to ""businesses needing identity verification,"" but we weren't gaining traction against larger competitors.

I started by conducting stakeholder interviews with our existing customers, which revealed that small to medium-sized fintech companies were getting the most value from our product - specifically because of our lightweight integration and privacy-first approach. These companies needed robust verification but lacked the resources for complex implementations that our larger competitors required.

For competitive differentiation, I worked with our engineering team to understand our technical advantages. We discovered our algorithm performed exceptionally well on diverse facial features and varying lighting conditions - areas where competitors struggled. However, I realized this technical superiority wasn't being communicated effectively.

I collaborated with marketing to refocus our messaging around ""inclusive verification that works for everyone"" and ""five-minute integration for engineering teams."" We reorganized our pricing tiers to better align with fintech startup budgets and created implementation guides specifically for fintech use cases.

I'll be honest - the business strategy aspect was challenging for me. I had the technical knowledge to identify our differentiators but relied heavily on collaboration with our marketing and sales leads to translate this into effective positioning. This experience taught me the importance of cross-functional partnerships in market positioning.",35,"[{""interviewer_response"": ""Interviewer: \n\nThank you for that excellent introduction, Morgan! Your experience in AI product management sounds highly relevant, especially your work translating complex technical capabilities into user-friendly features. Let's dig deeper into your product management approach.\n\nI'd like to start with market positioning. Could you walk me through how you positioned one of your products in the market? How did you identify the target audience and differentiate from competitors?."", ""interviewee_response"": ""You answered: I appreciate your interest in my approach to market positioning! \n\nAt NeuralPath, one of my key projects was repositioning our facial recognition API product. Initially, we were marketing broadly to \""businesses needing identity verification,\"" but we weren't gaining traction against larger competitors.\n\nI started by conducting stakeholder interviews with our existing customers, which revealed that small to medium-sized fintech companies were getting the most value from our product - specifically because of our lightweight integration and privacy-first approach. These companies needed robust verification but lacked the resources for complex implementations that our larger competitors required.\n\nFor competitive differentiation, I worked with our engineering team to understand our technical advantages. We discovered our algorithm performed exceptionally well on diverse facial features and varying lighting conditions - areas where competitors struggled. However, I realized this technical superiority wasn't being communicated effectively.\n\nI collaborated with marketing to refocus our messaging around \""inclusive verification that works for everyone\"" and \""five-minute integration for engineering teams.\"" We reorganized our pricing tiers to better align with fintech startup budgets and created implementation guides specifically for fintech use cases.\n\nI'll be honest - the business strategy aspect was challenging for me. I had the technical knowledge to identify our differentiators but relied heavily on collaboration with our marketing and sales leads to translate this into effective positioning. This experience taught me the importance of cross-functional partnerships in market positioning..""}]"
I'm feeling increasingly positive about this candidate. Their detailed example shows real-world product positioning experience with clear reasoning behind their decisions. I appreciate their self-awareness about business strategy challenges and how they leveraged cross-functional partnerships to address this gap. Their methodical approach to discovering their product's true market fit through customer research demonstrates exactly the kind of analytical thinking we need. I'm genuinely impressed by their ability to articulate both the process and their personal learning.,85,"This candidate shows strong skills in data-driven decision making and customer-centered thinking. They provided a concrete, detailed example that demonstrates actual repositioning work rather than theoretical knowledge. I like that they identified a specific niche (fintech SMBs) and crafted differentiated messaging based on actual technical advantages. Their mention of collaboration with marketing shows appropriate cross-functional awareness, and their candor about business strategy being a growth area aligns with their initial self-assessment. The candidate shows good product instincts in recognizing that technical superiority means nothing if not effectively communicated to the right audience. This answer validates their initial claims and suggests they can handle complex product positioning challenges, though I should probe on measurable results from this repositioning effort.","

That's an excellent example, Morgan. I like how you identified the specific niche where your product delivered exceptional value rather than competing broadly. Building on that, I'd like to understand your approach to competitive analysis. How do you stay informed about the competitive landscape, and could you share an example of a time when competitive insights influenced your product decisions?","I'm glad that example resonated! Competitive analysis has been a crucial part of my product management approach.

At NeuralPath, I established a quarterly competitive review process where I'd systematically evaluate our top five competitors' products, pricing, and positioning. Beyond the obvious surface-level analysis, I found immense value in setting up ""listening posts"" across multiple channels. I created Google Alerts for competitor news, followed key executives on LinkedIn, regularly reviewed their release notes, and even maintained trial accounts to experience their product updates firsthand.

One particularly impactful example was when we were planning our feature roadmap for our object recognition API. Through monitoring developer forums, I noticed increasing frustration with a leading competitor's model that performed poorly on small objects within larger images. Their customers were vocal about this limitation, but the competitor wasn't addressing it.

I brought these insights to our engineering team, and we realized our underlying architecture could be optimized for this specific use case. We pivoted our next quarter's development to focus on small-object detection accuracy, which wasn't originally on our roadmap.

When we launched this enhancement, we directly addressed this pain point in our messaging. We created comparison benchmarks showing our superior performance specifically for small-object detection scenarios. This attracted several enterprise customers who switched from our competitor, resulting in our highest-converting feature that year.",0,"[{""interviewer_response"": ""Interviewer: \n\nThank you for that excellent introduction, Morgan! Your experience in AI product management sounds highly relevant, especially your work translating complex technical capabilities into user-friendly features. Let's dig deeper into your product management approach.\n\nI'd like to start with market positioning. Could you walk me through how you positioned one of your products in the market? How did you identify the target audience and differentiate from competitors?."", ""interviewee_response"": ""You answered: I appreciate your interest in my approach to market positioning! \n\nAt NeuralPath, one of my key projects was repositioning our facial recognition API product. Initially, we were marketing broadly to \""businesses needing identity verification,\"" but we weren't gaining traction against larger competitors.\n\nI started by conducting stakeholder interviews with our existing customers, which revealed that small to medium-sized fintech companies were getting the most value from our product - specifically because of our lightweight integration and privacy-first approach. These companies needed robust verification but lacked the resources for complex implementations that our larger competitors required.\n\nFor competitive differentiation, I worked with our engineering team to understand our technical advantages. We discovered our algorithm performed exceptionally well on diverse facial features and varying lighting conditions - areas where competitors struggled. However, I realized this technical superiority wasn't being communicated effectively.\n\nI collaborated with marketing to refocus our messaging around \""inclusive verification that works for everyone\"" and \""five-minute integration for engineering teams.\"" We reorganized our pricing tiers to better align with fintech startup budgets and created implementation guides specifically for fintech use cases.\n\nI'll be honest - the business strategy aspect was challenging for me. I had the technical knowledge to identify our differentiators but relied heavily on collaboration with our marketing and sales leads to translate this into effective positioning. This experience taught me the importance of cross-functional partnerships in market positioning..""}, {""interviewer_response"": ""Interviewer: \n\nThat's an excellent example, Morgan. I like how you identified the specific niche where your product delivered exceptional value rather than competing broadly. Building on that, I'd like to understand your approach to competitive analysis. How do you stay informed about the competitive landscape, and could you share an example of a time when competitive insights influenced your product decisions?."", ""interviewee_response"": ""You answered: I'm glad that example resonated! Competitive analysis has been a crucial part of my product management approach.\n\nAt NeuralPath, I established a quarterly competitive review process where I'd systematically evaluate our top five competitors' products, pricing, and positioning. Beyond the obvious surface-level analysis, I found immense value in setting up \""listening posts\"" across multiple channels. I created Google Alerts for competitor news, followed key executives on LinkedIn, regularly reviewed their release notes, and even maintained trial accounts to experience their product updates firsthand.\n\nOne particularly impactful example was when we were planning our feature roadmap for our object recognition API. Through monitoring developer forums, I noticed increasing frustration with a leading competitor's model that performed poorly on small objects within larger images. Their customers were vocal about this limitation, but the competitor wasn't addressing it.\n\nI brought these insights to our engineering team, and we realized our underlying architecture could be optimized for this specific use case. We pivoted our next quarter's development to focus on small-object detection accuracy, which wasn't originally on our roadmap.\n\nWhen we launched this enhancement, we directly addressed this pain point in our messaging. We created comparison benchmarks showing our superior performance specifically for small-object detection scenarios. This attracted several enterprise customers who switched from our competitor, resulting in our highest-converting feature that year..""}]"
"I'm feeling genuinely impressed and excited about this candidate. Their systematic approach to competitive analysis shows real strategic thinking, and their example demonstrates how they translated market intelligence into actionable product decisions that drove business results. I appreciate how they didn't just do surface-level research but established multiple channels for gathering competitive insights. The fact that they identified an unaddressed customer pain point and leveraged it into a competitive advantage shows exactly the kind of opportunity-spotting we need. I'm increasingly confident this candidate has the strategic product thinking we're looking for.",85,"Morgan continues to demonstrate strong product management capabilities with concrete examples. Their competitive analysis methodology is structured yet thorough, going beyond basic research to include hands-on product testing and social listening. What's particularly impressive is how they connected competitive intelligence to actual product decisions that yielded business results - attracting enterprise customers and creating their ""highest-converting feature."" This shows they understand the full loop from market research to development prioritization to commercial outcomes. They've now demonstrated both repositioning skills and competitive analysis capabilities, with examples that feel authentic rather than theoretical. They're showing a pattern of identifying specific customer pain points and aligning technical capabilities to address them, which is core to effective product management. I'm building confidence in their strategic capabilities, though I should test their prioritization skills next to see how they handle tradeoffs.","



That's a fantastic example of turning competitive intelligence into a product advantage, Morgan. The direct business impact shows real strategic thinking. Now I'd like to understand your approach to market sizing. Could you walk me through how you've calculated the Total Addressable Market (TAM) for a product, and how that calculation influenced your product strategy or decisions?","Thank you! Market sizing is definitely an area where I've grown significantly in my product management journey.

When I joined AIConnect, we were launching a specialized sentiment analysis API targeting the customer service industry. I needed to calculate the TAM to help secure additional funding for the product line.

I approached this methodically. First, I researched industry reports from Gartner and Forrester to understand the broader customer service software market size - approximately $75 billion globally at that time. I then narrowed to the subset that incorporated AI solutions, which was around 15% of that market.

From there, I looked specifically at companies that would need sentiment analysis capabilities. I worked with our sales team to analyze conversion rates across different company sizes and segments, and with our data science team to understand implementation complexity across industries.

This analysis revealed our true addressable market was smaller than initially assumed - about $2.3 billion - but with much higher conversion potential in specific segments like e-commerce and financial services customer support.

I'll be transparent - this was challenging for me initially. The business modeling aspects didn't come as naturally as the technical requirements. I collaborated closely with our business development lead and learned tremendously from the process.

The impact on our strategy was significant. Rather than building general-purpose sentiment analysis, we tailored our solution specifically for customer support ticket prioritization and agent coaching - applications with proven ROI in our target segments.",0,"[{""interviewer_response"": ""Interviewer: \n\nThank you for that excellent introduction, Morgan! Your experience in AI product management sounds highly relevant, especially your work translating complex technical capabilities into user-friendly features. Let's dig deeper into your product management approach.\n\nI'd like to start with market positioning. Could you walk me through how you positioned one of your products in the market? How did you identify the target audience and differentiate from competitors?."", ""interviewee_response"": ""You answered: I appreciate your interest in my approach to market positioning! \n\nAt NeuralPath, one of my key projects was repositioning our facial recognition API product. Initially, we were marketing broadly to \""businesses needing identity verification,\"" but we weren't gaining traction against larger competitors.\n\nI started by conducting stakeholder interviews with our existing customers, which revealed that small to medium-sized fintech companies were getting the most value from our product - specifically because of our lightweight integration and privacy-first approach. These companies needed robust verification but lacked the resources for complex implementations that our larger competitors required.\n\nFor competitive differentiation, I worked with our engineering team to understand our technical advantages. We discovered our algorithm performed exceptionally well on diverse facial features and varying lighting conditions - areas where competitors struggled. However, I realized this technical superiority wasn't being communicated effectively.\n\nI collaborated with marketing to refocus our messaging around \""inclusive verification that works for everyone\"" and \""five-minute integration for engineering teams.\"" We reorganized our pricing tiers to better align with fintech startup budgets and created implementation guides specifically for fintech use cases.\n\nI'll be honest - the business strategy aspect was challenging for me. I had the technical knowledge to identify our differentiators but relied heavily on collaboration with our marketing and sales leads to translate this into effective positioning. This experience taught me the importance of cross-functional partnerships in market positioning..""}, {""interviewer_response"": ""Interviewer: \n\nThat's an excellent example, Morgan. I like how you identified the specific niche where your product delivered exceptional value rather than competing broadly. Building on that, I'd like to understand your approach to competitive analysis. How do you stay informed about the competitive landscape, and could you share an example of a time when competitive insights influenced your product decisions?."", ""interviewee_response"": ""You answered: I'm glad that example resonated! Competitive analysis has been a crucial part of my product management approach.\n\nAt NeuralPath, I established a quarterly competitive review process where I'd systematically evaluate our top five competitors' products, pricing, and positioning. Beyond the obvious surface-level analysis, I found immense value in setting up \""listening posts\"" across multiple channels. I created Google Alerts for competitor news, followed key executives on LinkedIn, regularly reviewed their release notes, and even maintained trial accounts to experience their product updates firsthand.\n\nOne particularly impactful example was when we were planning our feature roadmap for our object recognition API. Through monitoring developer forums, I noticed increasing frustration with a leading competitor's model that performed poorly on small objects within larger images. Their customers were vocal about this limitation, but the competitor wasn't addressing it.\n\nI brought these insights to our engineering team, and we realized our underlying architecture could be optimized for this specific use case. We pivoted our next quarter's development to focus on small-object detection accuracy, which wasn't originally on our roadmap.\n\nWhen we launched this enhancement, we directly addressed this pain point in our messaging. We created comparison benchmarks showing our superior performance specifically for small-object detection scenarios. This attracted several enterprise customers who switched from our competitor, resulting in our highest-converting feature that year..""}, {""interviewer_response"": ""Interviewer: \n\n\n\nThat's a fantastic example of turning competitive intelligence into a product advantage, Morgan. The direct business impact shows real strategic thinking. Now I'd like to understand your approach to market sizing. Could you walk me through how you've calculated the Total Addressable Market (TAM) for a product, and how that calculation influenced your product strategy or decisions?."", ""interviewee_response"": ""You answered: Thank you! Market sizing is definitely an area where I've grown significantly in my product management journey.\n\nWhen I joined AIConnect, we were launching a specialized sentiment analysis API targeting the customer service industry. I needed to calculate the TAM to help secure additional funding for the product line.\n\nI approached this methodically. First, I researched industry reports from Gartner and Forrester to understand the broader customer service software market size - approximately $75 billion globally at that time. I then narrowed to the subset that incorporated AI solutions, which was around 15% of that market.\n\nFrom there, I looked specifically at companies that would need sentiment analysis capabilities. I worked with our sales team to analyze conversion rates across different company sizes and segments, and with our data science team to understand implementation complexity across industries.\n\nThis analysis revealed our true addressable market was smaller than initially assumed - about $2.3 billion - but with much higher conversion potential in specific segments like e-commerce and financial services customer support.\n\nI'll be transparent - this was challenging for me initially. The business modeling aspects didn't come as naturally as the technical requirements. I collaborated closely with our business development lead and learned tremendously from the process.\n\nThe impact on our strategy was significant. Rather than building general-purpose sentiment analysis, we tailored our solution specifically for customer support ticket prioritization and agent coaching - applications with proven ROI in our target segments..""}]"
