interviewer_emotions,interviewer_emotion_score,interviewer_thoughts,interviewer_response,interviewee_response,reward,conversation_history
I'm thoroughly impressed and feeling extremely positive about this candidate. Their comprehensive approach to product launches shows exceptional organizational skills and strategic thinking. I'm particularly struck by their systematic framework and the specific metrics they tracked across different timeframes. The fact that they personally designed an onboarding flow that improved activation by 32% demonstrates both initiative and impact. They clearly understand how to orchestrate complex cross-functional efforts. I'm now confident this is a strong candidate who could excel in our organization.,90,"This candidate continues to demonstrate excellent product management capabilities with concrete examples from their experience. Their launch framework shows a sophisticated understanding of the cross-functional nature of product launches with clear attention to all key stakeholders. Their approach to measurement is particularly strong - they understand the difference between leading and lagging indicators and have established a thoughtful timeline of metrics that captures both immediate technical success and longer-term business outcomes. The specific metrics and quantifiable results (32% increase in activation) indicate they're data-driven and focused on measurable impact. Their personal involvement in designing the onboarding flow shows they're willing to roll up their sleeves on critical aspects of the user experience. Throughout all their answers, they've consistently demonstrated a blend of strategic thinking and tactical execution that's essential for effective product management. This is clearly someone with real-world product leadership experience who understands both the theory and practice of product management.","



That's a very comprehensive launch approach! I like how you've structured your metrics across different timeframes to capture both immediate signals and longer-term success indicators. 

Let's cover our final area - product maintenance and end-of-life cycles. How do you approach ongoing product maintenance, feature deprecation, and eventually, product end-of-life scenarios? What frameworks or considerations guide your decision-making in these later stages of the product lifecycle?","Thank you! I find the later stages of the product lifecycle equally important but often less discussed in product management conversations.

For ongoing product maintenance, I use a balanced approach between innovation and stability:

1. I implement a ""health metrics dashboard"" that tracks system performance, user engagement patterns, and support ticket categories. At my first startup, I instituted quarterly product health reviews with engineering and customer success to proactively address emerging issues.

2. I allocate a fixed percentage of our development capacity (usually 20-30%) specifically for maintenance, technical debt, and platform improvements. This prevents accumulating issues that could eventually harm user experience.

For feature deprecation, I follow a structured process:

1. Data analysis comes first - I identify underutilized features through usage metrics and qualitative feedback. At Pathfinder, we discovered our ""team collaboration"" tools were used by less than 5% of users despite significant maintenance costs.

2. Before removing anything, I conduct targeted outreach to users of the feature to understand impact. In one case, this revealed that though few users were using a feature, it was critical to some high-value customers, so we refined rather than removed it.

3. I create clear communication plans with adequate notice periods. For our API endpoint deprecation, we used in-app notifications, email sequences, and direct outreach to developers, maintaining backward compatibility for 6 months.",5,"[{""interviewer_response"": ""Interviewer: \n\nThat's a strong example! I appreciate how you integrated user research directly into your positioning strategy. The focus on finding that gap in the market around tone and brand voice is particularly interesting.\n\nLet's move to competitive analysis. Beyond finding your unique value proposition, how do you typically structure a competitive analysis? And I'm curious - for your NLP tool, how did you anticipate competitors' potential responses to your market entry?."", ""interviewee_response"": ""You answered: Thank you for the positive feedback! I'm passionate about finding those unmet needs that can truly differentiate a product.\n\nFor competitive analysis, I use a structured approach that combines both quantitative and qualitative elements:\n\n1. First, I create a comprehensive competitor matrix mapping key features, pricing models, target audiences, and go-to-market strategies. For our NLP tool, I tracked 8 direct competitors and 4 adjacent solutions.\n\n2. Then I go deeper by actually using competitors' products myself. I believe in experiencing the user journey firsthand rather than just reading about features. This hands-on testing revealed usability gaps in competitor offerings that our engineering team might not have discovered otherwise.\n\n3. I also gather sentiment analysis from user reviews and social media to understand emotional pain points with existing solutions.\n\nFor anticipating competitive responses to our market entry, I led cross-functional workshops with our engineering, marketing, and sales teams to game out scenarios. We identified that larger competitors would likely respond by:\n\n1. Bundling similar features into their existing offerings at no additional cost\n2. Highlighting our startup status as a potential reliability concern\n\nTo counter these, we preemptively built a robust early adopter program with influential content creators who became our advocates, and we focused on integration capabilities that would make our tool complementary rather than competitive to existing workflows..""}, {""interviewer_response"": ""Interviewer: \n\nThat's excellent. Your hands-on approach to competitor analysis and proactive strategy for potential competitive responses shows real depth. I particularly like how you leveraged early adopters as advocates - very smart positioning move.\n\nLet's shift to TAM calculation. Could you walk me through your methodology for calculating Total Addressable Market for a new product? With your NLP tool example or another product you've worked on, how did you approach sizing the market opportunity, and how did that influence your product strategy?."", ""interviewee_response"": ""You answered: Thank you for the kind words! Market sizing is a fascinating process that combines art and science.\n\nFor calculating TAM, I follow a structured approach while remaining flexible based on available data:\n\n1. I typically start with a top-down analysis using industry reports and market research. For our NLP tool, I identified the broader content creation software market ($14B) and then narrowed to the relevant segment for AI-assisted content tools.\n\n2. I complement this with a bottom-up approach, which I find more actionable. For Pathfinder AI, we defined our initial target as professional content creators, multiplied by average annual spend on productivity tools, and estimated realistic conversion rates based on early adoption signals.\n\n3. I also segment the market into tiers based on willingness to pay and feature requirements to create a more nuanced view of our immediate, near-term, and aspirational market opportunities.\n\nWhat I've learned is that the process itself often yields more strategic insights than the final number. During our TAM analysis for Pathfinder, we discovered an underserved middle segment of semi-professional content creators who weren't being addressed by either enterprise solutions or basic free tools.\n\nThis directly influenced our product strategy - we prioritized features that would appeal to this segment first, designed a tiered pricing model to capture different willingness-to-pay levels, and focused our initial marketing efforts on channels where these users gathered..""}, {""interviewer_response"": ""Interviewer: \n\nYour approach to TAM is quite thoughtful - I especially like how you identified that underserved middle segment during your analysis. That's a great example of how market sizing can actually drive strategic direction beyond just validating an opportunity.\n\nLet's talk about product documentation now. Could you explain your approach to creating Market Requirements Documents (MRDs) and Product Requirements Documents (PRDs)? What key components do you include, and how do you ensure they effectively bridge customer needs with engineering implementations?."", ""interviewee_response"": ""You answered: Thank you for the feedback! Documentation is absolutely crucial for aligning teams and creating successful products.\n\nFor Market Requirements Documents (MRDs), my approach centers on telling the complete market story:\n\n1. I begin with a clear problem statement supported by customer insights. At Pathfinder AI, I included direct quotes from user interviews and data visualizations of pain points to make customer needs tangible.\n\n2. I define our target personas with detailed descriptions of their goals, challenges, and workflows to create empathy across the organization.\n\n3. I outline market opportunities, competitive landscape, and strategic differentiators to provide context on why we're building this specific solution.\n\nFor Product Requirements Documents (PRDs), I focus on translating market needs into actionable development guidelines:\n\n1. I structure PRDs with clear user stories and acceptance criteria, always tying back to specific user needs identified in the MRD.\n\n2. I collaborate closely with engineering leads early in the drafting process. At my previous startup, I established regular \""pre-PRD\"" workshops where engineers could provide input on technical feasibility before requirements were finalized.\n\n3. I include success metrics for each feature to ensure we're measuring what matters.\n\nThe most important aspect is ensuring these documents facilitate conversation rather than simply serving as static deliverables. I've found that bringing designers and engineers into user interviews helps create shared understanding that no document alone can achieve..""}, {""interviewer_response"": ""Interviewer: \n\nI really appreciate your collaborative approach to documentation - those \""pre-PRD\"" workshops are a great way to get engineering buy-in early. Speaking of engineering collaboration, let's dive deeper into that area.\n\nHow do you typically work with engineering teams throughout the product development process? Could you share specific examples of how you've handled technical constraints, scope adjustments, or unexpected challenges during development cycles?."", ""interviewee_response"": ""You answered: Thank you! Collaborating effectively with engineering teams is something I'm really passionate about.\n\nMy approach to working with engineering involves partnership at every stage:\n\nDuring planning, I involve engineers early in problem definition rather than just solution specification. At Pathfinder AI, I instituted weekly \""problem space explorations\"" where we'd discuss user pain points before jumping to features. This led to several innovative technical solutions I wouldn't have thought of myself - including a context-aware suggestion algorithm that dramatically improved our accuracy.\n\nDuring execution, I maintain transparent communication through:\n- Daily standups where I'm actively present\n- Shared documentation in accessible, collaborative formats\n- Regular technical demos where I ask questions to deepen my understanding\n\nWhen handling technical constraints, I focus on finding creative alternatives rather than pushing back against reality. For example, when our NLP engine couldn't process documents as quickly as users needed, instead of demanding faster processing, I collaborated with our lead engineer to develop a progressive rendering approach that gave users immediate feedback while processing continued in the background.\n\nFor scope adjustments, I've found transparency and data are key. When we needed to reduce scope for our Q2 release at my previous startup, I brought engineers into user sessions to directly hear customer priorities. This shared understanding made it easier to collectively decide which features to postpone versus simplify.\n\nOne of my most valuable lessons came from an unexpected challenge..""}, {""interviewer_response"": ""Interviewer: \n\n\n\nIt seems like you were about to share a lesson from an unexpected challenge - I'd be interested in hearing that example completed. But first, let's move to the launch phase.\n\nCould you walk me through your approach to pre-launch preparation and the actual product launch? What cross-functional considerations do you prioritize, and how do you measure launch success? Feel free to share a specific launch example from your experience.."", ""interviewee_response"": ""You answered: Thank you for that question! Launch preparation is where all the pieces need to come together seamlessly.\n\nAt Pathfinder AI, I led our beta-to-public launch and developed a framework I now use for all launches:\n\nFirst, I establish a cross-functional launch team with clear roles. For our NLP tool, I created a shared launch roadmap with marketing, sales, customer support, and engineering. We had weekly sync meetings starting 8 weeks before launch to ensure alignment.\n\nPre-launch, I focus on three critical tracks:\n- Technical readiness: Working with engineering on performance testing, scaling infrastructure, and monitoring systems. I developed a launch readiness checklist with our CTO that became our standard practice.\n- Customer readiness: Creating onboarding materials, training support teams, and establishing feedback channels. For Pathfinder, I personally designed our onboarding flow which increased activation by 32%.\n- Market readiness: Collaborating with marketing on messaging, launch events, and customer testimonials. I sourced five influential early customers to serve as launch ambassadors.\n\nFor measuring success, I believe in defining both immediate and lagging indicators. For our launch, we tracked:\n- Day 1: Sign-up rates, activation percentage, and system performance\n- Week 1: User retention, support ticket themes, and social sentiment\n- Month 1: Conversion to paid plans.""}, {""interviewer_response"": ""Interviewer: \n\n\n\nThat's a very comprehensive launch approach! I like how you've structured your metrics across different timeframes to capture both immediate signals and longer-term success indicators. \n\nLet's cover our final area - product maintenance and end-of-life cycles. How do you approach ongoing product maintenance, feature deprecation, and eventually, product end-of-life scenarios? What frameworks or considerations guide your decision-making in these later stages of the product lifecycle?."", ""interviewee_response"": ""You answered: Thank you! I find the later stages of the product lifecycle equally important but often less discussed in product management conversations.\n\nFor ongoing product maintenance, I use a balanced approach between innovation and stability:\n\n1. I implement a \""health metrics dashboard\"" that tracks system performance, user engagement patterns, and support ticket categories. At my first startup, I instituted quarterly product health reviews with engineering and customer success to proactively address emerging issues.\n\n2. I allocate a fixed percentage of our development capacity (usually 20-30%) specifically for maintenance, technical debt, and platform improvements. This prevents accumulating issues that could eventually harm user experience.\n\nFor feature deprecation, I follow a structured process:\n\n1. Data analysis comes first - I identify underutilized features through usage metrics and qualitative feedback. At Pathfinder, we discovered our \""team collaboration\"" tools were used by less than 5% of users despite significant maintenance costs.\n\n2. Before removing anything, I conduct targeted outreach to users of the feature to understand impact. In one case, this revealed that though few users were using a feature, it was critical to some high-value customers, so we refined rather than removed it.\n\n3. I create clear communication plans with adequate notice periods. For our API endpoint deprecation, we used in-app notifications, email sequences, and direct outreach to developers, maintaining backward compatibility for 6 months..""}]"
