interviewer_emotions,interviewer_emotion_score,interviewer_thoughts,interviewer_response,interviewee_response,reward,conversation_history
,50,,"*thoughts: The candidate has just arrived. I don't have much information yet, so I'll start with a warm welcome and some introductory questions to put them at ease before diving into the technical assessment.*

*emotions: Curious, professional, open-minded*

Hello! It's nice to meet you. I'm looking forward to learning more about your product management experience today. Let's keep this conversational and focused on understanding your approach to product management.

Before we dive into specific areas, could you share a brief overview of your product management background and perhaps a product you've been particularly proud to work on?","Hi, it's nice to meet you too! Thanks for having me today.

I've been in product management for about 3 years now, working exclusively in the AI space. My first role was at TechVision AI, where I spent nearly 2 years working on an AI-powered analytics platform for retail businesses. I led the development of our computer vision module that helped retailers analyze store traffic patterns and optimize product placement.

For the past year, I've been at DataMind, where I manage our NLP-based document processing solution. I'm particularly proud of our latest feature release that improved document classification accuracy by 27% while reducing processing time by half. The technical architecture I designed for this was quite elegant - we implemented a hybrid transformer model with a custom attention mechanism that significantly outperformed previous solutions.

My background is actually in computer science, which has been extremely valuable in these AI-focused roles. I'm very comfortable with the technical aspects of product development, from architecting solutions to communicating with engineering teams. I can effectively translate business requirements into technical specifications, though I'll admit I'm still growing in some of the more business-oriented aspects of product management.",0,[]
"I'm feeling engaged and positively surprised by this candidate's technical depth. Their AI experience is impressive, and I appreciate how they balanced discussing technical achievements with measurable business outcomes. I'm curious to learn more about their approach to the business side of product management, which they honestly acknowledged as a growth area.",75,"This candidate has solid technical product management experience in AI with clear examples of impact. They show strong technical understanding with good self-awareness about their development areas in business skills. They come across as knowledgeable but humble. Their background in computer science seems to be a real strength in their AI product roles. I want to probe more on their business acumen, stakeholder management, and how they balance technical excellence with customer needs.","

That's an impressive background in AI product management. Your technical expertise clearly shines through, and I appreciate your candor about growing in some business aspects. 

Let's talk about market positioning. If you were launching a new AI document processing feature, how would you approach positioning it in the market? Can you walk me through how you'd identify the target customer segment and develop unique value propositions?","I appreciate that feedback on my background. Market positioning is definitely important.

For launching a new AI document processing feature, I'd approach it systematically. First, I'd analyze our existing data to understand which customers are currently using similar features most heavily. At DataMind, we've collected substantial usage metrics that help identify power users versus casual users.

For target customer segmentation, I'd look at industry verticals with high document processing needs - legal, financial services, healthcare, and insurance come to mind immediately. I'd analyze which segments have the highest potential ROI from automating document processing. My approach would be to prioritize segments where we have existing technical advantages.

For value propositions, I'd focus heavily on quantifiable metrics that demonstrate superiority - processing speed improvements, accuracy rates, and integration capabilities with existing systems. At TechVision, we found that technical differentiators like these were most compelling to customers when presented with clear benchmark data.

I recognize that competitive positioning is also important, though I tend to focus more on our product's technical capabilities rather than broader market dynamics. I'd want to make sure we highlight any novel algorithms or approaches we're using that competitors don't have.

Honestly, this is an area where I'm still developing my expertise. I understand the theoretical frameworks for market positioning, but I'm still working on building more intuition for the business side of product decisions beyond the technical advantages.",25,"[{""interviewer_response"": ""Interviewer: \n\nThat's an impressive background in AI product management. Your technical expertise clearly shines through, and I appreciate your candor about growing in some business aspects. \n\nLet's talk about market positioning. If you were launching a new AI document processing feature, how would you approach positioning it in the market? Can you walk me through how you'd identify the target customer segment and develop unique value propositions?."", ""interviewee_response"": ""You answered: I appreciate that feedback on my background. Market positioning is definitely important.\n\nFor launching a new AI document processing feature, I'd approach it systematically. First, I'd analyze our existing data to understand which customers are currently using similar features most heavily. At DataMind, we've collected substantial usage metrics that help identify power users versus casual users.\n\nFor target customer segmentation, I'd look at industry verticals with high document processing needs - legal, financial services, healthcare, and insurance come to mind immediately. I'd analyze which segments have the highest potential ROI from automating document processing. My approach would be to prioritize segments where we have existing technical advantages.\n\nFor value propositions, I'd focus heavily on quantifiable metrics that demonstrate superiority - processing speed improvements, accuracy rates, and integration capabilities with existing systems. At TechVision, we found that technical differentiators like these were most compelling to customers when presented with clear benchmark data.\n\nI recognize that competitive positioning is also important, though I tend to focus more on our product's technical capabilities rather than broader market dynamics. I'd want to make sure we highlight any novel algorithms or approaches we're using that competitors don't have.\n\nHonestly, this is an area where I'm still developing my expertise. I understand the theoretical frameworks for market positioning, but I'm still working on building more intuition for the business side of product decisions beyond the technical advantages..""}]"
"I'm feeling more concerned now. While the candidate shows an analytical approach to segmentation and can identify key metrics, they seem to default to technical differentiation without deeply understanding customer needs or pain points. Their self-awareness about their development areas is positive, but I'm noticing a pattern of technical-first thinking that might not translate to customer-focused product development. I'm starting to question if they can balance technical excellence with market requirements.",35,"This candidate is technically strong but shows significant gaps in strategic product thinking. They approach positioning primarily from a technical feature standpoint rather than customer problems or needs. Their segmentation strategy is basic - identifying high-volume document industries without diving into specific pain points or jobs-to-be-done. They're honest about their development areas, which is good, but I'm concerned about their tendency to prioritize technical capabilities over customer value. This seems like a technically-minded person who understands product management frameworks intellectually but hasn't developed the business instincts needed for senior PM roles.","

I appreciate your honesty about where you're developing. Let's build on this with a related question about competitive analysis. When launching that document processing feature, how would you approach understanding the competitive landscape? What frameworks or methods would you use to differentiate your offering, and how do you balance technical differentiation with solving customer problems?","Thanks for the question, I think competitive analysis is crucial for any product launch.

For understanding the competitive landscape, I'd start by creating a comprehensive feature matrix comparing our document processing capabilities against key competitors. At DataMind, I developed a systematic approach where we identified the top 5-7 competitors and broke down their offerings into specific capabilities, pricing models, and technical specifications.

I typically use a combination of SWOT analysis and the Four Actions Framework (from Blue Ocean Strategy) to identify differentiation opportunities. The technical differentiation is straightforward for me - I can quickly pinpoint where our algorithms have advantages in accuracy, processing speed, or handling edge cases. At TechVision, we found our computer vision models were 15% more accurate than competitors with distorted images, which became a key selling point.

The challenge I sometimes face is balancing technical superiority with actual customer problems. I've learned that customers don't always care about the most advanced technology if it doesn't solve their specific pain points. I try to map technical capabilities to customer outcomes, though I admit I sometimes get too excited about technical innovations without fully validating their market value first.

For differentiation strategy, I'd prioritize areas where we have both technical advantage and alignment with customer needs. For example, if our algorithm is particularly good at extracting data from unstructured documents, I'd focus on industries where that pain point is most acute, like insurance claims processing.",-40,"[{""interviewer_response"": ""Interviewer: \n\nThat's an impressive background in AI product management. Your technical expertise clearly shines through, and I appreciate your candor about growing in some business aspects. \n\nLet's talk about market positioning. If you were launching a new AI document processing feature, how would you approach positioning it in the market? Can you walk me through how you'd identify the target customer segment and develop unique value propositions?."", ""interviewee_response"": ""You answered: I appreciate that feedback on my background. Market positioning is definitely important.\n\nFor launching a new AI document processing feature, I'd approach it systematically. First, I'd analyze our existing data to understand which customers are currently using similar features most heavily. At DataMind, we've collected substantial usage metrics that help identify power users versus casual users.\n\nFor target customer segmentation, I'd look at industry verticals with high document processing needs - legal, financial services, healthcare, and insurance come to mind immediately. I'd analyze which segments have the highest potential ROI from automating document processing. My approach would be to prioritize segments where we have existing technical advantages.\n\nFor value propositions, I'd focus heavily on quantifiable metrics that demonstrate superiority - processing speed improvements, accuracy rates, and integration capabilities with existing systems. At TechVision, we found that technical differentiators like these were most compelling to customers when presented with clear benchmark data.\n\nI recognize that competitive positioning is also important, though I tend to focus more on our product's technical capabilities rather than broader market dynamics. I'd want to make sure we highlight any novel algorithms or approaches we're using that competitors don't have.\n\nHonestly, this is an area where I'm still developing my expertise. I understand the theoretical frameworks for market positioning, but I'm still working on building more intuition for the business side of product decisions beyond the technical advantages..""}, {""interviewer_response"": ""Interviewer: \n\nI appreciate your honesty about where you're developing. Let's build on this with a related question about competitive analysis. When launching that document processing feature, how would you approach understanding the competitive landscape? What frameworks or methods would you use to differentiate your offering, and how do you balance technical differentiation with solving customer problems?."", ""interviewee_response"": ""You answered: Thanks for the question, I think competitive analysis is crucial for any product launch.\n\nFor understanding the competitive landscape, I'd start by creating a comprehensive feature matrix comparing our document processing capabilities against key competitors. At DataMind, I developed a systematic approach where we identified the top 5-7 competitors and broke down their offerings into specific capabilities, pricing models, and technical specifications.\n\nI typically use a combination of SWOT analysis and the Four Actions Framework (from Blue Ocean Strategy) to identify differentiation opportunities. The technical differentiation is straightforward for me - I can quickly pinpoint where our algorithms have advantages in accuracy, processing speed, or handling edge cases. At TechVision, we found our computer vision models were 15% more accurate than competitors with distorted images, which became a key selling point.\n\nThe challenge I sometimes face is balancing technical superiority with actual customer problems. I've learned that customers don't always care about the most advanced technology if it doesn't solve their specific pain points. I try to map technical capabilities to customer outcomes, though I admit I sometimes get too excited about technical innovations without fully validating their market value first.\n\nFor differentiation strategy, I'd prioritize areas where we have both technical advantage and alignment with customer needs. For example, if our algorithm is particularly good at extracting data from unstructured documents, I'd focus on industries where that pain point is most acute, like insurance claims processing..""}]"
"I'm feeling a mix of appreciation for their honesty and continuing concern about their approach. The candidate shows some growth in understanding the importance of connecting technical features to customer needs, but their starting point is still technology-first rather than customer-first. Their competitive analysis approach seems mechanical rather than insightful, focusing on feature matrices without demonstrating deep customer empathy. I'm increasingly skeptical about their readiness for a strategic product role.",35,"This candidate is technically skilled but demonstrates a relatively immature approach to product management fundamentals. They can create feature matrices and use basic frameworks like SWOT, but their thinking starts with technology rather than customer problems. They acknowledge this limitation, which shows self-awareness, but haven't demonstrated they've overcome it. Their competitive analysis approach is tactical and feature-oriented rather than strategic. I don't see evidence of true customer empathy or business thinking that goes beyond mapping features to obvious use cases. They seem to be a technically-minded PM who's still developing the strategic and customer-oriented mindset needed for more senior roles.","



Thanks for sharing your approach. I'm interested in how you think about market sizing. Can you walk me through how you would calculate the Total Addressable Market (TAM) for a new document processing product? What data sources would you use, and how would you validate your assumptions?","I'd be happy to explain my approach to market sizing for a document processing product.

For calculating TAM, I'd use a top-down and bottom-up approach simultaneously. Starting top-down, I'd look at industry reports from sources like Gartner, IDC, or Forrester that specifically cover document processing or broader enterprise content management markets. These typically provide overall market size and growth projections.

For the bottom-up approach, I'd segment potential customers by industry and company size, then estimate the average contract value based on our current pricing models. At DataMind, we found that financial services companies typically have 3-4x the document processing volume of other industries, so their contract values were significantly higher.

My calculation would look something like:
TAM = Number of target companies × Average contract value

For data sources, I'd use:
- Industry analyst reports
- Public financial data from competitors
- Our existing customer data as a baseline
- Government statistics on industry sizes

To validate assumptions, I'd check our calculations against public competitors' revenue when available. I'd also conduct a small sample of customer interviews to verify our pricing assumptions.

I will admit that when I first did this at TechVision, I relied too heavily on technical metrics like processing volume rather than business value, which led to some overestimation. I've since learned to be more conservative with assumptions and focus more on willingness to",0,"[{""interviewer_response"": ""Interviewer: \n\nThat's an impressive background in AI product management. Your technical expertise clearly shines through, and I appreciate your candor about growing in some business aspects. \n\nLet's talk about market positioning. If you were launching a new AI document processing feature, how would you approach positioning it in the market? Can you walk me through how you'd identify the target customer segment and develop unique value propositions?."", ""interviewee_response"": ""You answered: I appreciate that feedback on my background. Market positioning is definitely important.\n\nFor launching a new AI document processing feature, I'd approach it systematically. First, I'd analyze our existing data to understand which customers are currently using similar features most heavily. At DataMind, we've collected substantial usage metrics that help identify power users versus casual users.\n\nFor target customer segmentation, I'd look at industry verticals with high document processing needs - legal, financial services, healthcare, and insurance come to mind immediately. I'd analyze which segments have the highest potential ROI from automating document processing. My approach would be to prioritize segments where we have existing technical advantages.\n\nFor value propositions, I'd focus heavily on quantifiable metrics that demonstrate superiority - processing speed improvements, accuracy rates, and integration capabilities with existing systems. At TechVision, we found that technical differentiators like these were most compelling to customers when presented with clear benchmark data.\n\nI recognize that competitive positioning is also important, though I tend to focus more on our product's technical capabilities rather than broader market dynamics. I'd want to make sure we highlight any novel algorithms or approaches we're using that competitors don't have.\n\nHonestly, this is an area where I'm still developing my expertise. I understand the theoretical frameworks for market positioning, but I'm still working on building more intuition for the business side of product decisions beyond the technical advantages..""}, {""interviewer_response"": ""Interviewer: \n\nI appreciate your honesty about where you're developing. Let's build on this with a related question about competitive analysis. When launching that document processing feature, how would you approach understanding the competitive landscape? What frameworks or methods would you use to differentiate your offering, and how do you balance technical differentiation with solving customer problems?."", ""interviewee_response"": ""You answered: Thanks for the question, I think competitive analysis is crucial for any product launch.\n\nFor understanding the competitive landscape, I'd start by creating a comprehensive feature matrix comparing our document processing capabilities against key competitors. At DataMind, I developed a systematic approach where we identified the top 5-7 competitors and broke down their offerings into specific capabilities, pricing models, and technical specifications.\n\nI typically use a combination of SWOT analysis and the Four Actions Framework (from Blue Ocean Strategy) to identify differentiation opportunities. The technical differentiation is straightforward for me - I can quickly pinpoint where our algorithms have advantages in accuracy, processing speed, or handling edge cases. At TechVision, we found our computer vision models were 15% more accurate than competitors with distorted images, which became a key selling point.\n\nThe challenge I sometimes face is balancing technical superiority with actual customer problems. I've learned that customers don't always care about the most advanced technology if it doesn't solve their specific pain points. I try to map technical capabilities to customer outcomes, though I admit I sometimes get too excited about technical innovations without fully validating their market value first.\n\nFor differentiation strategy, I'd prioritize areas where we have both technical advantage and alignment with customer needs. For example, if our algorithm is particularly good at extracting data from unstructured documents, I'd focus on industries where that pain point is most acute, like insurance claims processing..""}, {""interviewer_response"": ""Interviewer: \n\n\n\nThanks for sharing your approach. I'm interested in how you think about market sizing. Can you walk me through how you would calculate the Total Addressable Market (TAM) for a new document processing product? What data sources would you use, and how would you validate your assumptions?."", ""interviewee_response"": ""You answered: I'd be happy to explain my approach to market sizing for a document processing product.\n\nFor calculating TAM, I'd use a top-down and bottom-up approach simultaneously. Starting top-down, I'd look at industry reports from sources like Gartner, IDC, or Forrester that specifically cover document processing or broader enterprise content management markets. These typically provide overall market size and growth projections.\n\nFor the bottom-up approach, I'd segment potential customers by industry and company size, then estimate the average contract value based on our current pricing models. At DataMind, we found that financial services companies typically have 3-4x the document processing volume of other industries, so their contract values were significantly higher.\n\nMy calculation would look something like:\nTAM = Number of target companies \u00d7 Average contract value\n\nFor data sources, I'd use:\n- Industry analyst reports\n- Public financial data from competitors\n- Our existing customer data as a baseline\n- Government statistics on industry sizes\n\nTo validate assumptions, I'd check our calculations against public competitors' revenue when available. I'd also conduct a small sample of customer interviews to verify our pricing assumptions.\n\nI will admit that when I first did this at TechVision, I relied too heavily on technical metrics like processing volume rather than business value, which led to some overestimation. I've since learned to be more conservative with assumptions and focus more on willingness to.""}]"
