interviewer_emotions,interviewer_emotion_score,interviewer_thoughts,interviewer_response,interviewee_response,reward,conversation_history
"I'm feeling more positive but still cautious. This is the strongest answer the candidate has given, showing thoughtful navigation of technical and business trade-offs with a specific, credible example. They demonstrated self-awareness about their technical bias while showing growth in finding balanced solutions. However, this seems to be the exception rather than the rule in their approach, based on their previous answers, and they still started from a position of technical preference before considering business needs. I'm less skeptical but not fully convinced of their business acumen.",65,"This is the candidate's strongest response so far, showing actual product management skill in mediating between technical and business concerns. They provided a specific, believable example with clear trade-offs and a thoughtful resolution. They demonstrated self-awareness about their technical bias while showing ability to quantify options in business terms. However, this stands somewhat in contrast to their previous answers that showed a consistently technical-first mindset. This suggests they have the capacity to balance technical and business concerns when directly confronted with the conflict, but may not naturally think in terms of business value first. They appear to be a technically-oriented PM who is developing business skills but still defaults to technical thinking when not explicitly pushed to consider business priorities.","






That's a great example of balancing technical and business needs. Now let's discuss product launches. Can you walk me through your approach to pre-launch activities and the launch itself? What key metrics would you track before, during, and after launch? How do you ensure a successful go-to-market strategy?","I'm glad you appreciated that example. When it comes to product launches, I take a structured approach with clear phases.

For pre-launch activities, I focus heavily on technical readiness. At DataMind, I implemented a launch readiness checklist that included performance testing, QA validation, and documentation review. I also ensure we have robust monitoring systems in place to track performance metrics once we go live.

For the launch itself, I typically organize it into alpha, beta, and general availability phases. During alpha, we select technically-savvy customers who can provide detailed feedback on functionality. At TechVision, we identified 5-7 power users who helped us identify edge cases before wider release.

Key metrics I track include:
- Pre-launch: Test coverage, bug severity and count, performance benchmarks
- During launch: System performance, error rates, feature adoption rates
- Post-launch: User engagement, retention metrics, support ticket volume, and NPS

For go-to-market, I work closely with marketing on technical messaging. I'm particularly good at helping translate technical capabilities into digestible benefit statements. I create detailed product documentation and training materials for sales teams.

If I'm being honest, the customer feedback loop is an area where I'm still developing. I tend to rely more on quantitative metrics rather than qualitative user feedback.",40,"[{""interviewer_response"": ""Interviewer: \n\nThat's an impressive background in AI product management. Your technical expertise clearly shines through, and I appreciate your candor about growing in some business aspects. \n\nLet's talk about market positioning. If you were launching a new AI document processing feature, how would you approach positioning it in the market? Can you walk me through how you'd identify the target customer segment and develop unique value propositions?."", ""interviewee_response"": ""You answered: I appreciate that feedback on my background. Market positioning is definitely important.\n\nFor launching a new AI document processing feature, I'd approach it systematically. First, I'd analyze our existing data to understand which customers are currently using similar features most heavily. At DataMind, we've collected substantial usage metrics that help identify power users versus casual users.\n\nFor target customer segmentation, I'd look at industry verticals with high document processing needs - legal, financial services, healthcare, and insurance come to mind immediately. I'd analyze which segments have the highest potential ROI from automating document processing. My approach would be to prioritize segments where we have existing technical advantages.\n\nFor value propositions, I'd focus heavily on quantifiable metrics that demonstrate superiority - processing speed improvements, accuracy rates, and integration capabilities with existing systems. At TechVision, we found that technical differentiators like these were most compelling to customers when presented with clear benchmark data.\n\nI recognize that competitive positioning is also important, though I tend to focus more on our product's technical capabilities rather than broader market dynamics. I'd want to make sure we highlight any novel algorithms or approaches we're using that competitors don't have.\n\nHonestly, this is an area where I'm still developing my expertise. I understand the theoretical frameworks for market positioning, but I'm still working on building more intuition for the business side of product decisions beyond the technical advantages..""}, {""interviewer_response"": ""Interviewer: \n\nI appreciate your honesty about where you're developing. Let's build on this with a related question about competitive analysis. When launching that document processing feature, how would you approach understanding the competitive landscape? What frameworks or methods would you use to differentiate your offering, and how do you balance technical differentiation with solving customer problems?."", ""interviewee_response"": ""You answered: Thanks for the question, I think competitive analysis is crucial for any product launch.\n\nFor understanding the competitive landscape, I'd start by creating a comprehensive feature matrix comparing our document processing capabilities against key competitors. At DataMind, I developed a systematic approach where we identified the top 5-7 competitors and broke down their offerings into specific capabilities, pricing models, and technical specifications.\n\nI typically use a combination of SWOT analysis and the Four Actions Framework (from Blue Ocean Strategy) to identify differentiation opportunities. The technical differentiation is straightforward for me - I can quickly pinpoint where our algorithms have advantages in accuracy, processing speed, or handling edge cases. At TechVision, we found our computer vision models were 15% more accurate than competitors with distorted images, which became a key selling point.\n\nThe challenge I sometimes face is balancing technical superiority with actual customer problems. I've learned that customers don't always care about the most advanced technology if it doesn't solve their specific pain points. I try to map technical capabilities to customer outcomes, though I admit I sometimes get too excited about technical innovations without fully validating their market value first.\n\nFor differentiation strategy, I'd prioritize areas where we have both technical advantage and alignment with customer needs. For example, if our algorithm is particularly good at extracting data from unstructured documents, I'd focus on industries where that pain point is most acute, like insurance claims processing..""}, {""interviewer_response"": ""Interviewer: \n\n\n\nThanks for sharing your approach. I'm interested in how you think about market sizing. Can you walk me through how you would calculate the Total Addressable Market (TAM) for a new document processing product? What data sources would you use, and how would you validate your assumptions?."", ""interviewee_response"": ""You answered: I'd be happy to explain my approach to market sizing for a document processing product.\n\nFor calculating TAM, I'd use a top-down and bottom-up approach simultaneously. Starting top-down, I'd look at industry reports from sources like Gartner, IDC, or Forrester that specifically cover document processing or broader enterprise content management markets. These typically provide overall market size and growth projections.\n\nFor the bottom-up approach, I'd segment potential customers by industry and company size, then estimate the average contract value based on our current pricing models. At DataMind, we found that financial services companies typically have 3-4x the document processing volume of other industries, so their contract values were significantly higher.\n\nMy calculation would look something like:\nTAM = Number of target companies \u00d7 Average contract value\n\nFor data sources, I'd use:\n- Industry analyst reports\n- Public financial data from competitors\n- Our existing customer data as a baseline\n- Government statistics on industry sizes\n\nTo validate assumptions, I'd check our calculations against public competitors' revenue when available. I'd also conduct a small sample of customer interviews to verify our pricing assumptions.\n\nI will admit that when I first did this at TechVision, I relied too heavily on technical metrics like processing volume rather than business value, which led to some overestimation. I've since learned to be more conservative with assumptions and focus more on willingness to.""}, {""interviewer_response"": ""Interviewer: \n\n\n\nIt looks like your response got cut off at the end. You were mentioning something about willingness to pay, which is actually an important factor. Let's move on to another key area of product management - documentation and requirements. Could you walk me through your approach to creating MRDs (Market Requirements Documents) and PRDs (Product Requirements Documents)? How do you ensure alignment between customer needs, business goals, and technical feasibility?."", ""interviewee_response"": ""You answered: I appreciate the question about documentation and requirements.\n\nFor MRDs and PRDs, I've developed a fairly structured approach. When creating an MRD, I focus on capturing market needs, customer segments, and competitive analysis. My MRDs typically include quantifiable metrics we're targeting - for instance, at DataMind, I specified that our document classification feature needed to achieve at least 85% accuracy to be competitive, based on thorough technical benchmarking.\n\nFor PRDs, I'm quite detailed and technical. I break down features into clear functional requirements with acceptance criteria that are measurable. I include technical specifications, API requirements, and data models where relevant. Engineers have complimented my PRDs for being comprehensive and leaving little room for ambiguity. At TechVision, my PRD template included sections for integration points, error handling, and performance expectations.\n\nTo ensure alignment between customer needs and business goals, I try to map each requirement back to specific customer pain points and business objectives. I use a traceability matrix to connect customer feedback to features and then to business KPIs. \n\nWhere I think I could improve is in the prioritization process. I tend to prioritize technical elegance and completeness, which sometimes leads to scope expansion. I've been working on being more disciplined about feature prioritization using frameworks like RICE scoring, though I still find myself advocating strongly for technical excellence..""}, {""interviewer_response"": ""Interviewer: \n\n\n\n\nThanks for sharing your documentation approach. Let's talk about your relationship with engineering teams. How do you collaborate with engineers throughout the product development lifecycle? Can you give me an example of a challenging technical decision you had to navigate with an engineering team, and how you handled trade-offs between technical excellence and business priorities?."", ""interviewee_response"": ""You answered: I value my relationship with engineering teams tremendously. My technical background has been a huge advantage here - I can speak their language and understand technical constraints, which builds credibility.\n\nMy collaboration approach varies by development stage. During planning, I involve senior engineers early to validate technical feasibility. During development, I hold bi-weekly sync meetings and participate in technical discussions. At DataMind, I implemented a \""technical office hours\"" where engineers could discuss implementation challenges directly with me.\n\nA challenging example was at DataMind when implementing our document classification feature. The engineering team wanted to use a newer, more elegant transformer architecture that would take 3 additional months to implement. The business team was pushing for a faster release using our existing models with incremental improvements.\n\nI navigated this by first quantifying both options - the elegant solution would provide approximately 12% better accuracy but delay revenue by a quarter. I arranged a workshop where engineering could present their technical vision and business could share market timing concerns. \n\nWe ultimately compromised by implementing a phased approach - we launched with the enhanced existing model on the original timeline, but allocated resources to develop the advanced architecture in parallel for a \""V2\"" release three months later. This satisfied the technical team's desire for excellence while meeting immediate business needs.\n\nI'll admit I was initially biased toward the more elegant technical solution, but I've learned that finding these balanced approaches often leads to better outcomes than simply choosing one side.""}, {""interviewer_response"": ""Interviewer: \n\n\n\n\n\n\nThat's a great example of balancing technical and business needs. Now let's discuss product launches. Can you walk me through your approach to pre-launch activities and the launch itself? What key metrics would you track before, during, and after launch? How do you ensure a successful go-to-market strategy?."", ""interviewee_response"": ""You answered: I'm glad you appreciated that example. When it comes to product launches, I take a structured approach with clear phases.\n\nFor pre-launch activities, I focus heavily on technical readiness. At DataMind, I implemented a launch readiness checklist that included performance testing, QA validation, and documentation review. I also ensure we have robust monitoring systems in place to track performance metrics once we go live.\n\nFor the launch itself, I typically organize it into alpha, beta, and general availability phases. During alpha, we select technically-savvy customers who can provide detailed feedback on functionality. At TechVision, we identified 5-7 power users who helped us identify edge cases before wider release.\n\nKey metrics I track include:\n- Pre-launch: Test coverage, bug severity and count, performance benchmarks\n- During launch: System performance, error rates, feature adoption rates\n- Post-launch: User engagement, retention metrics, support ticket volume, and NPS\n\nFor go-to-market, I work closely with marketing on technical messaging. I'm particularly good at helping translate technical capabilities into digestible benefit statements. I create detailed product documentation and training materials for sales teams.\n\nIf I'm being honest, the customer feedback loop is an area where I'm still developing. I tend to rely more on quantitative metrics rather than qualitative user feedback..""}]"
