interviewer_emotions,interviewer_emotion_score,interviewer_thoughts,interviewer_response,interviewee_response,reward,conversation_history
,50,,"Hello there! Thanks for joining us today. I'm looking forward to discussing your product management experience. I'll be asking you questions about various aspects of the product lifecycle to get a better understanding of your approach and expertise.

Let's start with market positioning. Can you tell me about a product you worked on and how you positioned it in the market? What was your approach to identifying the target audience and differentiating from competitors?","Hi, thanks for having me today. I'm excited to discuss my product management experience with you.

At my most recent role at TechMind AI, I led the development of an AI-powered data analytics platform targeted at mid-sized businesses. For market positioning, I conducted a thorough analysis of existing solutions and identified that while enterprise-level solutions were feature-rich but expensive and complex, and small business solutions were too simplistic, there was a gap for mid-market companies needing sophisticated analytics without the enterprise complexity.

I defined our target audience as mid-sized companies with revenue between $10-100M that had growing data needs but limited technical resources. My approach involved analyzing market research reports, reviewing competitor pricing models, and creating detailed feature comparison matrices that objectively showed where our solution could win.

For differentiation, I focused on three key areas: simplified implementation (under 2 weeks versus competitors' 2-3 months), pre-built industry templates, and cost efficiency (40% lower TCO than enterprise solutions). I developed clear messaging around these value propositions and worked with marketing to execute this positioning.

The results were solid - we achieved 85% of our first-year customer acquisition targets and our positioning resonated well with the target segment based on the conversion metrics from our marketing campaigns. I think the technical rigor I brought to the competitive analysis was particularly effective.",0,[]
I'm feeling engaged and impressed by this candidate's thorough response. Their structured approach to market positioning shows strong analytical thinking and strategic mindset. I appreciate the specific metrics they shared about implementation time and cost efficiency. They've demonstrated clear understanding of product positioning fundamentals with concrete examples. I'm now curious and optimistic to hear more about their other product management experiences.,85,"This candidate articulates market positioning strategy quite well. They've provided specific details about target segmentation ($10-100M companies), clear differentiation points, and quantifiable outcomes (85% of targets, 40% lower TCO). They understand the methodical approach to positioning with competitive analysis and feature comparison matrices. Their answer demonstrates strategic thinking and business acumen. They come across as experienced and data-driven in their decision-making process. So far, they seem strong in the go-to-market aspect of product management.","

That's excellent! I appreciate the specificity in your approach to market positioning. You clearly identified a gap in the market and created a focused value proposition around it. 

Let's dig deeper into the competitive analysis aspect. Can you walk me through your process for analyzing competitors? How did you translate those insights into product decisions, and were there any unexpected competitive moves you had to respond to?","I appreciate that feedback on my market positioning approach.

For competitive analysis, I implemented a structured process at TechMind AI. I started by identifying our direct and indirect competitors through market research and customer interviews. Then I created a comprehensive competitive matrix tracking roughly 30 key features, pricing models, technical requirements, and customer satisfaction metrics.

The technical analysis was particularly thorough - I personally tested competing products where possible and documented UX flows, performance benchmarks, and integration capabilities. We also analyzed competitors' API documentation to understand their technical limitations.

These insights directly informed our product roadmap. For example, when I discovered that competitors struggled with processing unstructured data, we prioritized developing superior NLP capabilities. We also identified that competitors required significant professional services for implementation, so we built a self-service onboarding flow that became a key differentiator.

Regarding unexpected competitive moves, one major competitor suddenly dropped their pricing by 30% shortly after our launch. This was challenging since we had positioned ourselves partly on cost efficiency. Rather than matching their price cut, I analyzed usage patterns and identified that customers were primarily using a subset of features. I quickly pivoted our strategy to offer a more modular pricing structure where customers only paid for what they needed, which ultimately retained our value proposition.

In retrospect, I could have built stronger relationships with industry analysts to anticipate competitive moves better, but the data-driven approach to competitive analysis proved effective.",35,"[{""interviewer_response"": ""Interviewer: \n\nThat's excellent! I appreciate the specificity in your approach to market positioning. You clearly identified a gap in the market and created a focused value proposition around it. \n\nLet's dig deeper into the competitive analysis aspect. Can you walk me through your process for analyzing competitors? How did you translate those insights into product decisions, and were there any unexpected competitive moves you had to respond to?."", ""interviewee_response"": ""You answered: I appreciate that feedback on my market positioning approach.\n\nFor competitive analysis, I implemented a structured process at TechMind AI. I started by identifying our direct and indirect competitors through market research and customer interviews. Then I created a comprehensive competitive matrix tracking roughly 30 key features, pricing models, technical requirements, and customer satisfaction metrics.\n\nThe technical analysis was particularly thorough - I personally tested competing products where possible and documented UX flows, performance benchmarks, and integration capabilities. We also analyzed competitors' API documentation to understand their technical limitations.\n\nThese insights directly informed our product roadmap. For example, when I discovered that competitors struggled with processing unstructured data, we prioritized developing superior NLP capabilities. We also identified that competitors required significant professional services for implementation, so we built a self-service onboarding flow that became a key differentiator.\n\nRegarding unexpected competitive moves, one major competitor suddenly dropped their pricing by 30% shortly after our launch. This was challenging since we had positioned ourselves partly on cost efficiency. Rather than matching their price cut, I analyzed usage patterns and identified that customers were primarily using a subset of features. I quickly pivoted our strategy to offer a more modular pricing structure where customers only paid for what they needed, which ultimately retained our value proposition.\n\nIn retrospect, I could have built stronger relationships with industry analysts to anticipate competitive moves better, but the data-driven approach to competitive analysis proved effective..""}]"
"I'm increasingly impressed with this candidate. Their competitive analysis approach shows both depth and systematic thinking. I appreciate how they personally tested competing products - that demonstrates hands-on commitment. Their example of pivoting the pricing strategy in response to a competitor's price cut shows adaptability and strategic thinking. Instead of just reacting, they found a creative solution through data analysis. I'm feeling very positive about their product management capabilities and curious to explore more dimensions of their experience.",85,"This candidate shows strong competitive intelligence skills with a robust, data-driven approach. They're detail-oriented (tracking 30 features), hands-on (personally testing products), and technically astute (analyzing APIs). Their response to the competitive price drop demonstrates good business judgment - pivoting to modular pricing rather than simply matching the cut shows strategic thinking and value-orientation. They connected competitive insights directly to product decisions (prioritizing NLP capabilities, building self-service onboarding). I also appreciate their self-awareness in acknowledging what they could have done better with analyst relationships. So far, this candidate appears to be a strong, experienced product manager with both strategic and tactical capabilities.","

That's a fantastic example of how to turn competitive analysis into actionable product decisions. I particularly like how you responded to the price drop with a more strategic approach rather than just matching it.

Let's talk about Total Addressable Market. Could you explain your methodology for calculating TAM for a new product, and how you used TAM insights to guide product strategy? Perhaps you could use the AI analytics platform as an example or another product you've worked on.","I'm glad you found my competitive analysis approach valuable.

For calculating TAM for our AI analytics platform at TechMind, I used a multi-faceted approach. First, I analyzed industry reports from Gartner and Forrester to establish the overall analytics market size, which was approximately $25 billion. Then I narrowed down to our specific segment by filtering for mid-sized businesses using company databases and determining what percentage of the total market they represented.

I calculated our serviceable addressable market (SAM) by identifying which industries within the mid-market had the highest data analysis needs and technical readiness. This gave us a SAM of approximately $3.2 billion. Finally, I determined our serviceable obtainable market (SOM) based on our go-to-market capabilities and geographical focus for the first two years.

These TAM insights directly guided our product strategy in several ways. For instance, when the data showed that manufacturing and healthcare segments represented 40% of our potential market, we prioritized building industry-specific templates and data connectors for these verticals. I also used TAM data to quantify revenue potential for different feature sets, which helped rationalize our roadmap.

The analysis showed that mid-sized companies across industries were rapidly increasing their data science budgets but struggling with implementation, which validated our core value proposition.",0,"[{""interviewer_response"": ""Interviewer: \n\nThat's excellent! I appreciate the specificity in your approach to market positioning. You clearly identified a gap in the market and created a focused value proposition around it. \n\nLet's dig deeper into the competitive analysis aspect. Can you walk me through your process for analyzing competitors? How did you translate those insights into product decisions, and were there any unexpected competitive moves you had to respond to?."", ""interviewee_response"": ""You answered: I appreciate that feedback on my market positioning approach.\n\nFor competitive analysis, I implemented a structured process at TechMind AI. I started by identifying our direct and indirect competitors through market research and customer interviews. Then I created a comprehensive competitive matrix tracking roughly 30 key features, pricing models, technical requirements, and customer satisfaction metrics.\n\nThe technical analysis was particularly thorough - I personally tested competing products where possible and documented UX flows, performance benchmarks, and integration capabilities. We also analyzed competitors' API documentation to understand their technical limitations.\n\nThese insights directly informed our product roadmap. For example, when I discovered that competitors struggled with processing unstructured data, we prioritized developing superior NLP capabilities. We also identified that competitors required significant professional services for implementation, so we built a self-service onboarding flow that became a key differentiator.\n\nRegarding unexpected competitive moves, one major competitor suddenly dropped their pricing by 30% shortly after our launch. This was challenging since we had positioned ourselves partly on cost efficiency. Rather than matching their price cut, I analyzed usage patterns and identified that customers were primarily using a subset of features. I quickly pivoted our strategy to offer a more modular pricing structure where customers only paid for what they needed, which ultimately retained our value proposition.\n\nIn retrospect, I could have built stronger relationships with industry analysts to anticipate competitive moves better, but the data-driven approach to competitive analysis proved effective..""}, {""interviewer_response"": ""Interviewer: \n\nThat's a fantastic example of how to turn competitive analysis into actionable product decisions. I particularly like how you responded to the price drop with a more strategic approach rather than just matching it.\n\nLet's talk about Total Addressable Market. Could you explain your methodology for calculating TAM for a new product, and how you used TAM insights to guide product strategy? Perhaps you could use the AI analytics platform as an example or another product you've worked on.."", ""interviewee_response"": ""You answered: I'm glad you found my competitive analysis approach valuable.\n\nFor calculating TAM for our AI analytics platform at TechMind, I used a multi-faceted approach. First, I analyzed industry reports from Gartner and Forrester to establish the overall analytics market size, which was approximately $25 billion. Then I narrowed down to our specific segment by filtering for mid-sized businesses using company databases and determining what percentage of the total market they represented.\n\nI calculated our serviceable addressable market (SAM) by identifying which industries within the mid-market had the highest data analysis needs and technical readiness. This gave us a SAM of approximately $3.2 billion. Finally, I determined our serviceable obtainable market (SOM) based on our go-to-market capabilities and geographical focus for the first two years.\n\nThese TAM insights directly guided our product strategy in several ways. For instance, when the data showed that manufacturing and healthcare segments represented 40% of our potential market, we prioritized building industry-specific templates and data connectors for these verticals. I also used TAM data to quantify revenue potential for different feature sets, which helped rationalize our roadmap.\n\nThe analysis showed that mid-sized companies across industries were rapidly increasing their data science budgets but struggling with implementation, which validated our core value proposition..""}]"
"I'm feeling very positive about this candidate. Their methodical approach to TAM analysis shows strong business acumen and strategic thinking. I appreciate how they broke down the market from broad TAM to specific SOM with actual figures, and then used these insights to drive practical product decisions. Their understanding of how to connect market analysis to feature prioritization demonstrates the kind of data-driven product leadership we need. I'm increasingly confident that this candidate has the right mix of analytical skills and strategic vision for the role.",85,"This candidate demonstrates a thorough understanding of market sizing methodologies, properly distinguishing between TAM, SAM, and SOM with specific numbers ($25B total market, $3.2B SAM). They show how market analysis directly influenced product decisions by prioritizing features for high-value segments (manufacturing and healthcare at 40%). Their approach is systematic and quantitative, using market data to validate their value proposition and rationalize the roadmap. This answer reinforces their strategic capabilities and business orientation. They continue to provide specific examples with concrete numbers, showing both theoretical understanding and practical application of product management principles.","

Excellent breakdown of the TAM calculation process. I appreciate how you moved from the broad market to specific addressable segments with clear figures and then used those insights to drive concrete product decisions.

Now, let's discuss the product documentation process. Could you explain your approach to creating Market Requirements Documents (MRDs) and Product Requirements Documents (PRDs)? What information do you include in each, and how do you ensure they effectively guide the development team while addressing market needs?","I believe documentation is critical to effective product development. For our AI analytics platform at TechMind, I developed a structured approach to both MRDs and PRDs.

For Market Requirements Documents, I focused on capturing the ""why"" behind the product. I typically included market analysis data, competitive landscape, customer pain points with supporting evidence from user research, and clear articulation of the market opportunity in terms of potential revenue and strategic value. I also outlined success metrics and KPIs that would indicate market fit. 

For Product Requirements Documents, I translated those market needs into specific technical requirements. My PRDs included detailed feature specifications, user stories, technical constraints, UI/UX requirements, and acceptance criteria. I used a prioritization framework that weighted features based on development effort versus market impact to guide implementation sequences.

To ensure effectiveness, I maintained a consistent template with mandatory sections and utilized JIRA to link PRD items directly to development tasks. I held dedicated requirements review sessions with engineering teams to address questions and clarify technical details.

One challenge I encountered was keeping technical specifications aligned with the business goals. To address this, I implemented requirement traceability matrices that mapped each feature back to specific market needs and business objectives.

While my approach was technically thorough, I recognize that sometimes I could focus too much on specifications and feature details rather than fostering true understanding of user needs across the team.",0,"[{""interviewer_response"": ""Interviewer: \n\nThat's excellent! I appreciate the specificity in your approach to market positioning. You clearly identified a gap in the market and created a focused value proposition around it. \n\nLet's dig deeper into the competitive analysis aspect. Can you walk me through your process for analyzing competitors? How did you translate those insights into product decisions, and were there any unexpected competitive moves you had to respond to?."", ""interviewee_response"": ""You answered: I appreciate that feedback on my market positioning approach.\n\nFor competitive analysis, I implemented a structured process at TechMind AI. I started by identifying our direct and indirect competitors through market research and customer interviews. Then I created a comprehensive competitive matrix tracking roughly 30 key features, pricing models, technical requirements, and customer satisfaction metrics.\n\nThe technical analysis was particularly thorough - I personally tested competing products where possible and documented UX flows, performance benchmarks, and integration capabilities. We also analyzed competitors' API documentation to understand their technical limitations.\n\nThese insights directly informed our product roadmap. For example, when I discovered that competitors struggled with processing unstructured data, we prioritized developing superior NLP capabilities. We also identified that competitors required significant professional services for implementation, so we built a self-service onboarding flow that became a key differentiator.\n\nRegarding unexpected competitive moves, one major competitor suddenly dropped their pricing by 30% shortly after our launch. This was challenging since we had positioned ourselves partly on cost efficiency. Rather than matching their price cut, I analyzed usage patterns and identified that customers were primarily using a subset of features. I quickly pivoted our strategy to offer a more modular pricing structure where customers only paid for what they needed, which ultimately retained our value proposition.\n\nIn retrospect, I could have built stronger relationships with industry analysts to anticipate competitive moves better, but the data-driven approach to competitive analysis proved effective..""}, {""interviewer_response"": ""Interviewer: \n\nThat's a fantastic example of how to turn competitive analysis into actionable product decisions. I particularly like how you responded to the price drop with a more strategic approach rather than just matching it.\n\nLet's talk about Total Addressable Market. Could you explain your methodology for calculating TAM for a new product, and how you used TAM insights to guide product strategy? Perhaps you could use the AI analytics platform as an example or another product you've worked on.."", ""interviewee_response"": ""You answered: I'm glad you found my competitive analysis approach valuable.\n\nFor calculating TAM for our AI analytics platform at TechMind, I used a multi-faceted approach. First, I analyzed industry reports from Gartner and Forrester to establish the overall analytics market size, which was approximately $25 billion. Then I narrowed down to our specific segment by filtering for mid-sized businesses using company databases and determining what percentage of the total market they represented.\n\nI calculated our serviceable addressable market (SAM) by identifying which industries within the mid-market had the highest data analysis needs and technical readiness. This gave us a SAM of approximately $3.2 billion. Finally, I determined our serviceable obtainable market (SOM) based on our go-to-market capabilities and geographical focus for the first two years.\n\nThese TAM insights directly guided our product strategy in several ways. For instance, when the data showed that manufacturing and healthcare segments represented 40% of our potential market, we prioritized building industry-specific templates and data connectors for these verticals. I also used TAM data to quantify revenue potential for different feature sets, which helped rationalize our roadmap.\n\nThe analysis showed that mid-sized companies across industries were rapidly increasing their data science budgets but struggling with implementation, which validated our core value proposition..""}, {""interviewer_response"": ""Interviewer: \n\nExcellent breakdown of the TAM calculation process. I appreciate how you moved from the broad market to specific addressable segments with clear figures and then used those insights to drive concrete product decisions.\n\nNow, let's discuss the product documentation process. Could you explain your approach to creating Market Requirements Documents (MRDs) and Product Requirements Documents (PRDs)? What information do you include in each, and how do you ensure they effectively guide the development team while addressing market needs?."", ""interviewee_response"": ""You answered: I believe documentation is critical to effective product development. For our AI analytics platform at TechMind, I developed a structured approach to both MRDs and PRDs.\n\nFor Market Requirements Documents, I focused on capturing the \""why\"" behind the product. I typically included market analysis data, competitive landscape, customer pain points with supporting evidence from user research, and clear articulation of the market opportunity in terms of potential revenue and strategic value. I also outlined success metrics and KPIs that would indicate market fit. \n\nFor Product Requirements Documents, I translated those market needs into specific technical requirements. My PRDs included detailed feature specifications, user stories, technical constraints, UI/UX requirements, and acceptance criteria. I used a prioritization framework that weighted features based on development effort versus market impact to guide implementation sequences.\n\nTo ensure effectiveness, I maintained a consistent template with mandatory sections and utilized JIRA to link PRD items directly to development tasks. I held dedicated requirements review sessions with engineering teams to address questions and clarify technical details.\n\nOne challenge I encountered was keeping technical specifications aligned with the business goals. To address this, I implemented requirement traceability matrices that mapped each feature back to specific market needs and business objectives.\n\nWhile my approach was technically thorough, I recognize that sometimes I could focus too much on specifications and feature details rather than fostering true understanding of user needs across the team..""}]"
