interviewer_emotions,interviewer_emotion_score,interviewer_thoughts,interviewer_response,interviewee_response,reward,conversation_history
"I'm continuing to feel very positive about this candidate. Their approach to product maintenance and end-of-life decisions demonstrates the same methodical, data-driven thinking I've seen throughout the interview. I appreciate their systematic quarterly health assessment and clear categorization of maintenance activities. Their example about the dashboard optimization shows good judgment in prioritization. Their self-awareness about needing to improve customer communications during deprecations shows maturity. Overall, I feel confident this candidate has the technical understanding, analytical skills, and strategic thinking needed for effective product management across the entire lifecycle.",85,"This candidate demonstrates a mature understanding of product lifecycle management. Their approach to maintenance is methodical and data-driven, with clear metrics (usage, tickets, costs, revenue) and a sensible categorization system. The dashboard optimization example shows good technical judgment and ROI thinking. For deprecations, they consider appropriate factors and have experience with the complete process. Their awareness of needing to improve customer-centric communications shows self-reflection. Throughout the entire interview, they've demonstrated strong analytical capabilities, strategic thinking, and hands-on product management experience. They consistently provide specific examples with metrics and outcomes, suggesting real expertise rather than theoretical knowledge. Their technical background appears to be a strength, particularly in working with engineering teams. Overall, they present as a well-rounded, experienced product manager with particularly strong capabilities in market analysis, competitive positioning, and data-driven decision making.","



Thank you for sharing your approach to product maintenance and end-of-life decisions. Your quarterly health assessment framework and clear categorization of maintenance activities demonstrate a thoughtful, systematic approach to managing products throughout their lifecycle.

We've covered quite a bit today - from market positioning and competitive analysis to TAM calculations, documentation, engineering collaboration, product launches, and maintenance/EOL strategies. I've been impressed with your structured thinking and data-driven approach across all these areas.

Do you have any questions for me about the role or our company?","I'm glad my product maintenance approach resonated with you.

Yes, I do have a few questions about the role. First, I'm interested in understanding what specific technical challenges your product team is currently facing and how you're approaching them. I find that diving into technical complexities is where I can add the most immediate value.

Second, what's the composition of the product team I'd be joining? I'm particularly interested in the ratio of technical to business-focused team members and how responsibilities are divided.

Finally, I'd like to understand your product development methodology - are you using Agile, and if so, how strictly is it implemented? In my experience, having a well-defined process with clear technical specifications leads to more efficient development cycles.

I appreciate the comprehensive interview today. The range of topics we've covered aligns well with my experience in building data-driven products with strong technical fundamentals.",0,"[{""interviewer_response"": ""Interviewer: \n\nThat's excellent! I appreciate the specificity in your approach to market positioning. You clearly identified a gap in the market and created a focused value proposition around it. \n\nLet's dig deeper into the competitive analysis aspect. Can you walk me through your process for analyzing competitors? How did you translate those insights into product decisions, and were there any unexpected competitive moves you had to respond to?."", ""interviewee_response"": ""You answered: I appreciate that feedback on my market positioning approach.\n\nFor competitive analysis, I implemented a structured process at TechMind AI. I started by identifying our direct and indirect competitors through market research and customer interviews. Then I created a comprehensive competitive matrix tracking roughly 30 key features, pricing models, technical requirements, and customer satisfaction metrics.\n\nThe technical analysis was particularly thorough - I personally tested competing products where possible and documented UX flows, performance benchmarks, and integration capabilities. We also analyzed competitors' API documentation to understand their technical limitations.\n\nThese insights directly informed our product roadmap. For example, when I discovered that competitors struggled with processing unstructured data, we prioritized developing superior NLP capabilities. We also identified that competitors required significant professional services for implementation, so we built a self-service onboarding flow that became a key differentiator.\n\nRegarding unexpected competitive moves, one major competitor suddenly dropped their pricing by 30% shortly after our launch. This was challenging since we had positioned ourselves partly on cost efficiency. Rather than matching their price cut, I analyzed usage patterns and identified that customers were primarily using a subset of features. I quickly pivoted our strategy to offer a more modular pricing structure where customers only paid for what they needed, which ultimately retained our value proposition.\n\nIn retrospect, I could have built stronger relationships with industry analysts to anticipate competitive moves better, but the data-driven approach to competitive analysis proved effective..""}, {""interviewer_response"": ""Interviewer: \n\nThat's a fantastic example of how to turn competitive analysis into actionable product decisions. I particularly like how you responded to the price drop with a more strategic approach rather than just matching it.\n\nLet's talk about Total Addressable Market. Could you explain your methodology for calculating TAM for a new product, and how you used TAM insights to guide product strategy? Perhaps you could use the AI analytics platform as an example or another product you've worked on.."", ""interviewee_response"": ""You answered: I'm glad you found my competitive analysis approach valuable.\n\nFor calculating TAM for our AI analytics platform at TechMind, I used a multi-faceted approach. First, I analyzed industry reports from Gartner and Forrester to establish the overall analytics market size, which was approximately $25 billion. Then I narrowed down to our specific segment by filtering for mid-sized businesses using company databases and determining what percentage of the total market they represented.\n\nI calculated our serviceable addressable market (SAM) by identifying which industries within the mid-market had the highest data analysis needs and technical readiness. This gave us a SAM of approximately $3.2 billion. Finally, I determined our serviceable obtainable market (SOM) based on our go-to-market capabilities and geographical focus for the first two years.\n\nThese TAM insights directly guided our product strategy in several ways. For instance, when the data showed that manufacturing and healthcare segments represented 40% of our potential market, we prioritized building industry-specific templates and data connectors for these verticals. I also used TAM data to quantify revenue potential for different feature sets, which helped rationalize our roadmap.\n\nThe analysis showed that mid-sized companies across industries were rapidly increasing their data science budgets but struggling with implementation, which validated our core value proposition..""}, {""interviewer_response"": ""Interviewer: \n\nExcellent breakdown of the TAM calculation process. I appreciate how you moved from the broad market to specific addressable segments with clear figures and then used those insights to drive concrete product decisions.\n\nNow, let's discuss the product documentation process. Could you explain your approach to creating Market Requirements Documents (MRDs) and Product Requirements Documents (PRDs)? What information do you include in each, and how do you ensure they effectively guide the development team while addressing market needs?."", ""interviewee_response"": ""You answered: I believe documentation is critical to effective product development. For our AI analytics platform at TechMind, I developed a structured approach to both MRDs and PRDs.\n\nFor Market Requirements Documents, I focused on capturing the \""why\"" behind the product. I typically included market analysis data, competitive landscape, customer pain points with supporting evidence from user research, and clear articulation of the market opportunity in terms of potential revenue and strategic value. I also outlined success metrics and KPIs that would indicate market fit. \n\nFor Product Requirements Documents, I translated those market needs into specific technical requirements. My PRDs included detailed feature specifications, user stories, technical constraints, UI/UX requirements, and acceptance criteria. I used a prioritization framework that weighted features based on development effort versus market impact to guide implementation sequences.\n\nTo ensure effectiveness, I maintained a consistent template with mandatory sections and utilized JIRA to link PRD items directly to development tasks. I held dedicated requirements review sessions with engineering teams to address questions and clarify technical details.\n\nOne challenge I encountered was keeping technical specifications aligned with the business goals. To address this, I implemented requirement traceability matrices that mapped each feature back to specific market needs and business objectives.\n\nWhile my approach was technically thorough, I recognize that sometimes I could focus too much on specifications and feature details rather than fostering true understanding of user needs across the team..""}, {""interviewer_response"": ""Interviewer: \n\nThat's a clear explanation of your documentation approach. I like your emphasis on connecting features back to business objectives through traceability matrices.\n\nLet's shift to your relationship with engineering. How do you collaborate with engineering teams throughout the product development lifecycle? Can you share a specific example where you had to navigate technical constraints or make tradeoffs between features and timelines?."", ""interviewee_response"": ""You answered: Thanks for that feedback on my documentation process.\n\nWhen it comes to collaborating with engineering teams, I maintain a structured yet flexible approach throughout the development lifecycle. At TechMind, I established regular touchpoints including weekly sprint planning, bi-weekly technical deep dives, and daily standups when we approached critical milestones.\n\nA specific example that comes to mind was during the development of our natural language processing feature for unstructured data analysis. Our initial plan was to build a comprehensive NLP engine that could handle multiple languages and industry-specific terminology. However, about six weeks into development, our engineering lead informed me that the level of accuracy we wanted would require significantly more time and resources than originally estimated.\n\nI approached this challenge methodically. First, I gathered data on which specific NLP capabilities were most critical to our target customers by analyzing feature usage patterns from our beta users. Then I worked with engineering to break down the feature into modular components that could be released incrementally.\n\nWe ultimately decided to focus on English-language processing first with specialized terminology for our two key verticals (manufacturing and healthcare), while deferring support for additional languages. I created a revised PRD with clearly prioritized requirements and acceptance criteria, and we adjusted our go-to-market messaging accordingly.\n\nThis approach allowed us to launch on schedule with the most valuable subset of features..""}, {""interviewer_response"": ""Interviewer: \n\n\n\nThat's an excellent example of pragmatic decision-making when facing technical constraints. I like how you used actual usage data to prioritize the most valuable capabilities rather than simply guessing what users needed.\n\nLet's talk about product launches. Could you walk me through your approach to pre-launch activities and the launch itself? How do you prepare different stakeholders, and what metrics do you track to evaluate launch success?."", ""interviewee_response"": ""You answered: I appreciate that feedback.\n\nFor product launches, I implement a comprehensive, phased approach. At TechMind, for our AI analytics platform launch, I created a detailed launch plan covering three months of pre-launch activities.\n\nFirst, I develop a launch timeline with clear milestones and dependencies. I create a stakeholder matrix identifying all teams involved - engineering for final testing, marketing for campaign materials, sales for training, and customer support for documentation. Each team receives specific deliverables and deadlines.\n\nFor engineering preparation, I implement a code freeze two weeks before launch and coordinate a thorough QA process with documented test cases. My technical background allows me to effectively communicate with engineers about launch readiness.\n\nFor sales enablement, I develop competitive battlecards, pricing guides, and demo scripts. I typically conduct at least three training sessions with the sales team, including objection handling scenarios based on our competitive analysis.\n\nFor marketing coordination, I provide detailed product specifications, use cases, and technical differentiators to ensure messaging accuracy. While I focus heavily on ensuring technical accuracy in marketing materials, I sometimes struggle with translating technical features into emotionally compelling benefits.\n\nDuring launch, I track several metrics including: user activation rate, feature adoption, support ticket volume by category, sales pipeline growth, conversion rates, and technical performance metrics.\n\nAt our last launch, we achieved 92% of our activation targets within the first month..""}, {""interviewer_response"": ""Interviewer: \n\n\n\nThank you for that comprehensive overview of your launch process. Your structured approach with clear assignments for each stakeholder group is excellent.\n\nFor our final topic, let's discuss product maintenance and end-of-life planning. How do you approach product maintenance decisions, and what factors do you consider when determining that a product or feature should be deprecated or discontinued?."", ""interviewee_response"": ""You answered: Thank you for that question.\n\nFor product maintenance, I take a data-driven approach. At TechMind, I established a quarterly product health assessment that analyzed several key metrics: usage frequency, support ticket volume, maintenance costs, and revenue contribution. This systematic review helped prioritize maintenance efforts.\n\nI categorize maintenance activities into three buckets: critical fixes, performance improvements, and technical debt. For resource allocation, I developed a scoring matrix that weighted issues based on customer impact, system stability risk, and strategic alignment.\n\nFor example, when our analytics dashboard was experiencing performance degradation, I analyzed the data and determined that optimizing the data processing pipeline would deliver the highest ROI compared to other maintenance requests. By allocating engineering resources to this specific area, we improved dashboard load times by 40%.\n\nRegarding end-of-life decisions, I consider several factors: declining usage metrics, increasing maintenance costs, strategic fit, and competitive positioning. At my previous company, I led the deprecation of a feature that was being used by less than 5% of customers but consuming nearly 15% of our maintenance resources.\n\nMy approach to deprecation includes creating a clear timeline with adequate notice periods, developing migration paths for affected users, and providing documentation on alternatives. I also establish specific metrics to validate the deprecation decision.\n\nOne area I'm working to improve is balancing the technical rationale for deprecations with more customer-centric communications..""}, {""interviewer_response"": ""Interviewer: \n\n\n\nThank you for sharing your approach to product maintenance and end-of-life decisions. Your quarterly health assessment framework and clear categorization of maintenance activities demonstrate a thoughtful, systematic approach to managing products throughout their lifecycle.\n\nWe've covered quite a bit today - from market positioning and competitive analysis to TAM calculations, documentation, engineering collaboration, product launches, and maintenance/EOL strategies. I've been impressed with your structured thinking and data-driven approach across all these areas.\n\nDo you have any questions for me about the role or our company?."", ""interviewee_response"": ""You answered: I'm glad my product maintenance approach resonated with you.\n\nYes, I do have a few questions about the role. First, I'm interested in understanding what specific technical challenges your product team is currently facing and how you're approaching them. I find that diving into technical complexities is where I can add the most immediate value.\n\nSecond, what's the composition of the product team I'd be joining? I'm particularly interested in the ratio of technical to business-focused team members and how responsibilities are divided.\n\nFinally, I'd like to understand your product development methodology - are you using Agile, and if so, how strictly is it implemented? In my experience, having a well-defined process with clear technical specifications leads to more efficient development cycles.\n\nI appreciate the comprehensive interview today. The range of topics we've covered aligns well with my experience in building data-driven products with strong technical fundamentals..""}]"
